question,answer,A,B,C,D,Category,Human Accuracy
재봉틀 작업을 할때 잘못된 자세는?,3,재봉틀 테이블에서 15cm정도 떨어져 바르게 앉는다.,몸의 중심(코)과 바늘대가 일치하게 위치를 정한다.,어깨에 힘을 주고 상체를 똑바로 한다.,발판에 발의 위치를 엇비껴놓는다.,Fashion,0.6333
패턴 배치로 잘못된 것은?,2,체크무늬는 옆선의 무늬를 맞추어 배치한다.,패턴은 작은것부터 배치한다.,패턴은 옷감의 안쪽에 배치한다.,짧은 털이 있는 옷감은 털의 결 방향을 위로 배치한다.,Fashion,0.8065000000000001
10대 소녀들에게 많은 체형으로 항상 바른자세를 유지하는 이들에게서 볼 수 있으며 나이가 많은 사람도 이런 체형일 경우에는 보다 젊어진다.상체가 곧고 가슴이 높게 솟아 있으며 엉덩이는 풍만하고 배가 평편한 자세인 체형은?,4,후경체,굴신체,편평체,반신체,Fashion,0.7
재봉할 때 봉제 천에 비하여 바늘이 굵은 경우 일어나는 현상은?,4,땀뜀 현상이 일어난다.,천의 보내기 운동이 불량하다.,재봉틀의 노루발이 장애를 일으킨다.,천에 버커링이 발생한다.,Fashion,0.6296
직접원가에 제조간접비를 합친 것은?,1,제조원가,간접원가,판매원가,총원가,Fashion,0.68
섬유의 단면이 삼각형인 것은?,1,견,면,모,마,Fashion,0.7826000000000001
부직포의 특징이 아닌 것은?,1,마찰에 강하다,방향성이 없다,드레이프성이 부족하다,절단부분이 풀리지 않는다,Fashion,0.6522
천연고무와 가장 유사한 성질을 가진 합성섬유는?,2,나일론,스판덱스,비닐론,비스코스,Fashion,0.6667000000000001
빨간 성냥불을 어두운 곳에서 돌리면 길고 선명한 빨간 원을 그린다. 이것을 색채의 어떤 지각현상 때문인가?,2,색음 현상,색의 잔상,동화 현상,색채 대비,Fashion,0.6087
의복배색의 일반적인 경향으로 겨울의 복식 배색에 가장 효과적인 색은?,1,검정과 감색,흰색과 파랑,파랑과 연두,귤색과 녹색,Fashion,0.8695999999999999
드레이프성이 가장 좋은 직물은?,1,실크,광목,모시,아마,Fashion,0.75
스커트 제작 시 착용했을 때 안감이 미끄러지지 않게 하기위해 겉감과 연결하는 바느질법은?,2,감치기,실루우프,새발뜨기,버튼호울스터치,Fashion,0.6970000000000001
경제적으로 볼 때 재단을 가봉 후에 하는 것과 거리가 먼것은?,3,칼라,주머니,소매,안단,Fashion,0.6857
150cm 폭의 안감으로 긴소매 블라우스를 만들 때 적당한 옷감량 계산법은?,1,블라우스길이 + 소매길이 + 시접(10 ~ 15cm),(블라우스길이×2) + 시접(10 ~ 15cm),(블라우스길이×2) + 소매길이 + 시접(10 ~ 15cm),블라우스길이 + (소매길이×2) + 시접(10 ~ 15cm),Fashion,0.7742
계측방법으로 적당치 못한 것은?,1,가슴둘레: 좌우 어깨 끝점 사이의 길이,등 너비: 좌우 등 너비점 사이의 길이,가슴 너비: 좌우 가슴 너비점 사이의 길이,유두 길이: 목옆점에서 유두까지의 길이,Fashion,0.931
체형의 변이요소에 해당하지 않는 것은?,4,"인체의 외형은 골격, 근육, 피하지방에 의하여 모양이 만들어진다.",자연환경과 사회환경에 의하여 차이가 생긴다.,"남녀의 성차, 성장발육하는 과정에서 차이가 생긴다.",영양상태와는 관계가 있지만 유전적인 요소에는 관계되지 않는다.,Fashion,0.7143
단촌식 제도법의 특징이라 할 수 없는 것은?,4,치수를 많이 재는 제도법이다.,각 체형에 따라 알맞은 원형이다.,인체 각 부위를 정밀하게 제도한다.,기준이 되는 큰 치수 몇 항목만을 사용한다.,Fashion,0.75
봉비(땀뜀현상)의 원인과 가장 상관이 먼 것은?,3,바늘 끝이 닳아서 뭉뚝할 경우,가는 바늘에 굵은 실이 끼워졌을 경우,두꺼운 원단에 노루발의 압력이 강한 경우,실의 흘림에 저항이 있는 경우,Fashion,0.6136
90㎝폭의 옷감으로 길이가 70㎝인 타이트 스커트를 만들 때의 필요한 옷감량 계산으로 가장 적당한 것은?,2,110㎝,160㎝,210㎝,260㎝,Fashion,0.76
"폴리에스테르 직물로 봉제하여 다름질할 때 효율적이고, 안전한 다림질 온도는?",2,90 ~ 100℃,120 ~ 150℃,170 ~ 180℃,190 ~ 200℃,Fashion,0.72
번수나 데니어(denier)는 무엇을 표시하는가?,4,실의 종류,실의 꼬임,실의 중량,실의 굵기,Fashion,0.7082999999999999
직물과 편성물을 비교한 것으로 맞지 않는 것은?,3,편성물은 직물에 비해 신축성이 크다.,편성물은 직물에 비해 함기율이 크다.,직물은 편성물에 비해 필링이 생기기 쉽다.,직물은 편성물에 비해 마찰에 강하다.,Fashion,0.6087
현미경 구조에서 마디(node)가 나타나는 섬유는?,1,아마 섬유,양모 섬유,무명 섬유,명주 섬유,Fashion,0.7037
실온의 아세톤에 용해되는 섬유는 ?,1,아세테이트,나일론,폴리에스테르,면,Fashion,0.68
시각적인 요소로서 현실적인 형(real shape)이란?,3,선,점,입체,면,Fashion,0.7308
키가 작은 사람이 장식할 때 어떻게 하는 것이 자기의 단점을 가장 잘 보완할 수 있는가?,1,목걸이를 V자 형식으로 칼라선 가까이 했다.,벨트의 버클이 눈에 크게 띄게 했다.,목걸이가 요우크선 아래까지 내려오게 했다.,뒤허리 중심에 큰 리본을 달았다.,Fashion,0.8077
의복과 계절의 감각적인 면에서 볼 때 봄의 색상 설명이 잘못된 것은?,3,경쾌하고 맑은 색상이 좋다.,"자연현상의 연두, 녹색계통이 좋다.","붉은색, 갈색계통이 자연에 잘 조화된다.","연상감정으로 장미색, 핑크색 등이 좋다.",Fashion,0.7917000000000001
일반적으로 빨간 색을 좋아하는 민족에 속하지 않는 것은?,4,중국,인도,게르만,프랑스,Fashion,0.6
기하곡신이 주는 느낌은?,3,"안정, 서정","예민, 강직","활동, 세련","정직, 장엄",Fashion,0.7082999999999999
의복이 변색되거나 퇴색되는 원인이 아닌 것은?,4,세탁에 의한 염료의 탈락,자외선과 공기 중의 산소,땀의 성분 중 산,의복의 형태,Fashion,0.84
부직포의 특성으로 가장 거리가 먼 것은?,4,함기량이 많아 가볍고 따뜻하다.,절단부분이 잘 풀리지 않는다.,방향에 따른 성질의 차가 거의 없다.,마찰에 의한 내구성이 좋다.,Fashion,0.8077
직물의 구성 방법에 의한 분류 중 실로 만든 직물인 것은?,2,필름,레이스,부직포,펠트,Fashion,0.7273000000000001
다트 머니풀레이션의 응용이 아닌 것은?,1,스모킹,프린세스 라인,다트 풀니스,요크,Fashion,0.6875
스커트 원형을 제도할 때 필요 치수 항목으로 가장 옳은 것은?,1,"스커트 길이, 허리 둘레, 엉덩이 길이, 엉덩이 둘레","스커트 길이, 밑위 길이, 엉덩이 둘레, 배 둘레","스커트 길이, 허리 둘레, 엉덩이 둘레, 무릎 길이","스커트 길이, 허리 둘레, 배 둘레, 스커트 폭",Fashion,0.8667
실표뜨기할 때 주의사항으로 틀린 내용은?,3,"직선일 때는 간격을 성글게, 곡선일 때는 간격을 촘촘하게 시침한다.",면사 2올로 겉에서는 실 땀이 길고 뒤에서는 짧게 되도록 시침한다.,완성후 실을 뽑기 쉽게 완성선에서 0.5㎝떨어져서 한다.,옷감 한 겹을 제치고 사이의 실을 자른다.,Fashion,0.6452
길원형의 제도에서 앞길의 기초선을 그릴 때 가로선의 계산에서 B/4 + 4cm를 한다. 이 때 4cm가 뜻하는 것은?,4,앞뒤의 차,앞 처짐분,다트 폭,여유분,Fashion,0.8
직선봉이 두 개 이상 병열되어 있는 박음 방식은?,3,공업용 재봉기의 소분류: 장방형,공업용 재봉기의 대분류: 복합봉,공업용 재봉기의 중분류: 복렬봉,공업용 재봉기의 소분류: 원통형,Fashion,0.6774
단백질 섬유는 방축가공이 되어 있는 경우가 많으므로 물을 가볍게 뿌려 헝겊을 덮고 다려야 하는 직물은?,3,면직물,마직물,모직물,합성직물,Fashion,0.7143
"세탁을 자주해야 하는 운동복, 아동복, 와이셔츠 등에 많이 이용되며 겉으로 바늘땀이 두 줄이 나오기 때문에 스포티한 느낌을 주는 바느질법은?",4,평솔(plain seam),통솔(french seam),뉜솔(welt seam),쌈솔(flat felled seam),Fashion,0.7857
시접분량이 가장 적은 것은?,1,목둘레,옆선,어깨,스커트 단,Fashion,0.9643
레이스나 얇은 옷감으로 러플을 만들어 블라우스나 아동복등의 커프스나 치마단 장식에 이용되는 것으로 러플보다 폭이 좁은 것은?,1,프릴,레이스,플라운스,게이징,Fashion,0.7143
가봉시의 일반적인 유의사항이 아닌 것은?,2,"칼라, 커프스, 포켓은 가 재단 한 후 치수, 크기, 모양등을 확인 후 옷감을 재단한다.",바늘을 옷감에 어슷내려 꽂아 시침한다.,단추는 같은 크기로 종이나 천을 잘라서 일정한 위치에 붙여본다.,"시착한 다음 전체적인 실루엣을 먼저 관찰하고, 부분적인 곳을 관찰한다.",Fashion,0.7406999999999999
가봉 및 보정에 대한 일반적인 주의사항으로 부적당한 것은?,2,실은 주로 합성사보다는 면사를 사용한다.,작은 조각 이외에는 반드시 재봉대 위에 펴놓고 오른손으로 누르면서 오른쪽에서 왼쪽으로 시침한다.,바이어스 감과 직선으로 재단된 옷감을 붙일 때는 바이어스 감을 위로 겹쳐 놓고 바느질한다.,바느질 방법은 손바느질의 상침 시침으로 한다.,Fashion,0.7406999999999999
소매길이를 재는데 기준점이 되지 않는 것은?,2,어깨끝점,목뒤점,팔꿈치점,손목점,Fashion,0.8125
부직포 심지에 대한 옳은 설명은?,1,접착제를 사용하여 섬유와 섬유를 얽히게 해 고정시킨 소재이다.,절단부위가 약해서 올이 잘 풀린다.,올의 결은 방향성을 가지고 있다.,세탁에 수축하거나 늘어나기 쉽다.,Fashion,0.88
굴신체의 설명 중 틀린 것은?,3,앞이 남고 뒤가 부족하기 쉬운 경우이다.,옷을 입으면 앞이 뜨고 주름이 생긴다.,표준보다 몸이 뒤로 기울어진다.,뒤의 길이를 늘이든지 앞의 길이를 줄이면 된다.,Fashion,0.64
건식세탁의 장점이 아닌 것은?,4,건조가 빠르고 손질이 간편하다.,세탁물의 지질이 손상되지 않는다.,유용성오점을 제거하기가 용이하다.,습식세탁보다 세척율이 좋다.,Fashion,0.5926
의복에서 내부의 구성선이나 장식적인 요소들을 무시하는 외형을 무엇이라 하는가?,3,다트선,힙라인선,실루엣선,허리선,Fashion,0.75
허리를 강조하여 가장 여성미를 드러내는 실루엣은?,1,아워글래스 실루엣,H라인 실루엣,타원형 실루엣,시스 실루엣,Fashion,0.8
봄 시즌에 밝고 생동감있는 디자인을 할 때에 의복의 색상에 적당한 것은?,1,"노랑, 연두","진녹색, 검정","검정, 갈색","남색, 갈색",Fashion,1.0
직물의 변에 대한 설명 중 맞지 않는 것은?,2,직물의 제직·가공·정리시 이 부분이 큰 힘을 받는다.,다른 부분보다 얇게 제직되어 있다.,대부분의 상호가 여기에 표시되기도 한다.,직물의 양쪽 끝에 있는 쫀쫀한 부분이다.,Fashion,0.7692
방한복의 선택 조건으로 적합한 것은?,2,흡습성이 높은 것,열전도율이 낮은 것,통기성이 높은 것,투습성이 좋은 것,Fashion,0.7692
직물의 기본이 되는 삼원조직이란?,4,"능직, 사직, 수자직","평직, 능직, 파일직","평직, 사직, 중합직","평직, 능직, 수자직",Fashion,0.8077
곰팡이가 발생할 수 있어 깨끗하고 건조하게 보관 해야하는 섬유끼리 짝지어진 것은?,1,면-레이온,아마-나일론,견-폴리에스테르,모-아세테이트,Fashion,0.6667000000000001
재봉틀 분해소제 때 가장 먼저 해야할 것은?,1,바늘을 뺀다.,노루발을 떼어 놓는다.,침판을 떼어 놓는다.,솔로 바늘판의 뒷면과 톱니의 부근을 깨끗이 털어낸다.,Fashion,0.9677
"일반적으로 재봉틀을 사용할 때 회전이 무겁고, 소리가 많이 나는 경우는?",1,반달집에 실이 끼였을 경우,바늘의 굵기와 실의 굵기가 다를 경우,땀수 조절기가 조절이 안될 경우,밑실 조절나사가 너무 조여졌을 경우,Fashion,0.8148000000000001
옷감을 재단할 때 어깨와 옆선의 시접 분량으로 가장 적합한 것은?,3,0.5㎝,1㎝,2㎝,3㎝,Fashion,0.7241
소매산을 가르키는 제도약자는?,3,F.S.H,B.S.H,S.C.H,S.B.L,Fashion,0.7778
의복제작의 과정을 바르게 나열한 것은?,1,치수재기- 제도- 형지제작- 재단- 봉제,제도- 형지제작- 치수재기- 봉제- 재단,치수재기- 제도- 재단- 봉제- 형지제작,형지제작- 치수재기- 제도- 재단- 봉제,Fashion,0.8462000000000001
목앞점과 목뒷점을 자연스러운 곡선으로 연결하였을 때 그 곡선의 어깨선과 목부위에서 만나는 점은?,2,목 앞점,목 옆점,목 뒷점,어깨 끝점,Fashion,0.68
재봉시 지퍼 등솔기를 다리미로 가른 후 봉제하여 외관상 박음선이 드러나게 처리되어 깔끔하며 스커트나 원피스에 많이 사용되는 지퍼는?,1,콘슬지퍼,양면지퍼,파스너,비스론,Fashion,1.0
재단 전에 옷감을 정리해야 할 필요성으로 올바른 것은?,1,옷감의 올을 바르게 정리하기 위해서,옷감의 두께를 증가시키기 위해서,옷감의 수지 성분을 제거하기 위해서,옷감의 강도를 높이기 위해서,Fashion,0.92
칼라의 종류가 다른 것은?,3,세일러 칼라,피터팬 칼라,롤 칼라,수티앵 칼라,Fashion,0.64
실의 굵기를 항장식으로 나타내는 것은?,4,면사,모사,마사,견사,Fashion,0.6087
합성섬유로 만든 옷이 피부와 접촉하는 내의에 적합하지 못한 제일 큰 이유는?,3,통기성이 크기 때문에,열전도율이 크기 때문에,흡수성이 적기 때문에,정전기 발생이 적기 때문에,Fashion,0.75
"면, 마, 레이온 등은 어떤 화합물로 구성되어 있는가?",1,셀룰로스,단백질,피브로인,케라틴,Fashion,0.8261
빛의 3원색을 혼합하면 어떠한 색이 되는가?,4,검정색,노랑색,청색,백색,Fashion,0.7082999999999999
무늬에서 율동감을 얻으려면 어떻게 해야 하는가?,1,색이나 형의 반복,균제적인 균형,일부분을 특히 강조,조화있는 공간설정,Fashion,0.8636
색채의 연상 작용에 관한 내용이 아닌 것은?,3,"색을 보는 사람의 경험과 기억, 지식 등에 영향을 받는다.","색을 보는 사람의 민족성이나 나이, 성별에 따라 다르다.",인간의 마음을 흔드는 심리적 반응과 사회적 규범을 나타내는 사회적 반응이 있다.,색채의 연상에는 구체적 연상과 추상적 연상이 있다.,Fashion,0.619
계절에 따른 조화된 의복색으로 가장 부적절한 것은?,2,봄-경쾌하고 밝은 색,여름-탁하고 어두운 색,가을-어둡고 풍부한 느낌의 색상,겨울-따뜻한 색,Fashion,0.8571
면적을 크게 보이게 하는 설명으로 바른 것은?,1,높은 명도의 밝고 강한 색,낮은 채도의 부드러운 대비 효과,무채색 계통의 채도가 낮은 색,한색 계통의 탁한 색,Fashion,0.8261
하늘에 어떤 색상의 애드벌룬을 띄워야 선명하게 보이겠는가?,3,파랑,초록,주황,흰색,Fashion,0.7726999999999999
직물 조직 중 가장 튼튼한 조직의 옷감은?,3,수자직,변화능직,평직,사문직,Fashion,0.625
여름철 옷감으로 적당한 것은?,3,옷감의 밀도가 조밀한 직물,드레이프성이 큰 직물,열전도율이 높은 직물,섬유의 꼬임이 적은 직물,Fashion,0.6364
각 사람의 체형과 취미에 맞게 제작되는 가장 이상적인 피복제작 방법은?,4,기성복,이이지 오더(easy order),가정 봉제,맞춤복,Fashion,0.8
피계측자가 의자에 앉았을 때 우측 옆의 허리선에서부터 실루엣대로 의자 바닥까지(座面)의 수직 길이는?,2,바지 길이,밑위 길이,엉덩이 길이,치마 길이,Fashion,0.7333
원형을 보정할 때 뒤에서 당기고 주름이 생기는 경우는 어떤 체형에서 나타나는가?,3,복부 반신체형,엉덩이가 들어가고 복부가 나온 체형,엉덩이가 나오고 복부가 들어간 체형,몸에 살이 적은 체형,Fashion,0.6
총원가에 속하지 않는 것은?,1,적정 이윤,제조 원가,일반 관리비,판매 간접비,Fashion,0.72
재봉된 천에 실이 끊기거나 밑실이 올라오게 되어 박음질이 불량하게 되고 봉축 심 퍼커링 현상이 일어났다. 무엇으로 조절하는가?,1,윗실조절 장치,실채기,노루발의 압력,몸체 실걸이,Fashion,0.8
솔기의 퍼커링 현상이 일어나는 요소가 아닌 것은?,3,윗실과 밑실의 장력에 의한 현상,바늘에 의해 올이 밀려 나가서 생기는 현상,바늘의 길이에 의한 현상,톱니와 노루발의 압력에 의한 현상,Fashion,0.6957
채촌시 가슴둘레를 잴 때 정확한 방법은?,4,유두점을 지나 수평으로 줄자를 당겨 잰다.,유두 아랫부분을 수평으로 잰다.,계측용 벨트로 유두 윗 부분을 잰다.,유두점을 지나 수평으로 줄자를 자연스럽게 잰다.,Fashion,0.7826000000000001
90cm 폭의 옷감으로 긴소매 원피스를 재단할 경우 가장 적당한 옷감량의 계산법은?,2,원피스길이＋소매길이＋시접＋여유분,(원피스길이× 2)＋소매길이＋시접＋여유분,원피스길이＋소매길이＋칼라너비＋시접＋여유분,원피스길이＋(소매길이× 1.5)＋시접＋여유분,Fashion,0.8181999999999999
기성복 제품의 원가 상승 혹은 하락 요인이 되는 설명 중 바르지 않은 것은?,3,복잡한 옷의 경우는 인건비가 많이 들므로 가격상승의 요인이 된다.,원단 값은 가격 결정에 중요한 역할을 하므로 기성복생산의 경우에는 값싼 원단을 사용하는 경우도 있다.,작업과정을 자동화하면 인건비를 줄일 수 있으므로 원가하락에 무조건 도움이 된다.,부속품비는 옷을 만드는데 드는 비용 중 비교적 큰 부분을 차지하므로 비용을 절감하기 위해서는 가격이 낮은 부속품을 사용한다.,Fashion,0.5909
금속 또는 합성수지 등의 얇은 판을 여러모양으로 오려낸 것으로 옷의 색과 맞추어 붙이는 것은?,4,파이핑,퀼팅,애플리케,스팽글,Fashion,0.6818000000000001
가봉 시착을 위한 손바느질 방법으로 적당한 것은?,4,실은 반드시 강도가 강한 합성섬유로 한다.,바느질 방법은 박음질로 한다.,반드시 실은 두올로 한다.,바늘은 옷감에 직각으로 내려꽂아 시침을 한다.,Fashion,0.6818000000000001
길이가 100㎝인 슬랙스를 만들려고 한다. 90㎝ 너비의 옷감을 이용할 경우 가장 적정한 겉감의 필요치수는?,3,100㎝,155㎝,220㎝,255㎝,Fashion,0.6087
외부로부터 가해진 힘에 의하여 그 물질이 형태적 변화를 일으키는 성질을 무엇이라고 하는가?,1,가소성,펠팅성,방추성,방축성,Fashion,0.5909
현미경구조에 따른 섬유의 특징 중 겉비늘(scale)이 없는 섬유는?,4,양털,캐시미어,모헤어,비닐론,Fashion,0.7143
아마섬유 자체를 결합시키고 있는 고무질은?,4,리그닌(lignin),바스틴(bastin),큐토스(cutose),펙틴(pectin),Fashion,0.619
유사 색상의 배색은 어떠한 느낌을 주는가?,2,대립적인 감정을 준다.,온화한 감정을 준다.,강하고 화려한 감정을 준다.,명쾌하고 가벼운 감정을 준다.,Fashion,0.7895
비슷한 색상의 배색일 때 서늘하고 가라앉은 느낌을 줄수 있는 의복의 배색은?,2,고명도의 난색 계통,저명도의 한색 계통,고채도의 중성색 계통,중채도의 고명도색 계통,Fashion,0.7895
원색의 설명을 바르게 한 것은?,2,가법혼합 또는 가색혼합에 의하여 얻어진 색상이다.,다른 색의 복합으로 만들 수 없는 색을 말한다.,색료 혼합의 중간색을 말한다.,순색에 유채색을 혼합하여 만든 색이다.,Fashion,0.7368000000000001
교통 표지판은 색의 어떤 성질을 이용한 것인가?,2,실용성,명시성,안정성,조화성,Fashion,0.75
뚱뚱한 체형의 사람에게 어울리는 의복은?,1,저명도 색으로 어두운 계통의 의복을 입는다.,엷은 색을 주색채로 사용하는 것이 좋다.,팽창색을 이용한다.,큰무늬 옷감을 이용한다.,Fashion,1.0
직물의 표리(겉과 뒤)판별법으로 틀린 것은?,4,직물의 식서에 상품명이나 섬유혼용율 표시가 있는 것이 겉면이다.,직물의 조직과 무늬가 뚜렷하게 나타난 쪽이 겉면이다.,면직물이나 모직물의 경우 광택이 많은 쪽이 겉면이다.,잔털이 많은 면이 겉면이다.,Fashion,0.65
하절기 의복으로 입기에 가장 적합한 조직과 직물명은?,4,편직물 - 저지,주자직물 - 공단,능직물 - 사아지,평직물 - 아마,Fashion,0.75
섬유의 염색성에 영향을 미치는 요인과 가장 관계가 없는 것은?,1,섬유의 강도,섬유의 화학적 조성,흡수성,염료를 잘 흡수하는 원자단,Fashion,0.75
우리나라에서 곰팡이가 가장 잘 발육이 되는 시기는 어느 때인가?,3,1월∼2월,4월∼5월,7월∼8월,10월∼11월,Fashion,0.9
입술 포켓을 만들 때 천의 결은?,3,가로 결,세로 결,바이어스 결,무늬에 따라 적당히,Fashion,0.6409999999999999
진동둘레와 소매부리에 개더나 소프트 플리츠를 넣은 소매로서 소매를 짧게 하면서 부풀린 소매의 명칭은?,2,세트인 소매(Set - in Sleeve),퍼프 소매(Puff Sleeve),셔어츠 소매(Shirt Sleeve),라글란 소매(Raglan Sleeve),Fashion,0.7837999999999999
표준보다 몸의 중심이 뒤로 기울어서 뒤가 많이 남는 반면 앞의 길이가 부족하기 쉬운 체형은?,2,굴신 체형,반신 체형,후견 체형,정상 체형,Fashion,0.7646999999999999
재봉틀을 청소할 때 제일 먼저 해야 하는 것은?,1,바늘을 빼어 놓는다.,노루발을 떼어 놓는다.,바늘판을 떼어 놓는다.,재봉틀 머리 부분을 뒤로 제쳐 놓는다.,Fashion,0.7879
단추 구멍의 크기를 정할 때 적용 칫수는?,1,단추의 지름 + 단추두께,단추의 지름,단추의 반지름 × 3,단추의 반지름 + 0.3㎝,Fashion,0.8065000000000001
완성된 다아트 길이는 B.P에서 몇 ㎝정도 떨어져 처리하는 것이 이상적인가?,2,1㎝,3㎝,5㎝,7㎝,Fashion,0.8125
의복원형의 기본이 아닌 것은?,4,길원형,소매원형,스커트원형,슬랙스원형,Fashion,0.6786
자켓재단시 시접을 가장 작게 해야 할 곳은?,1,목둘레,블라우스 단,소매 단,어깨와 옆선,Fashion,0.963
"팔 둘레의 위치가 아래쪽에 있고, 어깨 경사 각도가 큰 체형은?",1,처진 어깨,솟은 어깨,반신 어깨,굴신 어깨,Fashion,0.8845999999999999
"소매단, 블라우스단, 파스너단의 시접은?",3,0.5∼1㎝,1∼2㎝,3∼4㎝,4∼6㎝,Fashion,0.6552
스커트 제도에 사용되는 약자와 설명으로 바른 것은?,2,엉덩이 둘레선 : H.L.(Hem Line),앞중심선 : C.F.L(Center Front Line),옆선 : S.L.(Shoulder Line),도련선 : W.L.(Waist Line),Fashion,0.68
비스코스레이온 실의 길이가 9km 이며 무게가 5g 인 실의 굵기(Denier)는?,2,1 D,5 D,7 D,10 D,Fashion,0.7692
색상과 배색 중 난색끼리의 배색은?,3,서늘한 느낌을 준다.,침착하고 이지적이다.,부드럽고 온화하며 활동적이다.,쓸쓸하면서도 활동적이고 이지적이다.,Fashion,0.7619
색의 경연감에 대한 설명이 잘못된 것은?,1,채도와 명도가 낮은 색은 부드러워 보인다.,따뜻한 색 계통은 부드러워 보인다.,차가운 색 계통은 굳어있는 듯한 느낌을 준다.,"분홍색, 달걀색, 살색, 연두색 등의 색에 흰색을 많이 섞으면 부드러운 느낌을 준다.",Fashion,0.8181999999999999
"겸손, 점잖음, 무기력하고, 우울한 분위기를 지닌 색은?",1,회색(gray),바이올렛(violet),빨강(red),청색(blue),Fashion,0.9048
"섬유가 외부 힘의 작용으로 신장, 굴곡, 압축 등의 변형을 받았다가 외부의 힘이 사라졌을 때 원상으로 되돌아가는 능력은?",1,레질리언스,내구성,내연성,신도,Fashion,0.7143
5매 주자직에서 뜀수로 사용되는 수는?,1,"2, 3","3, 5","2, 5","1, 2, 3",Fashion,0.65
본봉재봉틀 구조 중 톱니는 무슨 작용을 하는가?,1,천을 밀어내는 작용을 한다.,노루발 올림장치 작용을 한다.,실의 강 약을 조절한다.,바느질 땀수를 조절한다.,Fashion,0.9545
밑실을 감을 때 실토리에 실은 몇 %가 가장 적당한가?,3,40%,60%,80%,100%,Fashion,0.72
시침 바느질에 사용하는 실은?,1,면사,견사,나일론사,폴리에스테르사,Fashion,0.9524
어깨 끝점에서 B.P까지 연결된 다트의 명칭은?,2,숄더 다트(shoulder dart),숄더 포인트 다트(shoulder point dart),언더 암 다트(under arm dart),로우 언더 암 다트(low under arm dart),Fashion,0.619
여러 장의 폭을 이어서 만든 스커트는?,2,타이어트 스커트,고어드 스커트,플레어 스커트,플리이츠 스커트,Fashion,0.619
가정용 재봉틀에 해당되는 것은?,4,96종,103종,31종,15종,Fashion,0.6364
