question,answer,A,B,C,D,Category,Human Accuracy
영구적인 오점을 남기기 쉬운 오점의 부착 형태는?,2,단순 부착,화학적 결합에 의한 부착,정전기로 인한 부착,침투 및 확산에 의한 부착,Fashion,0.8
"드라이클리닝을 하는데 어려움이 있는 의류를 손빨래를 원칙으로 물품을 손상하지 않고, 가볍게 처리하는 세탁 작업은?",2,론드리,웨트클리닝,건식클리닝,드라이클리닝,Fashion,0.6
석유계 드라이클리닝 세정기의 특징과 가장 관계 있는 것은?,1,방폭형구조,차입관,버튼드롭,스팀보드,Fashion,1.0
론드리 건조시에 주의하여야 할 설명으로 잘못된 것은?,4,배기구는 자주 청소하여 주어야 건조효율을 높일 수 있다.,늘어나거나 수축될 우려가 있는 섬유는 자연건조를 시킨다.,건조기에서 꺼내는 즉시 펼쳐놓아야 축열하여 눋는 것을 방지할 수 있다.,화학섬유는 90℃이상의 고온으로 건조시킨다.,Fashion,0.7143
물세탁(론드리)에서의 사고방지에 대한 설명이다. 맞지 않는 것은?,4,"표백제 사용시는 농도, 온도, 시간에 주의해야 한다.",과탄산소다를 사용할 때는 충분히 녹여서 와셔를 돌리면서 투입한다.,세탁물은 충분히 헹구어서 세제등이 세탁물에 남아 있지 않게 해야 한다.,과붕산소다를 사용할 때는 와셔에 투입한 후 돌린다.,Fashion,0.6154
론드리의 공정 중 풀먹임에 사용되는 풀의 원료가 아닌 것은?,1,규불화소다,젤라틴,PVA,전분,Fashion,0.8571
직물 조직 중 삼원 조직에 속하지 않는 것은?,4,평직,능직(사문직),수자직(주자직),바스켓직,Fashion,0.75
단일천 구조에 속하지 않는 것은?,4,직물,편물,펠트,천연피혁,Fashion,0.6667000000000001
일반적인 마 섬유의 특성은?,4,강도는 합성섬유보다 크다.,신도는 모섬유보다 큰 편이다.,수분 흡습시 강도가 저하한다.,양도체이므로 시원한 감이 있다.,Fashion,0.7857
옷감에 구김이 잘 가지 않는 성능은?,1,내추성,통기성,보온성,흡수성,Fashion,0.8667
면 섬유의 특성과 관련이 가장 적은 것은?,3,직접 염료로 염색이 가능하다.,산에는 약하나 알칼리에는 강하다.,검경 구조는 다각형이고 중공이 있다.,다림질 온도는 비교적 높은 편이다.,Fashion,0.75
반드시 드라이크리닝을 해야 할 의류 제품은?,1,방축가공된 모제품,합성피혁 제품,고무를 입힌 제품,안료로 염색된 제품,Fashion,0.8571
"양모섬유의 크림프 및 스케일, 면섬유의 천연꼬임, 아마 섬유의 마디에 의해서 향상되는 성질은?",1,방적성,탄성,보온성,드래이프성,Fashion,0.7857
인조섬유 중 합성 고분자계 섬유가 아닌 것은?,1,비스코스레이온,나일론 66,폴리에스테르,아크릴,Fashion,1.0
명주 섬유의 단면 모양은?,2,원형,삼각형,아령형,타원형,Fashion,0.7692
무명섬유의 공정 수분율은?,4,0.4%,1.5%,4.5%,8.5%,Fashion,0.6923
명주섬유를 가장 상해시키는 시약은?,2,산류,알칼리,금속염,환원제,Fashion,0.6667000000000001
세로방향의 실(경사)과 가로방향의 실(위사)이 직각으로 교차하여 이루어진 형태는?,3,경편물,위편물,직물,부직포,Fashion,0.8332999999999999
공중위생 영업자의 위생관리 의무로 맞는 것은?,2,공중위생 영업장의 설치,영업관련 시설 및 설비를 위생적이고 안전하게 관리,유해물질의 발생,세제의 제조 및 판매,Fashion,0.8181999999999999
세탁업소에 법적으로 게시할 내용이 아닌 것은?,4,신고필증,요금표,주의사항,세탁기능사 자격증,Fashion,0.7
공중위생법상 세탁업의 정의는?,4,"세제를 사용하여 의류, 기타 섬유제품이나 피혁 제품 등을 원형대로 세탁하는 영업","용제를 사용하여 의류, 기타 섬유제품이나 피혁 제품 등을 원형대로 세탁하는 영업","세제, 용제 등을 사용하여 의류, 기타 섬유제품을 원형대로 세탁하는 영업","세제, 용제 등을 사용하여 의류, 기타 섬유제품이나 피혁제품 등을 원형대로 세탁하는 영업",Fashion,0.7273000000000001
용제의 독성 중 염중독을 일으킬 수 있는 것은?,4,산소(O2),수소(H2),네온(Ne),안티몬(Sb),Fashion,0.7895
용제 청정화 관리에 대한 설명 중 옳은 것은?,4,2-3개월에 1회씩만 청정화 시켜주면 된다.,휠터나 카본이 있기 때문에 콜라색의 빛깔이라도 괜찮다.,용제의 색깔이 맥주색이면 양호하다.,사용회수에 관계없이 정종(청주)색을 유지하여야 재오염이 되지 않는다.,Fashion,0.8421
펌프의 기능에 관한 설명으로 틀린 것은?,1,용제의 필터순환 회수의 많고 적음에 따라 세정과 재오염 방지 효과는 무관하다.,필터압이 1kg/cm2 오르면 유량은 1/2이하가 된다.,필터압이 상승되면 유량이 저하되는 것은 펌프 기능 저하에 영향을 받는다.,"펌프 형식에는 가스, 기어, 원심 등의 형식이 있다.",Fashion,0.9444
표백의 작용과 방법에 대한 설명으로 적당하지 않은 것은?,4,천을 희게 한다.,표백분은 산화표백제이다.,차아염소산소다는 본빨래 마지막에 넣는다.,과탄산소다는 본빨래가 끝날 때 넣는다.,Fashion,0.6842
오염의 분류에 속하지 않는 것은?,3,유성 오염,불용성 고체 오염,대전성 오염,수용성 오염,Fashion,0.7222
유용성 오점의 분류가 아닌 것은?,4,"기계유, 식용유, 지방산, 그리스, 왁스 등","광유, 지방, 화장품, 지질 등","페인트, 그리스, 왁스, 타르, 피지 등","간장, 과즙, 구토물, 겨자, 곰팡이 등",Fashion,0.7778
재오염의 원인에 대한 설명이 틀린 것은?,2,흡착에 의한 재오염에는 정전기에 의한 것이 있다.,세정과정에서 용제 중에 용탈한 염료가 섬유에 염착 하지 않는다.,용제의 수분이 과다함에 따라 재오염이 발생한다.,물에 젖은 의류는 수분과다로 수용성 더러움이 흡착된다.,Fashion,0.6875
세탁 과정 중 옷에서 일단 분리되었던 오염이 다시 옷에 부착되는 경우를 무엇이라고 하는가?,1,재오염,방오,표백,용해도,Fashion,1.0
아마 섬유의 특성이 아닌 것은?,2,습윤하면 강도가 약간 증가한다.,흡습과 건조속도는 면보다 느리다.,탄성이 나쁘다.,일광에 의해 쉽게 손상을 받는다.,Fashion,0.6604000000000001
안감의 설명으로 틀린 것은?,4,두꺼운 겉감에는 가볍고 얇은 감을 사용한다.,색은 겉감보다 연한 동색으로 하거나 보색으로 배색한다.,얇고 비치는 겉감에는 되도록 질감이나 조직이 같은 흰색의 안감으로 한다.,안감은 겉감보다 좀 빳빳한 감으로 해야 실루엣이 살아난다.,Fashion,0.6087
겨울철 한복의 재료로써 사용되는 것은?,1,"자미사, 명주, 공단","숙고사, 관사, 모시","숙고사, 항라, 자미사","생고사, 은조사, 항라",Fashion,0.84
수자직에 속하는 것은?,3,포플린,옥양목,공단,개버딘,Fashion,0.7082999999999999
여름철 한복감으로 제일 적당한 것은?,2,명주,모시,아세테이트,T/C혼방,Fashion,0.8667
워시앤드웨어 (wash and wear)성을 가진 대표적인 섬유로 혼방 직물에 많이 이용되는 섬유는?,1,폴리에스테르계 섬유,폴리아미드계 섬유,폴리프로필렌계 섬유,폴리아크릴계 섬유,Fashion,0.6897
견직물의 특성에 해당하는 것은?,3,"흡습성이 좋고, 강력이 강하나 쉽게 구겨진다.","내구력이 강하고, 비교적 보온력이 있고, 세탁이 용이하다.","조직이 치밀하고, 촉감이 좋고, 우아한 광택이 있다.","일광에 취화가 적고, 보온력이 강하여 따뜻하다.",Fashion,0.75
"천연섬유 중 동물성 섬유로 조직이 치밀하여 , 촉감이 좋고 우아한 윤택으로 품위가 있어 고급 옷감으로 많이 쓰이는 것은?",4,면직물,마직물,모직물,견직물,Fashion,0.8286
평직의 장점에 해당되는 것은?,1,"얇고, 제직이 간단하며 실용적이다.",조직점이 많아 구김이 잘 생긴다.,표면이 거칠다.,광택이 많다.,Fashion,0.9032
비단(견)이 염기성 물감이나 산성물감에 염색이 잘되는 것은 섬유의 어떤 성분 때문인가?,1,피브로인 중의 아미노산,단백질 중의 탄소,세리신 중의 질소,피브로인 중의 탄소,Fashion,0.9643
필라멘트 섬유에 속하는 것은?,3,면섬유,마섬유,견섬유,모섬유,Fashion,0.6154
"한복의 속치마, 속바지등에 적합한 직물은?",1,레이온,폴리에스테르,나일론,비닐론,Fashion,0.625
흡습성이 적은 섬유의 특징이 아닌 것은?,1,염색이 잘 된다.,세탁 후 건조가 빠르다.,구김살이 잘 생기지 않는다.,표면에 정전기가 발생한다.,Fashion,0.8065000000000001
합성직물의 특성에 해당하는 것은?,2,"강도가 약하고, 잘 구겨지며 열에 약함","강도가 강하고, 세탁이 쉬우며, 잘 구겨지지 않음","촉감이 부드럽고 잘 구겨지지 않으며, 보온력이 강함","강력이 강하고, 흡습성이 좋으며, 쉽게 구겨짐",Fashion,0.6452
생사가 정련견에 비해 촉감이 거칠고 강경한 이유는 무엇 때문인가?,1,세리신,피브로인,외표피층,토사구,Fashion,0.64
여름 옷을 선택하는 조건으로 옳지 않은 것은?,1,불양도체인 섬유,흡습성이 큰 섬유,통기성이 큰 섬유,내일광성이 큰 섬유,Fashion,0.8667
바지 밑단을 꿰맬 때 이용되는 바느질법으로 알맞은 것은?,4,속감침질,감침질,잔홈질,새발뜨기,Fashion,0.7419
바지 뒷솔기의 바느질은 한국산업규격(K.S)상 어떻게 하여야 되는가?,2,3중환 바느질 또는 3중 바느질,2중환 바느질 또는 2중 바느질,4중환 바느질 또는 4중 바느질,몇번이고 겹치도록 하여야 한다,Fashion,0.7
"신축성이 우수하고, 적당한 드레이프성이 있을뿐만 아니라 안정성이 우수한 심지는?",3,광목을 풀로 붙여서 쓰는 것이 좋다.,부직포를 미싱으로 누벼서 쓰는 것이 좋다.,모심지를 손으로 누벼서 쓰는 것이 좋다.,모시나 삼베를 미싱으로 누벼서 쓰는 것이 좋다.,Fashion,0.6552
좋은 옷이란 체형을 파악하고 체형에 어울리는 보기 좋은 선을 만들어 내는데 있다. 굽은 다리의 해결책으로 틀린 것은?,1,굽은 다리가 그대로 보이게 한다.,휘어짐을 몰라보게 한다.,패턴의 무릎 부분을 절개하여 안으로 주름선을 이동한다.,장딴지를 살려서 처리한다.,Fashion,0.8929
양복제도에 관한 사항과 거리가 먼 것은?,4,선의 굵기에 따라서는 실선 파선 쇄선 등이 쓰인다.,가는 실선으로 표시하는 선은 치수선 지시선 치수보조선 등이 있다.,도면이란 평면상에 점과 선을 써서 물체의 모양 위치크기를 나타내고 여기에 기호 부호 문자 등을 나타낸 것이다.,제도에서 모양을 표시하는 실선은 굵기에 제한받지 아니하며 사용자가 편한대로 할 수 있다.,Fashion,0.68
프린세스 라인(princess line)의 설명으로 가장 적당한 것은?,1,어깨에서 B.P를 통과하는 선이다.,암홀에서 B.P를 통과하는 선이다.,허리선을 낮추어서 옆으로 자른 선이다.,허리선을 높혀서 옆으로 자른 선이다.,Fashion,0.7692
형넣기 작업에 앞서 정해진 길이로 천을 여러겹 포개어 펼쳐 놓는 작업을 무엇이라 하는가?,1,연단작업,그레이딩(grading)작업,검포작업,마킹(marking)작업,Fashion,0.7726999999999999
앞 중심선의 약자는?,1,C.F.L,C.B.L,S.C.P,A.H.L,Fashion,0.9444
단추가 갖추어야 할 성능과 거리가 먼 것은?,1,무겁고 단단해야 한다.,세탁에 의해 변하지 않아야 한다.,다림질에 의해서 녹지 않아야 한다.,충격에 의해 쉽게 파손되지 않아야 한다.,Fashion,0.9375
치수재기에 있어서 왼길이의 1/2로 가장 많이 적용되는 치수는?,1,저고리 기장,소매 기장,등 기장,바지 기장,Fashion,0.8125
조끼 뒷판 그레이딩 시 치수에 따라 어깨선은 어느 방향으로 변화 되는가?,1,45° 방향,30° 방향,15° 방향,10° 방향,Fashion,0.7857
가봉할 때 등품과 앞품은 적당하나 어깨가 넓을 경우 수정방법은?,2,어깨에서 폭만큼 깍아준다.,"등품, 앞품선에 무리가 가지 않게 어깨선 중앙 부분에서 A.H 선을 향하여 접어준다.",Neck을 파준다.,"앞,뒤 중앙선을 깍아준다.",Fashion,0.7333
표준체격을 설명한 것으로 맞는 것은?,2,뒷품이 앞품보다 넓다.,앞품이 뒷품보다 넓다.,앞품과 뒷품이 같다.,표준체격과 앞뒤품은 상관이 없다.,Fashion,0.6061
저고리의 소매를 달 때 설명한 것 중 가장 알맞는 것은?,1,소매산 위에 홈 줄임을 해서 한다.,소매산 위에 홈 줄임이 필요없다.,소매 맞춤표를 안 맞춘다.,소매 길이에 꼭 맞추어야 한다.,Fashion,0.7406999999999999
허리가 잘룩하고 볼기가 솟은 사람의 바지 재단은 어떻게 하는 것이 가장 좋은가?,3,바지 여유를 많이 둔다.,바지통을 크게 한다.,허리의 다아트를 많이 준다.,바지춤을 길게 한다.,Fashion,0.6957
시임 퍼커링(seam puckering)이 많아지는 경우와 거리가 가장 먼 것은?,1,재봉실의 장력이 작을수록,재봉틀의 회전수 증가,재봉틀의 바늘이 굵을수록,위사방향의 봉제일수록,Fashion,0.7037
앞내림이 필요한 체형은?,4,등이 굽은 사람,허리가 가는 사람,엉덩이가 나온 사람,가슴이 큰 사람,Fashion,0.625
갑피 가장자리를 중창에 골을 씌운 후 접착제를 도포하여 압착기로 창붙임 하는 제조법은?,2,실루웰트 제조법,시멘트식 제조법,가황압착식 제조법,사출성형식 제조법,Fashion,0.7097
신발 각 부분의 기능에 따른 요구 재질로써 가장 최하품의 가죽으로 재단하는 부분은?,1,뒷보강,선포,앞보강,구목보강,Fashion,0.7037
각종 고무나 수지를 이용하여 스폰지를 제작할 때 사용되는 발포제의 구비 조건이 잘못된 것은?,4,분해속도 조절이 가능할 것,기지내에서 분산성이 우수할 것,입도 분포가 균일할 것,분해열이 높을 것,Fashion,0.7726999999999999
완성된 갑피와 창을 조립하여 신발을 만드는 공정은?,4,준비,재봉,재단,제화,Fashion,0.8261
신발에 사용하는 재봉사는 주로 어떤 강도를 검사하는가?,1,인장강도,파열강도,골곡강도,마찰강도,Fashion,0.75
화학구조의 변화를 거쳐 원료고무가 넓은 온도 범위내에서 탄성체에 탄성을 나타내는 상태로 전환되는 공정으로 이 공정에서 선상인 고무분자가 3차원적인 가교결합을 이루는 것은?,2,소련,가황,혼련,압연,Fashion,0.6364
영국식 신발 치수법에서 길이 치수는 매 호마다 얼마의 간격으로 구성되는가?,2,1/2 인치,1/3 인치,1/4 인치,1/5 인치,Fashion,0.6364
접착제의 사용상 주의할 점이 아닌 것은?,3,사용하지 않을 때는 가능한한 밀폐 보관한다,통풍이 잘 되는 장소에 보관한다,가능한 한 습기가 많은 곳에 보관한다,열원으로 부터 떨어져 보관한다,Fashion,0.8
"신발의 화형제작에 있어 표준치수를 기준으로 하여 화형의 크기, 등급을 경절하는 작업은?",2,성형,그레이딩,설계,기획,Fashion,0.7
준비공정이 끝난 부패하기 쉬운 가죽에 안정된 유연성 탄력성 등을 가지게 하는 공정을 무엇이라 하는가?,2,염장,탄닝(tanning),박피,절재,Fashion,0.7143
"고무약품 중 고무분자간의 윤활제로 작용하여 미가황 고무 생지의 유연성,가공성을 개선하는 것은?",1,연화제,점착부여제,충진제,경화제,Fashion,0.75
패션머천다이저의 역할 중 표적시장을 설정하고 디자인 콘셉트를 설정하는 업무단계는?,1,상품기획업무,생산지원업무,물류업무,판매촉진지원업무,Fashion,1.0
패션 머천다이징의 개념에 속하지 않는 것은?,1,적절한 판매(right sales),적절한 장소(right place),적절한 가격(right price),적절한 시기(right time),Fashion,0.7778
표적시장을 설정하는 이유는?,1,누구의 어떤 욕구를 만족시킬 것인가를 명확히 한다.,어디에서 팔 것인가를 명확히 한다.,누구를 통해서 팔 것인가를 명확히 한다.,언제 팔 것인가를 명확히 한다.,Fashion,1.0
패션머천다이저의 대한 설명 중 틀린 것은?,1,"자기의 독창적인 발상이나 착상을 실현하기 위한 전 과정의 계획, 설계 및 조직을 하는 사람이다.",상품기획 부분의 총괄자로서 생산에서 판매부분에 이르기까지 광범위한 직무 영역을 가지고 새로운 브랜드 개발과 상품기획을 하는 사람이다.,유통업 분야와 제조업 분야에 따라 리테일 머천다이저와 어패럴 머천다이저로 구분된다.,M.D 라고 불리며 상품 및 취급방법에 관한 책임자를 뜻한다.,Fashion,1.0
소비자의 구매 대리인(buying agent) 역할을 하는 직종은?,3,직물 디자이너,패션 디자이너,리테일 머천다이저,모델리스트,Fashion,0.7
패션 머천다이저의 역할로서 가장 거리가 먼 것은?,1,디자인,상품기획,정보분석,판매원,Fashion,0.7778
기업의 제품 가격결정방법에 대한 설명이 틀린 것은?,1,경쟁제품중심의 가격결정방법-경쟁상품의 가격을 근거로 하여 자사제품의 가격을 경쟁사보다 높게 결정하는 경우는 시장점유율을 높이기 위해 사용되는 방법이다.,가치 중심의 가격결정방법-표적소비자들이 자사제품에 대해 어느 정도의 가치를 부여하는지를 조사하여 이에 상응하는 제품가격을 목표가격으로 설정한 다음 제품디자인 및 생산원가를 계획하는 방법이다.,원가가산 가격결정방법-단위당 원가에 일정률의 마진을 더해 판매가를 결정하는 방법이다.,목표이익 가격결정방법-목표이익을 실현하는 매출 수준에서 제품가격을 결정하는 방법이다.,Fashion,0.8
가격결정의 방법 중 수요기준 가격결정법에 대한 설명이 옳은 것은?,2,제조원가에 판매비와 일반관리비 및 이익 등을 가산하는 방법,생산비의 고저에 관계없이 수요력의 크기에 의해서 결정되는 방법,경쟁사의 가격과 시가에 기준을 두고 결정하는 방법,"판매업자의 마진, 리베이트, 소비자에 대한 상황 등의 요인을 종합하여 결정하는 방법",Fashion,0.0
손익분기점(break-even point)의 의미로 가장 옳은 것은?,1,순이익이 0이 되는 점의 매출액,매출이 일어나는 점,목표이익을 넘어가는 점의 매출액,고정비를 넘어가는 점의 매출액,Fashion,0.8571
"시장 표적화 전략 중 자사의 독특한 이미지를 부각하기 위해 브랜드 이미지, 광고, 디자인 등 부가가치적 측면을 강조하는 것은?",1,차별화 전략,비차별화 전략,시장세분화 전략,집중화 전략,Fashion,1.0
구매행동의 영향요인에 대한 설명으로 틀린 것은?,1,준거집단의 영향력이 클 때 관여 수준이 낮아진다.,구매 관여 수준은 소비자의 구매의사결정에 많은 영향을 미친다.,상표 관여 수준이 높으면 구매 관여 수준도 높아진다.,구매 관여란 소비자가 특정제품의 구매에 부여하는 관심의 정도를 말한다.,Fashion,1.0
단위당 원가에 일정률의 마진을 더해 판매가를 결정하는 가격경정법은?,1,원가기산 가격결정,목표이익 가격결정,소비자중심 가격결정,경쟁제품중심 가격결정,Fashion,1.0
"고객이 원하는 제품과 서비스를 지속적, 체계적으로 제공하여 고객의 가치를 극대화하여 기업의 수익성을 높이고자 하는 패션유통정보는?",1,CRM,SCM,TQM,STP,Fashion,0.6667000000000001
"패션 유통경로 중 상품에 대한 판매와 재고는 유통업체에서 책임지며, 제조회사는 상품기획과 생산만 하는 형태는?",2,위탁판매제도,완사입제도,위탁사입제도,절충사입제도,Fashion,0.0
포괄적 의사결정이 해당되는 구매행동 유형은?,1,고관여 구매형,다양성 추구형,상표충성적 구매형,관성적 반복구매형,Fashion,0.6667000000000001
리테일 머천다이저와 유사 개념으로 상품의 구매계획만을 담당하는 스페셜리스트는?,1,바이어,코디네이터,디자이너,어패럴 머천다이저,Fashion,0.6364
기업의 경쟁형태에 관한 예로서 경쟁형태의 설명으로 옳은 것은?,2,"독점-스판덱스 시장은 A사, B사, C사 등이 시장내에서 유일한 기업들로 시장을 독식하고 있다.","과점-국내 이웃도어 스포츠웨어 업계는 A, B, C, D사에 의해 지배당하고 있으며 사실상 후발업체의 진입이 힘든 상황이다.",독점적 경쟁-A사와 B사와 기능성 스포츠 내의 시장을 독점하고 경쟁을 벌이는 업체들이다.,순수경쟁-비교적 많은 수의 기업이 청바지 시장에 뛰어들어 차별화된 상품으로 치열한 경쟁을 벌이고 있다.,Fashion,0.0
적절한 패션상품과 서비스를 소비자가 원하는 시간과 장소에 적정한 가격으로 공급하기 위해 의류제조업체와 패션 소매상들이 공동으로 실시하는 물류정보시스템은?,3,CAM,POP,QRS,EDI,Fashion,0.0
패션 바이어의 상품 구성으로 옳은 것은?,1,경쟁점포가 밀집된 지역에서는 폭보다 깊이가 우선시 되어야 한다.,경쟁점포가 적고 독점성이 큰 지역에서는 폭보다 깊이가 우선이어야 한다.,독점성이 큰 지역에서는 폭보다는 깊이가 우선되어야 한다.,제품을 중심으로 전문화된 전문점의 경우 폭이 넓은 구성이 필요하다.,Fashion,0.75
머천다이저에 대한 설명 중 틀린 것은?,1,"자기의 독창적인 발상이나 착상을 실현하기 위한 전 과정의 계획, 설계 및 조직을 하는 사람이다.",상품기획 부문의 총괄자로서 생산에서 판매부문에 이르기까지 광범위한 직무 영역을 가지고 새로운 브랜드 개발과 상품기획을 하는 사람이다.,유통업 분야와 제조업 분야에 따라 리테일 머천다이저와 어패럴 머천다이저로 구분된다.,M.D 라고 불리우며 상품 및 취급방법에 관한 책임자를 뜻한다.,Fashion,0.8462000000000001
광고의 4대 매체에 해당되지 않는 것은?,3,잡지,신문,전화,TV,Fashion,0.6
패션머천다이징의 개념을 가장 잘 설명하고 있는 것은?,4,전체 제품시장을 어떤 기준을 이용하여 동질적인 세분시장으로 나누는 과정이다.,"고객들에게 제품을 판매하여 올리는 수익의 일부를 포인트, 적립금, 쿠폰, 현금 등의 형태로 되돌려 줌으로써 소비자의 미래가치를 높이고 기업에 대한 충성도를 지속적으로 유지, 강화하는 마케팅 노력이다.","한 개인의 살아가는 방식으로서, 보통 개인의 활동, 관심, 의견을 의미한다.",표적고객의 욕구를 만족시키기 위하여 패션제품이나 서비스를 적절한 장소와 적절한 시간에 적절한 양과 가격으로 제공하기 위한 상품기획을 말한다.,Fashion,0.6667000000000001
의류업체가 디자인과 총무 업무에 종사하는 직원에게 주는 월급은 제품의 원가구조 중 어디에 해당 하는가?,4,재료비,제조경비,직접노무비,간접노무비,Fashion,0.0
자사브랜드를 중요한 제품속성이나 소비자 편익과 관련시키는 제품포지셔닝 전략은?,1,제품속성에 의한 포지셔닝,사용상황에 의한 포지셔닝,제품사용자에 의한 포지셔닝,이미지에 대한 포지셔닝,Fashion,1.0
기업의 거시적 환경요소에 해당되지 않는 것은?,3,기술(technology),경쟁(competition),공급자(suppliers),인구통계(demography),Fashion,0.0
시장세분화 기준에 대한 설명으로 틀린 것은?,1,각 집단 사이에 마케팅 활동에 대한 탄력성의 차이가 없을 때 타당성 있는 기준이 될 수 있다.,마케팅 활동을 통해 접근이 불가능한 시장은 시장으로서의 가치가 없다.,측정이 불가능한 소비자 집단은 세분화 기준이 될 수 없다.,쉽게 변하고 일관성이 없는 소비자 특성은 세분화의 기준이 될 수 없다.,Fashion,1.0
브랜드를 구성하는 요소 중 발음은 불가능하지만 인식은 가능한 것은?,3,브랜드 네임(brand name),등록상표(trade mark),브랜드마크(brand mark),카피라이트(copyright),Fashion,0.0
"미국의 마케팅 발전과정 중 어떤 제품에 기업의 노력을 집중시킬 것인가, 새로운 상표의 런칭 등에 대한 의사결정을 어떻게 할 것인가 등 기업의 마케팅 활동에 대한 포트폴리오를 중요시하게 된 시기는?",3,판매지향시대,마케팅 컨셉시대,전략적 마케팅시대,마케팅 정보시스템시대,Fashion,0.0
제조회사의 입장에서 본 위탁판매제도의 장점은?,1,"기획에서 생산, 유통을 일괄되게 통제하기 쉽다.",재고부담 없어 이익과 편차가 적다.,상품기획과 생산에만 전념할 수 있어 전문화가 가능하다.,상권 특성에 따른 물량 배분으로 판매를 극대화 할 수 있다.,Fashion,1.0
