question,answer,A,B,C,D,Category,Human Accuracy
보일러의 고장원인으로 틀린 것은?,1,수면계에 수위가 나타난다.,증기에 물이 섞여 나온다.,작동 중불이 꺼진다.,본체에서 증기나 물이 샌다.,Fashion,0.9091
드라이클리닝 마무리기계 중 폼머형에 해당되는 것은?,1,인체프레스,만능프레스,스팀터널,스팀박스,Fashion,0.8462000000000001
얼룩빼기 방법 중 물리적인 방법이 아닌 것은?,3,기계적인 힘을 이용하는 방법,분산법,효소를 사용하는 방법,흡착법,Fashion,0.6154
웨트클리닝 처리방법에 대한 설명 중 틀린 것은?,3,색이 빠지거나 형이 일그러지는 것에 주의해야 한다.,"처리방법에는 솔빨래, 손빨래, 기계빨래, 오염을 닦아내는 것 등이 있다.",대상이 되는 의류는 종류가 많고 성질은 다르나 처리 방법은 모두 같다.,마무리 다림질을 생각하여 형의 망가짐에 유의하여야 한다.,Fashion,0.7143
밀폐형 세정기(hot machine)에 대한 설명 중 틀린 것은?,3,"세정, 탈액, 건조까지 연속적으로 처리된다.",다양한 안전장치가 있다.,세정만 가능하고 탈수는 원심탈수기를 사용한다.,운전조작이 다양한 콘트롤 시스템이다.,Fashion,0.75
경수를 연수로 바꾸는 방법이 아닌 것은?,2,끓이는 법,암모니아를 가하는 법,이온교환수지법,알칼리를 가하는 법,Fashion,0.6875
섬유 감별의 대표적인 방법이 아닌 것은?,4,연소에 의한 방법,현미경에 의한 방법,용해에 의한 방법,두들기는 방법,Fashion,0.7333
면섬유의 정련에 사용할 수 있는 약제로 가장 적당한 것은?,1,수산화나트륨,초산,질산,염산,Fashion,0.7333
섬유가 구비해야 할 조건과 가장 거리가 먼 것은?,2,섬유 상호간에 포합성이 있어야 한다.,굵기가 굵고 균일하여야 한다.,부드러운 성질이 있어야한다.,탄성과 광택이 우수하여야 한다.,Fashion,0.6
완성된 의류에 가공을 하여 형태를 고정시키는 방법은?,1,퍼머넌트 프레스 가공,샌포라이즈 가공,방축가공,방오가공,Fashion,0.7692
직물과 편성물을 비교하였을 때 직물의 특성에 해 당하는 것은?,3,가볍고 부드럽다.,성형성이 좋다.,형태안정성이 있다.,신축성이 좋다.,Fashion,0.6154
양모섬유의 구조에 대한 설명으로 옳은 것은?,1,"섬유의 단면은 원형이고, 겉비늘이 있다.","섬유의 단면은 삼각형이고, 리본 모양이 있다.","섬유의 단면은 5~6각의 다각형이고, 겉비늘이 있다.","섬유의 단면은 원형이고, 리본 모양이 있다.",Fashion,0.8462000000000001
"생피에서 지질이나 결채조직을 떼어내고 남은 가죽부분을 명반, 기름, 크롬 등으로 처리해서 가죽의 부패를 방지하고 유연성을 부여하는 작업은?",4,알칼리처리,효소처리,산처리,무두질,Fashion,0.6923
공중위생영업의 종류별 시설 및 설비기준을 위반한 공중위생영업자에 대하여 즉시 또는 일정한 기간을 정하여 그 개선을 명령할 수 없는 자는?,1,보건복지부장관,시·도지사,시장·군수,구청장,Fashion,0.9286
세탁업자와 소비자 간의 세탁물관리 사고로 인한 분쟁 조정을 위하여 노력해야 하는 곳은?,1,세탁업자단체,보건복지부,의류제조업단체,세탁기제조업단체,Fashion,1.0
셀룰로스 직물에 주로 사용되는 표백제는?,1,아염소산 나트륨,히이드로설파이트,과탄산나트륨,과붕산나트륨,Fashion,0.7105
천연섬유중 세정율이 가장 높은 섬유는?,1,양모,면,마,견,Fashion,0.8571
탄소수소계용제중 드라이크리닝용으로 가장 많이 사용하는 것은?,1,석유계용제,테레빈유,벤젠,데칸,Fashion,0.8462000000000001
진단시 고객으로부터 충분한 정보를 충분히 입수해야 할 내용과 가장관계가 없는 것은?,4,품질표시가 없는 제품,얼룩의 생성동기,고급제품의 구입나라의 번역된 취급표시정보,제품에 사용된 염료의 종류,Fashion,0.6154
드라이클리닝용제의 점검사항이 아닌 것은?,2,투명도,가공제의 탈락유무,불휘발성 잔유물,산가,Fashion,0.6364
의류에 대한 기술진단의 포인트가 아닌 것은?,3,오점,가공표시,부속품,마모,Fashion,0.6333
합성섬유를 착용했을 때 정정기의 발생을 방지하기 의한 가공은?,4,방추가공,방수가공,증백가공,대전방지가공,Fashion,0.8077
고체오점만으로 옳게 나열된 것은?,2,"곰팡이, 겨자 과자","매연, 시멘트, 석고","간장, 술 커피","구두약, 인주, 왁스",Fashion,0.6957
용제청정화 방법이 아닌 것은?,4,여과방법,증류방법,흡착방법,회수방법,Fashion,0.8332999999999999
계면활성제의 성질으로서 틀린 것은?,2,한 개의 분자내에 친수기와 친유기를 가진다.,물과 공기 등에 흡착하여 게면장력을 증가 시킨다.,직물의 습윤효과를 향상시킨다.,직물의 약제에 침투효과를 증가시킨다.,Fashion,0.7391
계면활성제중 세제로 가장 많이 사용되는 계면 활성제는?,3,양성계면활성제,비이온계면활성제,음이온계면활성제,양이온 계면활성제,Fashion,0.6818000000000001
계면활성제의 기본적인 성질과 직접관계 하는 작용이 아닌 것은?,4,습윤작용,침투작용,분산작용,살균작용,Fashion,0.7143
곰팡이 방지 방법으로 틀린 것은?,4,옷의 더러움을 깨끗이 없앤다.,의류을 충분히 건조시킨다.,비닐포장 내부의 산소를 제거하는 포장법을 이용한다.,보관장소의 습도를 높게하고 온도를 20~30℃ 정도로 유지한다.,Fashion,0.7726999999999999
양이온계면활성제의 용도로 가장적당하지 않은 것은?,1,세척제,발수제,유화제,대전방지제,Fashion,0.7726999999999999
수관보일러의 형식에 해당 되는 것은?,1,관류식,입식,노통,연관,Fashion,0.9524
헹굼후에도 남아있는 알칼리를 중화하여 섬유의 황변을 방지하고 금속비누와 표백제를 분해하면 철분 등 산에 녹는 오점을 용해제거하는 것은?,1,산욕,본세탁,탈수,풀먹임,Fashion,0.913
세탁기의 수류방식에 따른 형식에 해당되지 않는 것은?,1,빨래식,드럼식,와류식,교반식,Fashion,0.7826000000000001
론드리의 특징으로 틀린 것은?,4,알카리제를 사용하므로 오점이 잘빠진다.,표백이나 풀먹임이 효과적이면 용이하다.,와셔는 원통형이므로 의류가상하지 않는다.,마무리에 상당한시간과 기술이 필요없다.,Fashion,0.6667000000000001
론드리에서 건조시 주의점으로 틀린 것은?,3,화학섬유의 경우는 수축.황변되기 쉬우므로 60℃이하에서 건조시킨다.,가열을 정지시킨 후라도 텀부링안에 물품을 방치해서는 안된다.,저온의 경우 회전통에 넣는 양을 많게한다.,비닐론 제품은 젖은 상태로 다림질하는 것을 피한다.,Fashion,0.6087
손빨래 중 세탁효과가 좋고 노력이 적게드는 것은?,3,흔들어 빨기,주물려 빨기,두들겨 빨기,눌려 빨기,Fashion,0.6364
석유계용제용 드라이클리닝에 대한설명으로 틀린 것은?,1,사용한 용제을 계속하여 사용할 수 있다.,대부분 증류장치 없이 여과하여 사용한다.,일반적으로 세타온도는 20~30℃에서 20~30분동안 세탁한다.,인화성리 있어 용제의 보관과 취급에 주의해야 한다.,Fashion,0.6818000000000001
물세탁의 본세탁 공정에세 세제와 조제의 ph는 얼마로 유지해야 하는가?,4,ph 4~5,ph 6~7,ph 8~9,ph 10~11,Fashion,0.85
천연동물성 섬유에 대한세탁방법으로 틀린 것은?,2,양모직물은 드라이클리닝이 안전하다.,견직물은 드라이클리니닝이 금지되어 있다.,양모직물은 중성세제을 사용한다.,견직물은 세탁용수을 연수로 사용한다.,Fashion,0.6364
가죽처리공정 중 가죽의 촉감 향상을 위하여 털과 표피층의 제거 불필요한 단백질의 제거 지방과 기름 등을 제거하는 공정은?,4,유성,산에 담그기,회분빼기,석회침지,Fashion,0.6957
표시의 분류 중 조성표시의 설명으로 옳은 것은?,1,섬유소재명과 혼용율을 표시한 것,수축률 난연성 등의 성능을 표시한 것,크기와 같은 치수를 표시한 것,방염가공 등의가공한 것을 표시한 것,Fashion,0.9545
평직에 대한설명으로 옳은 것은?,3,사문직이라고도 한다.,조직점이 적어서 유연하다.,경사와 위사가 한올씩 상하교대로 교차되어 있다.,표면이 매끄럽고 광택이 좋다.,Fashion,0.8
면섬유의 공정수분율은?,2,0.4%,8.5%,12%,18.25%,Fashion,0.8571
폴리에스테르섬유의 염색에 가장 많이 사용되고 있는 염료는?,4,직접염료,염기성 염료,산성염료,분산염료,Fashion,0.6667000000000001
여름에 삼베옷을 입으면 시원한 느낌을 주는 가장 큰 이유는?,3,가볍기 때문,흡습성이 크기 때문,열전도성이 좋기 때문,촉감이 까칠 까칠하기 때문,Fashion,0.8462000000000001
면섬유에세 섬유소내의 탈수작용으로 분해가 시작되는 온도는?,1,160℃,180℃,250℃,320℃,Fashion,0.6087
부직포의 특성으로 옳은 것은?,2,방향성이 있다.,절단부분이 풀리지 않는다.,합기량이 적다.,내구성이 좋다.,Fashion,0.7391
공중위생관리법의 궁극적인 목적에 해당되는 것은?,1,국민의 건강증진에 기여,위생관리서비스 향상에 노력,종사자의 기술수준 향상,종사자의 복리증진,Fashion,0.8636
세탁용 기계의 안전관리를 위하여 밀폐형이거나 용제회수기가 부착된 세탁용 기계를 사용하여야 할 세제의 종류가 아닌 것은?,3,트리클로로에탄,퍼클로로에칠렌,석유계용제,불소계용제,Fashion,0.7273000000000001
세탁업자가 준수하여야할 위생관리기준으로 틀린 것은?,3,드라이클리닝용 세탁기는 유기용제의 누출이 없도록 항상 점검하여야 한다.,세탁물에는 세탁물처리에 사용된 세제.유기용제 또는 얼룩제거 약제가 남지 않도록 해야한다.,"출입, 검사 등의 기록부를 영업소밖에 비치하여야 한다.",업소에 보관중인 세탁물에 좀이나 곰팡이등이 생성되지 않도록 위생적으로 괄하여야한다.,Fashion,0.7
공중위생업을 하고자 하는 자가 신고를 하지 아니한자에 해당되는 벌칙은?,2,3년이하의 징역 또는 1천만원이하의 벌금,1년이하의 징역 또는 1천만원이하의 벌금,6월이하의 징역 또는 500만원이하의 벌금,6월이하의 징역 또는 100만원이하의 벌금,Fashion,0.7619
공중위생업을 하고자 하는 자가 신고해야할 대상자가 아닌 것은?,1,도지사,시장,군수,구청장,Fashion,0.7273000000000001
형광증백제에 대한 설명 중 옳은 것은?,1,형광증백제는 섬유상에 과도하게 염착되면 오히려 나쁜 효과가 생길 수도 있다.,대부분의 형광증백제는 염소계 표백제에 의해 증백능력을 상실한다.,증백효과는 증백제의 양에 따라 비례한다.,형광증백제는 섬유에 흡착되어 가시광선을 흡수하고 청색계 자외선을 복사한다.,Fashion,0.8332999999999999
세제에 첨가되어 있는 표백제는?,1,과탄산나트륨,과산화수소,황산,셀룰로스,Fashion,0.6842
가장 전문적 진단이 필요한 특수가공 제품은?,1,"모피, 피혁 제품",안료 제품,날염 제품,합성섬유 제품,Fashion,1.0
보일러의 부피를 일정하게 유지하고 증기의 온도를 상승 시켰을 때 압력의 변화는?,3,일정하다.,감소한다.,상승한다.,압력과 관계없다.,Fashion,0.6667000000000001
론드리에 가장 많이 쓰이는 표백제는?,3,과망간산칼륨,과산화수소,차아염산 나트륨,하이드로설파,Fashion,0.6111
세정액의 청정장치에 관한 설명 중 틀린 것은?,2,"종류로는 필터식, 청정통식, 카트리지식, 증류식 등이 있다.",스프링 필터의 용제는 튜브의 외부로부터 펌프 압력으로 필터 안으로 들어갈 때 청정화 한다.,리프 필터의 모양은 8~10매씩 나란히 세운 것이 1세트이다.,튜브 필터의 구조는 가는 철사망 으로 짠 원통형이다.,Fashion,0.625
보일러의 고장이 아닌 것은?,3,수면계의 수위가 나타나지 않는다.,보일러의 본체에서 증기나 물이 샌다.,부글부글 물이 끓는 소리가 난다.,작동 중 불이 꺼진다.,Fashion,0.6667000000000001
용제관리의 목적이 아닌 것은?,4,물품을 상하지 않게 한다.,재 오염을 방지한다.,세정효과를 높인다.,정전기 발생을 방지한다.,Fashion,0.7333
웨트크리닝의 대상이 아닌 것은?,4,합성수지 제품,수지안료 가공제품,고무를 입힌 제품,슈트나 한복,Fashion,0.6875
피혁제품의 세탁에 대한 설명 중 틀린 것은?,1,파우더 클리닝을 하는 것이 효과적이다.,물품에 따라 처리 시간을 조절한다.,탈지성이 적은 용제를 사용하는 것이 좋다.,세탁을 하면 원래 품질보다 떨어지게 된다.,Fashion,0.6
론드리 세탁방법의 설명 중 틀린 것은?,4,마직물로 된 백색 세탁물의 백도를 회복시키기 위한 고온 세탁방법이다.,"수지 가공 면직물이나 면 폴리에스터 혼방 물, 염색물의 중온 세탁방법이다.",용수가 절약되고 세탁물의 손상이 비교적 적다.,표면 처리된 피혁제품의 세탁방법이다.,Fashion,0.6429
의복의 기능에 해당 되지 않은 것은?,4,위생상성능,관리적 성능,실용적인 성능,감수성의 성능,Fashion,0.6429
"핫머신이라고 하며 합성용제를 사용하여 세척, 탈액, 건조까지 연속으로 처리되는 세탁기계?",2,준 밀폐형 세탁기,밀폐형 세탁기,자동 론드리 세탁기,개방형 세탁기,Fashion,0.625
단백질 전분 등의 얼룩을 단백질 분해효소로서 제거하는 화학적 얼룩빼기 방법은?,4,표백제법,알카리법,산법,효소법,Fashion,0.6875
론드리에서 백색 의류에 형광염료가 떨어졌다면 이것이 원인이 되는 공정은?,1,본 세탁,산욕,건조,헹굼,Fashion,0.75
웨트크리닝 처리 법중 탈수와 건조의 설명으로 틀린 것은?,2,탈수 시 형의 망가짐에 유의하고 가볍게 원심 탈수한다.,늘어날 위험이 있는 것은 둥글게 말아서 말린다.,색빠짐에 우려가 있는 것은 타올에 싸서 가볍게 손으로 눌러 짠다.,가급적 자연 건조한다.,Fashion,0.6875
기계마무리의 주의 점으로 틀린 것은?,4,비닐론은 충분히 건조시켜서 마무리한다.,마무리 할 때 증기를 쏘이면 수축과 늘어남의 우려가 있다.,플리츠 가공된 것은 스팀터널이나 스팀박스에 넣으면 주름이 소실 될 수 있다.,"고무벨트를 이용한 바지, 스커트는 다리미로 마무리해도 관계없다.",Fashion,0.6667000000000001
나이론 섬유의 성질로서 틀린 것은?,4,강도가 크다.,신도가 크다.,열가소성이 좋다.,내 일광성이 크다.,Fashion,0.5882000000000001
섬유의 분류에서 인피섬유에 해당되지 않은 것은?,1,면,대마,아마,모시,Fashion,0.9375
위사와 경사를 조합해서 만든 피륙은?,1,직물,편성물,레이스,브레이드,Fashion,0.8
크리리닝 대상품을 분류한 것 중 틀린 것은?,4,모포-모포류,사무복-작업복류,오버-코트류,방석카바-시트류,Fashion,0.6667000000000001
성인남자 긴소매드레스 셔츠의 염색견뢰도 중 마찰견뢰도의 기준으로 옳은 것은?,3,"건-3급 이상, 습-3급 이상","건-3급 이상, 습-4급 이상","건-4급 이상, 습-3급 이상,","건-4급 이상, 습-4급 이상",Fashion,0.75
파스너의 취급설명 중 틀린 것은?,1,클리닝 및 프레스 할 때 에는 파스너를 열어놓은 상태에서 한다.,슬라이더의 손잡이를 정상으로 해놓고 프레스 한다.,슬라이더에 직접 다림질 하지 않는다.,프레스 온도는 130도 이하로 유지한다.,Fashion,1.0
탄성회복이 나빠서 구김이 가장 잘 생기는 섬유는?,3,양모,견,아마,나이론,Fashion,0.6
공중위생법령에 따라 공중위생영업을 신고 할 때 신고를 받는 자가 아닌 것은?,1,도지사,시장,군수,구청장,Fashion,0.8571
공중 위생업자는 영업소 폐쇄명령이 있은 후 몇 개월이 경과하지 아니 할 때에는 누구든지 그 폐쇄명령이 이루어진 영업장소에서 같은 종류의 영업을 할 수 없는가?,3,1개월,3개월,6개월,12개월,Fashion,0.7143
재오염에 관한 설명 중 틀린 것은?,1,세정액은 계속적으로 청정화시키면서 반복 사용하기 때문에 오염물질이 용제 중에 축적 되지 않는다.,재오염이란 의류가 세정과정에서 용제 중에 분산된 더러움이 의류에 다시 부착되는 현상이다.,소프를 사용하면 세정력이 강화되고 재오염을 저하시킨다.,흡착에 의한 재오염은 깨끗한 용제로 헹구어도 제거 가 어려운 경우가 많다.,Fashion,1.0
퍼클로로에틸렌의 특성 중 틀린 것은?,4,독성이 크다.,"인화, 폭발의 위험성이 없다.",세척력이 석유계 용제에 비해 우수하다.,섬세한 고급 의복에 적합하다.,Fashion,0.6111
과산화수소를 사용했을 때 표백효과가 가장 큰 섬유는?,1,모,면,아세테이트,아크릴,Fashion,0.7778
보일러의 분류 중 원통 보일러에 해당되는 것은?,2,자연순환식 수관보일러,노통연관 보일러,강제순환식 수관보일러,관류 보일러,Fashion,0.6
계면활성제에 대한 설명 중 틀린 것은?,1,물의 표면장력을 증가시켜 준다.,친수기와 친유기를 함께 가지고 있다.,직물에 묻은 오염물질을 유화 분산시킨다.,기포성을 증가하고 세척작용을 향상시킨다.,Fashion,0.8824
보일러 사용 시 불완전연소에 의하여 발생하는 성분으로 옳은 것은?,1,"아황산가스, 일산화탄소, 그을음과 분진","일산화탄소, 과산화수소, 그을음과 분진","아황산가스, 일산화탄소, 차아염소산나트륨","아황산가스, 그을음과 분진, 퍼클로로에틸렌",Fashion,1.0
섬유의 재가공 시 섬유를 부드럽게 하여 착용감을 높이려는 방법은?,2,방추 가공,유연 가공,방오 가공,표백 가공,Fashion,0.6154
계면활성제의 분자구조는?,1,소수성 부분과 친수성 부분으로 되어 있다.,소수성 부분으로만 되어 있다.,친수성 부분으로만 되어 있다.,소수성 부분과 친유성 부분으로 되어 있다.,Fashion,0.9167
용제별 드라이클리닝 처리방법 중 세정의 온도는 20~30℃가 적당하며 35℃ 이상은 화재의 위험이 있어 방폭설비를 갖추어야 하는 것은?,1,석유계,퍼클로로에틸렌,불소계,1.1.1 트리클로로에탄,Fashion,0.9167
"용제의 재오염률 측정결과 원포 반사율이 45, 세정 후 반사율이 43.5일 때 재오염률은?",2,3.03%,3.33%,2.25%,3.92%,Fashion,0.6
세탁 후 비누를 깨끗이 헹구는 방법으로 옳은 것은?,1,세탁 온도와 같은 물로 헹군다.,"세탁은 뜨거운 물로, 헹굼은 찬물로 한다.",삶은 세탁물을 식히기 위해 찬물로 헹군다.,"찬물로 세탁하고, 찬물로 헹군다.",Fashion,0.9091
세탁물의 접수점검 시 진단해야 할 사항과 가장 거리가 먼 것은?,3,"카운터에서 고객과 함께 진단하고, 처방지에 주의점을 기입한다.","얼룩, 변색, 흠, 형태 변화 등과 클리닝의 대상 여부를 판별한다.","세탁기의 본체와 부속품을 체크하고, 세탁방법을 분류한다.","얼룩의 종류와 부착시기, 그리고 세탁물에 대한 정보를 알아본다.",Fashion,0.7273000000000001
"용제, 세제 등을 사용하여 의류, 기타 섬유제품이나 피혁제품 등을 원형에 가깝게 세탁 하는 것은?",2,재오염 방지 처리,클리닝,얼룩빼기,정련 및 표백,Fashion,0.7273000000000001
드라이클리닝의 일반적인 특성에 대한 설명으로 틀린 것은?,4,기름의 얼룩을 잘 제거한다.,특수 의류의 진단과 처리기술이 필요하다.,용제의 회수장치가 필요하다.,빠진 얼룩이 재오염되지 않는다.,Fashion,0.6364
세탁의 마무리 목적을 설명한 것 중 틀린 것은?,3,옷감의 형태를 바로 잡아 원형으로 회복시킨다.,디자인 또는 실루엣의 기능을 회복시킨다.,스티밍은 수분과 열에 의하여 의복소재에 가소성을 제거한다.,살균 및 소독을 한다.,Fashion,0.6364
얼룩빼기 방법 및 약품사용에 대한 설명 중 옳은 것은?,4,아세테이트 섬유는 질겨서 어느 약품을 사용해도 손상이 없다.,"산성 약제로는 과산화수소, 수산, 올레인산등이 있다.",알칼리성 얼룩은 알칼리성 약품으로만 뺀다.,"쇠 녹의 얼룩은 수산으로 제거하고, 암모니아로 헹구어 중화하는 것이 바람직하다.",Fashion,0.7
세탁물의 종류와 성질에 따라 섬유가 손상되지 않도록 와셔(washer)에서 온수 알칼리제를 섞어 세정하는 작업은?,2,산욕,본 빨래,드라이클리닝,헹굼,Fashion,0.6667000000000001
산욕 작용의 효과 중 틀린 것은?,3,천에 남아 있는 알칼리를 중화한다.,"의류를 살균, 소독한다.",더러운 오염을 깨끗이 제거한다.,"천에 광택을 주고 황변을 방지하고, 산가용성의 얼룩을 제거한다.",Fashion,0.6667000000000001
세탁 후 마무리하는 기계가 아닌 것은?,4,만능프레스,인체 프레스,팬츠 토퍼,스파팅 머신,Fashion,0.6667000000000001
다림질한 벨벳 바지가 파일이 눕고 번들거리는 현상이 나타나는 원인과 관계없는 것은?,4,다리미의 강한 압력 때문이다.,천을 덮고 다리지 않아서이다.,바큠(흡입)이 너무 강해서이다.,바큠을 끄고 천을 덮고 다려서이다.,Fashion,0.6
아마 섬유의 성질 중 틀린 것은?,4,열의 양도체이므로 시원한 감을 준다.,내구력이 풍부하고 내세탁성이 우수하다.,화학 약품에 대해서는 무명 섬유와 비슷하다.,표백제에 의해 쉽게 손상되지 아니한다.,Fashion,0.7
직물의 3원 조직은?,1,"평직, 능직(사문직), 주자직(수자직)","평직, 능직(사문직), 사직","주자직(수자직), 능직(사문직), 익조직","평직, 능직(사문직), 평편조직",Fashion,1.0
직물에 처리하는 샌포라이징(sanforizing) 가공이란 어떤 목적으로 행하는 가공인가?,1,"습기나 물, 세탁 등에 의해 직물이 수축되는 것을 방지하기 위하여",사용 중 옷감이 구겨지는 것을 방지하기 위하여,보관 중 섬유제품이 해충에 의해 손상되는 것을 방지하기 위하여,곰팡이의 발생을 방지하기 위하여,Fashion,0.8181999999999999
아세테이트 섬유의 염색에 적합한 염료는?,3,산성 염료,직접 염료,분산 염료,배트 염료,Fashion,0.6
가죽처리 공정에서 회분 빼기에 해당 되는 것은?,2,"가죽제품이 깨끗하고 염색이 잘 되게 은면에 남아있는 모근, 지방 또는 상피층의 분해물을 제거하는 것이다.","석회에 담그기가 끝난 제품은 알칼리가 높아 가죽재료로 사용하기가 부적당함으로 산, 산성염 등으로 중화시키는 것이다.","가죽의 촉감향상을 위하여 털과 표피층의 제거, 불필요한 단백질 제거 지방화 기름 등을 제거하는 것이다.",산을 가하여 산성화하여 가죽을 부드럽게 하는 것이다.,Fashion,0.6
면직물에 사용되는 염료 중 일반적으로 염색 견뢰도가 가장 우수한 것은?,1,배트 염료,직접 염료,산성 염료,반응성 염료,Fashion,0.8
면섬유를 구성하고 있는 주성분은?,1,셀룰로스(cellulose),피브로인 (fibroin),케라틴 (keratin),세리신(sericin),Fashion,1.0
명주섬유의 특성 설명 중 옳은 것은?,2,열에 대하여 양털보다는 매우 약하다.,다른 섬유에 비해 일광에는 약한 편이다.,흡습성이 불량하여 공정수분율은 2% 정도이다.,섬유장은 긴편이나 탄성회복률이 매우 불량하다.,Fashion,0.7
가죽에서 표피층 아래 부분으로 원피 두께의 50% 이상을 차지하며 제혁작업 후 최종 까지 남아서 피혁이 되는 중요한 부분은?,1,진피,표피,피하조직,하이드,Fashion,1.0
"면섬유의 물리적, 화학적 성질 설명으로 틀린 것은?",4,수분을 흡수하면 강도와 신도가 증가한다.,"면섬유의 염색에는 직접염료, 배트염료, 반응성 염료가 주로 사용된다.",내열성이 좋아 다림질 온도가 높다.,"산에는 비교적 강하고, 알칼리에는 약하다.",Fashion,0.7778
고무처럼 자유로이 신축하는 성질을 가진 것으로 스판덱스라고도 부르는 섬유는?,2,폴리에스테르계 섬유,폴리우레탄계 섬유,폴리아미드계 섬유,폴리아크릴로니트릴계 섬유,Fashion,0.7778
세탁업을 개설하려면 시설 및 설비를 갖추어 누구에게 신청하여야 하는가?,3,보건복지가족부장관,"시장, 도지사","시장, 군수, 구청장",환경부장관,Fashion,0.7778
세탁업소의 위생관리 의무를 지키지 아니하였을 경우 과태료 금액은?,3,80만 원 이하,100만 원 이하,200만 원 이하,300만 원 이하,Fashion,0.6667000000000001
