question,answer,A,B,C,D,Category,Human Accuracy
비점성 유체에 대한 설명으로 옳은 것은?,3,유체유동 시 마찰저항이 존재하는 유체이다.,실제유체를 뜻한다.,유체유동 시 마찰저항이 유발되지 않는 유체를 뜻한다.,전단응력이 존재하는 유체흐름을 뜻한다.,Gas Technology and Engineering,0.8293
"U자 Manometer에 수은(비중 13.6)과 물(비중1)이 채워져 있고 압력계 읽음이 R＝32.7㎝일 때 양쪽 단에서 같은 높이에 있는 물 내부 두 점에서의 압력차는? (단, 물의 밀도는 1000㎏/m3이다.)",4,40400㎏f/cm2,40.4㎏f/cm2,40.4 N/m2,40400 N/m2,Gas Technology and Engineering,0.5313
관속의 난류흐름에서 관 마찰계수 f는?,3,레이놀즈수에만 관계없고 상대조도만의 함수이다.,레이놀즈수만의 함수이다.,레이놀즈수와 상대조도의 함수이다.,프루우즈수와 마하수의 함수이다.,Gas Technology and Engineering,0.7273000000000001
"지름이 0.1m인 관에 유체가 흐르고 있다. 임계레이놀즈수가 2100이고, 이에 대응하는 임계유속이 0.25 m/s이다. 이 유체의 동점성 계수는 약 몇 cm2인가?",2,0.095,0.119,0.354,0.454,Gas Technology and Engineering,0.7143
"단면적 0.5m2의 원관 내를 유량 2m3/s, 압력 2㎏f/cm2로 물이 흐르고 있다. 이 유체의 전수두는? (단, 위치수두는 무시하고 물의 비중량은 1000㎏f/m3이다.)",2,18.8m,20.8m,22.4m,24.4m,Gas Technology and Engineering,0.5714
최대안전틈새의 범위가 가장 적은 가연성가스의 폭발 등급은?,3,A,B,C,D,Gas Technology and Engineering,0.76
층류연소속도에 대한 설명으로 가장 거리가 먼 것은?,2,층류연소속도는 혼합기체의 압력에 따라 결정된다.,층류연소속도는 표면적에 따라 결정된다.,층류연소속도는 연료의 종류에 따라 결정된다.,층류연소속도는 혼합기체의 조성에 따라 결정된다.,Gas Technology and Engineering,0.5918
내부에너지의 정의는 어느 것인가?,1,(총에너지)-(위치에너지)-(운동에너지),(총에너지)-(열에너지)-(운동에너지),(총에너지)-(열에너지)-(위치에너지)-(운동에너지),(총에너지)-(열에너지)-(위치에너지),Gas Technology and Engineering,0.7273000000000001
화염의 안정범위가 넓고 조작이 용이하며 역화의 위험이 없으며 연소실의 부하가 적은 특징을 가지는 연소 형태는?,2,분무연소,확산연소,분해연소,예혼합연소,Gas Technology and Engineering,0.5532
"0.3g의 이상기체가 750㎜Hg, 25℃에서 차지하는 용적이 300mL이다. 이 기체 10g 이 101.325kPa에서 1L가 되려면 온도는 약 몇℃가 되어야 하는가?",1,-243℃,-30℃,30℃,298℃,Gas Technology and Engineering,0.6667000000000001
실내화재 시 연소열에 의해 천정류(Ceiling Jet)의 온도가 상승하여 600℃ 정도가 되면 천정류에서 방출되는 복사열에 의하여 실내에 있는 모든 가연물질이 분해되어 가연성 증기를 발생하게 됨으로써 실재 전체가 연소하게 되는 상태를 무엇이라 하는가?,2,발화(Ignition),전실화재(Flash Over),화염분출(Flame gushing),역화(Back Draft),Gas Technology and Engineering,0.8913
어떤 카르노 기관이 4186KJ의 열을 수취하였다가 2512KJ의 열을 배출한다면 이동력기관의 효율은 약 얼마인가,2,20%,40%,67%,80%,Gas Technology and Engineering,0.7568
"펌프의 실양정(m)을 h, 흡입실양정을 h1, 송출실양정을 h2라 할 때 펌프의 실양정 계산식을 옳게 표시한 것은?",3,ℎ＝ℎ2 - ℎ1,ℎ＝(ℎ2 - ℎ1) / 2,ℎ＝ℎ2＋ℎ1,ℎ＝(ℎ2 + ℎ1) / 2,Gas Technology and Engineering,0.6731
조정압력이 3.3kPa 이하인 조정기의 안전장치의 작동표준 압력은?,3,3kPa,5kPa,7kPa,9kPa,Gas Technology and Engineering,0.48
초저온용기의 단열재의 구비조건으로 가장 거리가 먼 것은?,1,열전도율이 클 것,불연성일 것,난연성일 것,밀도가 작을 것,Gas Technology and Engineering,0.7646999999999999
가스액화분리장치를 구분할 경우 구성요소에 해당되지 않는 것은?,1,단열장치,냉각장치,정류장치,불순물 제거장치,Gas Technology and Engineering,0.5832999999999999
자동절체식 조정기를 사용할 때의 장점에 해당하지 않는 것은?,4,잔류액이 거의 없어질 때까지 가스를 소비할 수 있다.,전체 용기의 개수가 수동절체식보다 적게 소요된다.,용기교환 주기를 길게 할 수 있다.,일체형을 사용하면 다단 감압식보다 배관의 압력손실을 크게 해도 된다.,Gas Technology and Engineering,0.5909
독성가스 제조설비의 기준에 대한 설명 중 틀린 것은?,3,독성가스 식별표시 및 위험표시를 할 것,배관은 용접이음을 원칙으로 할 것,유지를 제거하는 여과기를 설치할 것,가스의 종류에 따라 이중관으로 할 것,Gas Technology and Engineering,0.6
나프타(Naphtha)에 대한 설명으로 틀린 것은?,4,비점 200℃ 이하의 유분이다.,파라핀계 탄화수소의 함량이 높은 것이 좋다.,도시가스의 증열용으로 이용된다.,헤비 나프타가 옥탄가가 높다.,Gas Technology and Engineering,0.8261
"피스톤의 지름 : 100㎜, 행정거리 : 150㎜, 회전수 : 1200rpm, 체적효율 : 75%인 왕복압축기의 압출량은?",2,0.95m3/min,1.06m3/min,2.23m3/min,3.23m3/min,Gas Technology and Engineering,0.7105
액화석유가스집단공급소의 저장탱크에 가스를 충전하는 경우에 저장탱크 내용적의 몇 %를 넘어서는 아니 되는가?,4,60%,70%,80%,90%,Gas Technology and Engineering,0.7381
LPG수송관의 이음부분에 사용할 수 있는 패킹재료로 가장 적합한 것은?,4,목재,천연고무,납,실리콘 고무,Gas Technology and Engineering,0.8222
"산소용기의 내압시험 압력은 얼마인가? (단, 최고충전압력은 15MPa이다.)",3,12MPa,15MPa,25MPa,27.5MPa,Gas Technology and Engineering,0.6977
가스와 공기의 열전도도가 다른 특성을 이용하는 가스검지기는?,1,서머스태트식,적외선식,수소염 이온화식,반도체식,Gas Technology and Engineering,0.7556
터보형 압축기에 대한 설명으로 옳은 것은?,3,"기체흐름이 축방향으로 흐를 때, 깃에 발생하는 양력으로 에너지를 부여하는 방식이다.",기체흐름이 축방향과 반지름방향의 중간적 흐름의 것을 말한다.,"기체흐름이 축방향에서 반지름방향으로 흐를 때, 원심력에 의하여 에너지를 부여하는 방식이다.",한 쌍의 특수한 형상의 회전체의 틈의 변화에 의하여 압력에너지를 부여하는 방식이다.,Gas Technology and Engineering,0.5909
가스배관 내의 압력손실을 작게 하는 방법으로 틀린 것은?,1,유체의 양을 많게 한다.,배관 내면의 거칠기를 줄인다.,배관 구경을 크게 한다.,유속을 느리게 한다.,Gas Technology and Engineering,0.7391
CNG충전소에서 천연가스가 공급되지 않는 지역에 차량을 이용하여 충전설비에 충전하는 방법을 의미하는 것은?,3,Combination Fill,Fast/Quick Fill,Mother/Daughter Fill,Slow/Time Fill,Gas Technology and Engineering,0.7143
위험장소를 구분할 때 2종 장소가 아닌 것은?,3,밀폐된 용기 또는 설비 안에 밀봉된 가연성 가스가 그 용기 또는 설비의 사고로 인해 파손되거나 오조작의 경우에만 누출할 위험이 있는 장소,확실한 기계적 환기조치에 따라 가연성가스가 체류하지 않도록 되어 있으나 환기장치에 이상이나 사고가 발생한 경우에는 가연성가스가 체류하여 위험하게 될 우려가 있는 장소,상용상태에서 가연성가스가 체류하여 위험하게 될 우려가 있는 장소,1종장소의 주변 또는 인접한 실내에서 위험한 농도의 가연성가스가 종종 침입할 우려가 있는 장소,Gas Technology and Engineering,0.5854
독성가스인 포스겐을 운반하고자 할 경우에 반드시 갖추어야 할 보호구 및 자재가 아닌 것은?,4,방독마스크,보호장갑,제독제 및 공구,소화설비 및 공구,Gas Technology and Engineering,0.8095
아세틸렌을 용기에 충전할 때의 충전 중의 압력은 얼마이하로 하여야 하는가?,4,1MPa 이하,1.5MPa 이하,2MPa 이하,2.5MPa 이하,Gas Technology and Engineering,0.5897
액화석유가스 취급에 대한 설명으로 옳은 것은?,4,자동차에 고정된 탱크는 저장탱크 외면으로부터 2m이상 떨어져 정지한다.,소형용접용기에 가스를 충전할 때에는 가스압력이 40℃에서 0.62MPa 이하가 되도록 한다.,충전용 주관의 모든 압력계는 매년 1회 이상 표준이 되는 압력계로 비교 검사한다.,공기 중의 혼합비율이 0.1v%상태에서 감지 할 수 있도록 냄새나는 물질(부취제)을 충전한다.,Gas Technology and Engineering,0.5128
액화가스를 충전하는 차량의 탱크 내부에 액면 요동 방지를 위하여 설치하는 것은?,3,콕크,긴급 탈압밸브,방파판,충전판,Gas Technology and Engineering,0.7895
상용압력이 40.0MPa의 고압가스설비에 설치된 안전밸브의 작동 압력은 얼마인가?,4,33MPa,35MPa,43MPa,48MPa,Gas Technology and Engineering,0.6585
LPG 용기 보관실의 바닥면적이 40m2이라면 환기구의 최소 통풍가능 면적은?,3,10000cm2,11000cm2,12000cm2,13000cm2,Gas Technology and Engineering,0.7674
시안화수소의 안전성에 대한 설명으로 틀린 것은?,1,순도 98% 이상으로서 착색된 것은 60일을 경과할 수 있다.,"안정제로는 아황산, 황산 등을 사용한다.",맹독성가스이므로 흡수장치나 재해방지장치를 설치해야 한다.,1일 1회 이상 질산구리벤젠지로 누출을 검지해야 한다.,Gas Technology and Engineering,0.8205
"산소기체가 30L의 용기에 27℃, 150atm으로 압축 저장되어 있다. 이 용기에는 약 몇 ㎏의 산소가 충전되어 있는가?",1,5.9,7.9,9.6,10.6,Gas Technology and Engineering,0.6970000000000001
고압가스 냉동제조시설에서 냉동능력 20 ton 이상의 냉동설비에 설치하는 압력계의 설치기준으로 옳지 않은 것은?,3,압축기의 토출압력 및 흡입압력을 표시하는 압력계를 보기 쉬운 곳에 설치한다.,강제윤활방식인 경우에는 윤활압력을 표시하는 압력계를 설치한다.,강제윤활방식인 것은 윤활유 압력에 대한 보호장치가 설치되어 있는 경우 압력계를 설치한다.,발생기에는 냉매가스의 압력을 표시하는 압력계를 설치한다.,Gas Technology and Engineering,0.75
고압가스 충전용기의 차량 운반 시 안전대책으로 옳지 않은 것은?,3,충격을 방지하기 위해 와이어로프 등으로 결속한다.,"염소와 아세틸렌 충전용기는 동일차량에 적재, 운반하지 않는다.",운반 중 충전용기는 항상 56℃ 이하를 유지한다.,독성가스 중 가연성가스와 조연성가스는 동일 차량에 적재하여 운반하지 않는다.,Gas Technology and Engineering,0.8718
액화석유가스 충전시설의 안전유지기준에 대한 설명으로 틀린 것은?,2,저장탱크의 안전을 위하여 1년에 1회 이상 정기적으로 침하 상태를 측정한다.,소형저장탱크 주위에 있는 밸브류의 조작은 원칙적으로 자동조작으로 한다.,소형저장탱크의 세이프티커플링의 주밸브는 액봉방지를 위하여 항상 열어둔다.,가스누출검지기와 휴대용 손전등은 방폭형으로 한다.,Gas Technology and Engineering,0.6923
내용적이 50L이상 125L 미만인 LPG용 용접용기의 스커트 통기 면적은?,4,100mm2 이상,300mm2 이상,500mm2 이상,1000mm2 이상,Gas Technology and Engineering,0.5135000000000001
충전된 가스를 전부 사용한 빈 용기의 밸브는 닫아두는 것이 좋다. 주된 이유로서 가장 거리가 먼 것은?,3,외기 공기에 의한 용기 내면의 부식,용기 내 공기의 유입으로 인해 재충전 시 충전량 감소,용기의 안전밸브 작동 방지,용기 내 공기의 유입으로 인한 폭발성 가스의 형성,Gas Technology and Engineering,0.6585
기체 크로마토그래피에서 분리도(Resolution)와 컬럼 길이의 상관관계는?,1,분리도는 컬럼 길이의 제곱근에 비례한다.,분리도는 컬럼 길이에 비례한다.,분리도는 컬럼 길이의 2승에 비례한다.,분리도는 컬럼 길이의 3승에 비례한다.,Gas Technology and Engineering,0.7
반도체식 가스누출 검지기의 특징에 대한 설명을 옳은 것은?,3,안정성은 떨어지지만 수명이 길다.,가연성 가스 이외의 가스는 검지할 수 없다.,소형·경량화가 가능하며 응답속도가 빠르다.,미량가스에 대한 출력이 낮으므로 감도는 좋지 않다.,Gas Technology and Engineering,0.8636
"습한 공기 205㎏ 중 수증기가 35㎏ 포함되어있다고 할 때 절대습도[㎏/㎏]는? (단, 공기와 수증기의 분자량은 각각 29, 18로 한다.)",1,0.206,0.171,0.128,0.106,Gas Technology and Engineering,0.5832999999999999
단위계의 종류가 아닌 것은?,2,절대단위계,실제단위계,중력단위계,공학단위계,Gas Technology and Engineering,0.7659999999999999
헴펠(Hempel)법으로 가스분석을 할 경우 분석가스와 흡수액이 잘못 연결된 것은?,4,CO2 - 수산화칼륨 용액,O2 - 알칼리성 피로카롤 용액,CmHn - 무수황산 25%를 포함한 발연 황산,CO - 염화암모늄 용액,Gas Technology and Engineering,0.5682
대기압이 750㎜Hg일 때 탱크 내의 기체압력이 게이지압력으로 1.96㎏/cm2이었다. 탱크 내 이 기체의 절대압력은 약 얼마인가?,3,1㎏/cm2,2㎏/cm2,3㎏/cm2,4㎏/cm2,Gas Technology and Engineering,0.7143
"점도의 차원은? (단, 차원기호는 M : 질량, L : 길이, T : 시간이다.)",2,MLT-1,ML-1T-1,M-1LT-1,M-1L-1T,Gas Technology and Engineering,0.7368000000000001
막식가스미터의 부동현상에 대한 설명으로 가장 옳은 것은?,1,가스가 미터를 통과하지만 지침이 움직이지 않는 고장,가스가 미터를 통과하지 못하는 고장,가스가 누출되고 있는 고장,가스가 통과될 때 미터가 이상음을 내는 고장,Gas Technology and Engineering,0.9474
검지가스와 누출 확인 시험지가 잘못 연결된 것은?,1,일산화탄소(CO) - 염화칼륨지,포스겐(COCl2) - 하리슨 시험지,시안화수소(HCN) - 초산벤젠지,황화수소(H2S) - 연당지(초산납 시험지),Gas Technology and Engineering,0.7073
"실온 22℃, 습도 45%, 기압 765㎜Hg인 공기의 증기 분압(Pw)은 약 몇 ㎜Hg인가? (단, 공기의 가스상수는 29.27㎏·m/㎏·K, 22℃에서 포화 압력(Ps)은 18.66㎜Hg이다.)",2,4.1,8.4,14.3,16.7,Gas Technology and Engineering,0.6364
유압식 조절계의 제어동작에 대한 설명으로 옳은 것은?,2,"P 동작이 기본이고 PI, PID 동작이 있다.","I 동작이 기본이고 P, PI 동작이 있다.","P 동작이 기본이고 I, PID 동작이 있다.","I 동작이 기본이고 P, PID 동작이 있다.",Gas Technology and Engineering,0.4443999999999999
루트 가스미터에 대한 설명 중 틀린 것은?,4,설치장소가 작아도 된다.,대유량 가스 측정에 적합하다.,중압가스의 계량이 가능하다.,계량이 정확하여 기준기로 사용된다.,Gas Technology and Engineering,0.6136
제어기의 신호전송방법 중 유압식 신호전송의 특징이 아닌 것은?,2,사용유압은 0.2~1㎏/cm2 정도이다.,전송거리는 100~150m 정도이다.,전송지연이 작고 조직력이 크다.,조작속도와 응답속도가 빠르다.,Gas Technology and Engineering,0.4772999999999999
"동점성계수가 각각 1.1×10-6m2/s, 1.5×10-5m2/s인 물과 공기가 지름 10㎝인 원형관 속을 10㎝/s의 속도로 각각 흐르고 있을 때, 물과 공기의 유동을 옳게 나타낸 것은?",3,"물 : 층류, 공기 : 층류","물 : 층류, 공기 : 난류","물 : 난류, 공기 : 층류","물 : 난류, 공기 : 난류",Gas Technology and Engineering,0.5385
관내 유체의 급격한 압력 강하에 따라 수중으로부터 기포가 분리되는 현상은?,4,공기바인딩,감압화,에어리프트,캐비테이션,Gas Technology and Engineering,0.7308
관속을 유체가 층류로 흐를 때 관에서의 평균유속은 관 중심에서의 최대 유속의 얼마가 되는가?,1,0.5,0.75,0.82,1.00,Gas Technology and Engineering,0.6667000000000001
"내경 60㎝의 관을 사용하여 수평거리 50km 떨어진 곳에 2m/s의 속도로 송수하고자 한다. 관마찰로 인한 손실수두는 약 몇 m에 해당하는가? (단, 관의 마찰계수는 0.02이다.)",2,240,340,440,40 5,Gas Technology and Engineering,0.5652
마하수가 1보다 클 때 유체를 가속시키려면 어떻게 하여야 하는가?,2,단면적을 감소시킨다.,단면적을 증가시킨다.,단면적을 일정하게 유지시킨다.,단면적과는 상관없으므로 유체의 점도를 증가시킨다.,Gas Technology and Engineering,0.5714
베르누이 방정식을 유도할 때 필요한 가정 중 틀린 것은?,3,유선상의 두 점에 적용한다.,마찰이 없는 흐름이다.,압축성유체의 흐름이다.,정상상태의 흐름이다.,Gas Technology and Engineering,0.5172
유체의 흐름에서 유선이란 무엇인가?,1,유체흐름의 모든 점에서 접선 방향이 그 점의 속도 방향과 일치하는 연속적인 선,유체흐름의 모든 점에서 속도벡터에 평행하지 않는 선,유체흐름의 모든 점에서 속도벡터에 수직한 선,유체흐름의 모든 점에서 유동단면의 중심을 연결한 선,Gas Technology and Engineering,0.9259
충격파와 에너지선에 대한 설명으로 옳은 것은?,3,충격파는 이음속 흐름에서 갑자기 초음속 흐름으로 변할 때에만 발생한다.,"충격파가 발생하면 압력, 온도, 밀도 등이 연속적으로 변한다.",에너지선은 수력구배선보다 속도수두만큼 위에 있다.,에너지선은 상상 상향 기울기를 갖는다.,Gas Technology and Engineering,0.5
내경이 2.5×10-3m인 원관에 0.3m/s의 평균속도로 유체가 흐를 때 유량은 약 몇 m3/s인가?,2,1.06×10-6,1.47×10-6,2.47×10-6,5.23×10-6,Gas Technology and Engineering,0.5217
"유동하는 물의 속도가 12m/s이고 압력이 1.1kgf/cm2이다. 이 경우에 속도수두와 압력수두는 각각 약 몇 m인가? (단, 물의 밀도는 1000kg/m3이다.)",2,"10.6, 11.0","7.35, 11.0","7.35, 10.6","10.6, 10.36",Gas Technology and Engineering,0.7
용적100L인 밀폐된 용기 속에 온도 0℃에서의 8mole의 산소와 12mole의 질소가 들어있다면 이 혼합기체의 압력(kPa)은 약 얼마인가?,1,454,558,658,754,Gas Technology and Engineering,0.5263
418.6kJ/kg의 내부에너지를 갖는 20℃의 공기10kg이 탱크 안에 들어있다. 공기의 내부 에너지가 502.3kJ/kg 으로 증가할 때까지 가영하였을 경우 이때의 열량변화는 약 몇 kJ인가?,3,775,793,837,893,Gas Technology and Engineering,0.65
"연도가스의 몰조성이 CO2 : 25%, CO : 5%, N2 : 65%, O2 : 5%이면 과잉공기 백분율(%)은?",2,14.46,16.9,18.8,82.2,Gas Technology and Engineering,0.5
발열량이 21MJ/kg인 무연탄이 7%의 습분을 포함한다면 무연탄의 발열량은 약 몇 MJ/kg인가?,3,16.43,17.85,19.53,21.12,Gas Technology and Engineering,0.8
연소속도에 관한 설명으로 옳은 것은?,2,단위는 kg/s으로 나타낸다.,미연소 혼합기류의 화염면에 대한 법선 방향의 속도이다.,"연료의 종류, 온도, 압력과는 무관하다.",정지 관찰자에 대한 상대적인 화염의 이동속도이다.,Gas Technology and Engineering,0.5185
등심연소의 화염 높이에 대하여 옳게 설명한 것은?,1,공기 유속이 낮을수록 화염의 높이는 커진다.,공기 온도가 낮을수록 화염의 높이는 커진다.,공기 유속이 낮을수록 화염의 높이는 낮아진다.,공기 유속이 높고 공기 온도가 높을수록 화염의 높이는 커진다.,Gas Technology and Engineering,0.6552
800℃의 고열원과 100℃의 저열원 사이에서 작동하는 열기관의 효율은 얼마인가?,2,88%,65%,58%,55%,Gas Technology and Engineering,0.4783
헬륨을 냉매로 하는 극저온용 가스냉동기의 기본사이클 이름은?,4,역르누아사이클,역아트킨슨사이클,역에릭슨사이클,역스털링사이클,Gas Technology and Engineering,0.7037
기상폭발의 발화원에 해당되지 않는 것은?,1,성냥,전기불꽃,화염,충격파,Gas Technology and Engineering,0.6667000000000001
과잉 공기비는 어떤 식에 의해 계산되는가?,2,(실제공기량) ÷ (이론공기량),(실제공기량) ÷ (이론공기량) - 1,(이론공기량) ÷ (실제공기량),(이론공기량) ÷ (실제공기량) - 1,Gas Technology and Engineering,0.5769
"두께 4㎜인 강의 평판에 고온측 면의 온도가 100℃이고, 저온측 면의 온도가 80℃일 때 m2에 대해 30000kJ/min의 전열을 한다고 하면 이 강판의 열전도율은 약 몇 W/m℃인가?",1,100,120,130,40 1,Gas Technology and Engineering,0.6470999999999999
증기운폭발(VCE)에 대한 설명 중 틀린 것은?,3,증기운의 크기가 증가하면 점화확률이 커진다.,증기운에 의한 재해는 폭발보다는 화재가 일반적이다.,폭발효율이 커서 연소에너지의 전부가 폭풍파로 전환된다.,방출점으로부터 먼 지점에서의 증기운의 점화는 폭발의 충격을 증가시킨다.,Gas Technology and Engineering,0.5926
과잉공기계수가 1일 때 224Nm3의 공기로 탄소는 약 몇 kg을 완전 연소시킬 수 있는가?,3,20.1,23.4,25.2,27.3,Gas Technology and Engineering,0.7
도시가스사업법에서 정의하는 것으로 가스를 제조하여 배관을 통하여 공급하는 도시가스가 아닌 것은?,3,천연가스,나프타부생가스,석탄가스,바이오가스,Gas Technology and Engineering,0.5714
역카르노 사이클로 작동되는 냉동기가 20kW의 일을 받아서 저온체에서 20kcal/s의 열을 흡수한다면 고온체로 방출하는 열량은 약 몇 kcal/s인가?,2,14.8,24.8,34.8,44.8,Gas Technology and Engineering,0.7273000000000001
고압가스 탱크의 수리를 위하여 내부가스를 배출하고 불활성 가스로 치환하여 다시 공기로 치환하였다. 내부의 가스를 분석한 결과 탱크 안에서 용접작업을 해도 되는 경우는?,1,산소 20%,질소 85%,수소 2%,일산화탄소 100ppm,Gas Technology and Engineering,0.8845999999999999
지하에 설치하는 지역정압기실(기지)의 조작을 안전하고 확실하게 하기 위하여 조명도는 최소 어느 정도로 유지하여야 하는가?,3,80Lux 이상,100Lux 이상,150Lux 이상,200Lux 이상,Gas Technology and Engineering,0.8519
액화석유가스 사용시설에 대한 설명으로 틀린 것은?,2,저장설비로부터 중간밸브까지의 배관은 강관·등관 또는 금속플렉시블 호스로 한다.,건축물 안의 배관은 매설하여 시공한다.,건축물의 벽을 통과하는 배관에는 보호관과 부식방지 피복을 한다.,호스의 길이는 연소기까지 3m 이내로 한다.,Gas Technology and Engineering,0.6
"고무호스가 노후 되어 직경 1㎜의 구멍이 뚫려 280㎜H2O의 압력으로 LP가스가 대기 중으로 2시간 유출되었을 때 분출된 가스의 양은 약 몇 L인가? (단, 가스의 비중은 1.6이다.)",2,140L,238L,348L,672L,Gas Technology and Engineering,0.65
액화석유가스용 염화비닐호스의 안지름 치수가 12.7㎜인 경우 제 몇 종으로 분류되는가?,3,1,2,3,4,Gas Technology and Engineering,0.5
동력 및 냉동시스템에서 사이클의 효율을 향상시키기 위한 방법이 아닌 것은?,4,재생기 사용,다단 압축,다단 팽창,압축비 감소,Gas Technology and Engineering,0.6154
펌프의 유효 흡입수두(NPSH)를 가장 잘 표현한 것은?,3,펌프가 흡입할 수 있는 전흡입 수두로 펌프의 특성을 나타낸다.,펌프의 동력을 나타내는 척도이다.,공동현상을 일으키지 않을 한도의 최대 흡입 양정을 말한다.,공동현상 발생조건을 나타내는 척도이다.,Gas Technology and Engineering,0.5517
압력에 따른 도시가스 공급방식의 일반적인 분류가 아닌 것은?,4,저압공급방식,중압공급방식,고압공급방식,초고압공급방식,Gas Technology and Engineering,0.8966
LiBr - H2O 형 흡수식 냉·난방기에 대한 설명으로 옳지 않은 것은?,3,증발기 내부압력을 5~6㎜Hg로 할 경우 물은 약 5℃에서 증발한다.,증발기 내부의 압력은 진공상태이다.,냉매는 LiBr이다.,LiBr 은 수증기를 흡수할 때 흡수열이 발생한다.,Gas Technology and Engineering,0.5517
"흡입구경이 100㎜, 송출구경이 90㎜인 원심펌프의 올바른 표시는?",1,100×90 원심펌프,90×100 원심펌프,100-90 원심펌프,90-100 원심펌프,Gas Technology and Engineering,0.8065000000000001
산업재해 발생 및 그 위험요인에 대하여 짝지어진 것 중 틀린 것은?,3,"화재, 폭발 - 가연성, 폭발성 물질","중독 - 독성가스, 유독물질","난청 - 누전, 배선불량","화상, 동상 - 고온, 저온물질",Gas Technology and Engineering,0.8845999999999999
아세틸렌 용기의 15℃에서의 최고충전압력은 1.55MPa이다. 아세틸렌 용기의 내압시험압력 및 기밀시험압력은 각각 얼마인가?,4,"4.65MPa, 1.71MPa","2.58MPa, 1.55MPa","2.58MPa, 1.71MPa","4.65MPa, 2.79MPa",Gas Technology and Engineering,0.4332999999999999
