question,answer,A,B,C,D,Category,Human Accuracy
가스의 폭발상한계에 영향을 주는 요인으로 가장 거리가 먼 것은?,4,온도,가스의 농도,산소의 농도,부피,Gas Technology and Engineering,0.825
염소의 설질에 대한 설명으로 틀린 것은?,4,화학적으로 활성이 강한 산화제이다.,녹황색의 자극적인 냄새가 나는 기체이다.,습기가 있으면 철 등을 부식시키므로 수분과 격리 시켜야 한다.,염소와 수소를 혼합하면 냉암소에서도 폭발하여 염화수소가 된다.,Gas Technology and Engineering,0.7436
고압가스일반제조시설에서 운전 중의 1일 1회 이상 점검항목이 아닌 것은?,2,가스설비로부터의 누출,안전밸브 작동,"온도, 압력, 유량 등 조업조건의 변동 상황","탑류, 저장탱크류, 배관 등의 진동 및 이상음",Gas Technology and Engineering,0.6315999999999999
도시가스 사용시설에서 연소기 설치기준에 대한 설명으로 틀린 것은?,1,개방형 연소기를 설치한 실에는 급기구 또는 배기통을 설치한다.,가스온풍기와 배기통의 접합은 나사식이나 플랜지식 또는 밴드식 등으로 한다.,"배기통의 재료는 스테인리스 강판이나 내열, 내식성 재료를 사용한다.",밀폐형 연소기는 급기통·배기통과 벽과의 사이에 배기가스가 실내에 들어올 수 없도록 밀폐하여 설치한다.,Gas Technology and Engineering,0.525
"내용적 1500L, 내압시험 압력 50MPa 인 차량에 고정된 탱크의 안전유지 기준에 대한 설명으로 틀린 것은?",4,고압가스를 충전하거나 그로부터 가스를 이입 받을 때에는 차량정지목을 설치하여야 하나 주변 상황에 따라 이를 생략할 수 있다.,"차량에 고정된 탱크에는 안전밸브가 부착되어야 하며, 안전밸브는 40MPa 이하의 압력에서 작동되어야 한다.","차량에 고정된 탱크에 부착되는 밸브, 부속배관 및 긴급차단장치는 50MPa 이상의 압력으로 내압시험을 실시하고 이에 합격된 제품이어야 한다.",긴급차단장치는 원격조작에 의하여 작동되고 차량에 고정된 탱크 외면의 온도가 100℃일 때에 자동으로 작동되어야 한다.,Gas Technology and Engineering,0.6315999999999999
액화가스를 충전하는 탱크의 내부에 액면 요동을 방지하기 위하여 설치하는 장치는?,2,방호벽,방파판,방해판,방지판,Gas Technology and Engineering,0.7631999999999999
화씨[℉]와 섭씨[℃]의 온도눈금 수치가 일치하는 경우의 절대온도[K]는?,2,201,233,313,345,Gas Technology and Engineering,0.8
국제단위계(SI단위)중 압력단위에 해당되는 것은?,1,Pa,bar,atm,kgf/cm2,Gas Technology and Engineering,0.7895
"50mL의 시료가스를 CO2, O2, CO 순으로 흡수시켰을 때 이때 남은 부피가 각각 32.5mL, 24.2mL, 17.8mL이었다면 이들 가스의 조성 중 N2의 조성은 몇 %인가? (단, 시료 가스는 CO2, O2, CO, N2로 혼합되어 있다.)",4,24.2%,27.2%,34.2%,35.6%,Gas Technology and Engineering,0.4614999999999999
접촉식 온도계 중 알코올 온도계의 특징에 대한 설명으로 옳은 것은?,1,저온측정에 적합하다.,열팽창계수가 작다.,열전도율이 좋다.,액주의 복원시간이 짧다.,Gas Technology and Engineering,0.7179000000000001
잔류편차(off-set)는 제거되지만 제어시간은 단축 되지 않고 급변할 때 큰 진동이 발생하는 제어기는?,3,P 제어기,PD 제어기,PI 제어기,on-off 제어기,Gas Technology and Engineering,0.4524
초음파식 액위계에서 사용하는 초음파의 주파수는?,2,1kHz 이상,20kHz 이상,100kHz 이상,200kHz 이상,Gas Technology and Engineering,0.5946
가스 자기성(磁氣性)을 이용하여 검출하는 분석기 기는?,3,가스크로마토그래피,SO2 계,O2 계,CO2 계,Gas Technology and Engineering,0.5854
다이어프램 압력계의 측정범위로 가장 옳은 것은?,1,20~5000㎜H2O,1000~10000㎜H2O,1~10kg/cm2,10~100kg/cm2,Gas Technology and Engineering,0.5676
주된 소화효과가 질식효과에 의한 소화기가 아닌 것은?,3,분말 소화기,포말 소화기,"산, 알칼리 소화기",CO2 소화기,Gas Technology and Engineering,0.8393
"물의 비열 1, 수증기의 비열 0.45, 100℃에서의 증발 잠열이 539㎉/㎏일 때 110℃ 수증기의 엔탈피는? (단, 기준 상태는 0℃, 1atm의 물이며 비열의 단위는 ㎉/㎏·℃이다.)",3,539㎉/㎏,639㎉/㎏,643.5㎉/㎏,653.5㎉/㎏,Gas Technology and Engineering,0.4545
"메탄 60v%, 에탄 20v%, 프로판 15v%, 부탄 5v%인 혼합가스의 공기 중 폭발하한계(v%)는 약 얼마인가? (단, 각 성분의 폭발하한계는 메탄 5.0v%, 에탄 3.0v%, 프로판 2.1v%, 부탄 1.8v% 로 한다.)",3,2.5,3.0,3.5,4.0,Gas Technology and Engineering,0.5625
"압력 1atm, 온도 20℃에서 공기 1㎏의 부피는 약 몇 m3인가? (단, 공기의 평균분자량은 29이다.)",4,0.42,0.62,0.75,0.83,Gas Technology and Engineering,0.451
CO2max[%]는 어느 때의 값을 말하는가?,2,실제공기량으로 연소시켰을 때,이론공기량으로 연소시켰을 때,과잉공기량으로 연소시켰을 때,부족공기량으로 연소시켰을 때,Gas Technology and Engineering,0.8595999999999999
"95℃의 온수를 100㎏/h 발생시키는 온수 보일러가 있다. 이 보일러에서 저위발열량이 45MJ/Nm3인 LNG를 1m3/h 소비할 때 열효율은 얼마인가? (단, 급수의 온도는 25℃이고, 물의 비열은 4.184kJ/㎏·K이다.)",2,60.07%,65.08%,70.09%,75.10%,Gas Technology and Engineering,0.6981
"층류 연소속도 측정법 중 단위화염 면적 당 단위시간에 소비되는 미연소 혼합기체의 체적을 연소속도로 정의하여 결정하며, 오차가 크지만 연소속도가 큰 혼합기체에 편리하게 이용되는 측정 방법은?",2,Slot 버너법,Bunsen 버너법,평면 화염 버너법,Soap Bubble법,Gas Technology and Engineering,0.8332999999999999
증기운 폭발(UVCE)의 특징에 대한 설명으로 옳은 것은?,1,증기운의 크기가 커지면 점화 확률도 커진다.,증기운의 재해는 화재보다 폭발이 보통이다.,폭발효율은 BLEVE 보다 크다.,증기와 공기와의 난류혼합은 폭발의 충격을 감소시킨다.,Gas Technology and Engineering,0.6207
"상온, 상압하에서 프로판이 공기와 혼합하는 경우 폭발범위는 약 몇 %인가?",2,1.9~8.5,2.2~9.5,5.3~14,4.0~75,Gas Technology and Engineering,0.7193
"불완전연소에 의한 매연, 먼지 등을 제거하는 집진 장치 중 건식 집진장치가 아닌 것은?",4,백필터,사이클론,멀티클론,사이클론 스크러버,Gas Technology and Engineering,0.7414000000000001
점화원이 될 우려가 있는 부분을 용기 안에 넣고 불활성가스를 용기 안에 채워 넣어 폭발성가스가 침입 하는 것을 방지하는 방폭구조는?,1,압력방폭구조,안전증방폭구조,유입방폭구조,본질방폭구조,Gas Technology and Engineering,0.8103
가스의 반응속도에 대한 설명으로 틀린 것은?,1,반응속도상수는 온도와 관계가 없다.,반응속도상수는 아레니우스법칙으로 표시할 수 있다.,반응은 원자나 분자의 충돌에 의해 이루어진다.,"반응속도에 영향을 미치는 요인에는 온도, 압력, 농도 등이 있다.",Gas Technology and Engineering,0.8421
왕복동식 압축기의 특징에 대한 설명으로 틀린 것은?,4,압축효율이 높다.,용량조절이 쉽다.,설치면적이 크다.,저압용으로 적합하다.,Gas Technology and Engineering,0.7736
단면적이 300mm2인 봉을 매달고 600㎏의 추를 그 자유단에 달았더니 이 봉에 생긴 응력은 재료의 허용인장응력에 도달하였다. 이 봉의 인장강도가 400 ㎏/cm2이라면 안전율은 얼마인가?,2,1,2,3,4,Gas Technology and Engineering,0.8298000000000001
"보일러, 난방기, 가스렌지 등에 사용되는 과열방지장치의 검지부 방식에 해당되지 않는 것은?",4,바이메탈식,액체팽창식,퓨즈메탈식,전극식,Gas Technology and Engineering,0.4443999999999999
정압기의 유량특성에서 메인밸브의 열림(스토로그리프트)과 유량의 관계를 말하는 유량특성에 해당 되지 않는 것은?,3,직선형,2차형,3차형,평방근형,Gas Technology and Engineering,0.6667000000000001
나사펌프의 특징에 대한 설명으로 틀린 것은?,3,고점도액의 이송에 적합하다.,고압에 적합하다.,흡입양정이 크고 소음이 적다.,"구조가 간단하고 청소, 분해가 용이하다.",Gas Technology and Engineering,0.5192
압력조정기의 다이어프램에 사용하는 고무의 재료는 전체 배합성분 중 NBR의 성분의 함량이 몇 % 이상 이어야 하는가?,1,50%,85%,90%,99%,Gas Technology and Engineering,0.5
배관의 규격기호와 그 용도 및 사용조건에 대한 설명으로 틀린 것은?,2,"SPPS는 350℃ 이하의 온도에서, 압력 9.8N/mm2 이하에 사용한다.","SPPH는 350℃ 이하의 온도에서, 압력 9.8N/mm2 이하에 사용한다.",SPLT는 빙점 이하의 특히 낮은 온도의 배관에 사용한다.,SPPW는 정수두 100m 이하의 급수배관에 사용한 다.,Gas Technology and Engineering,0.7551000000000001
레이놀드(Reynolds)식 정압기의 특징인 것은?,4,로딩형이다.,콤팩트하다.,"정특성, 동특성이 양호하다.",정특성은 극히 좋으나 안정성이 부족하다.,Gas Technology and Engineering,0.7551000000000001
국내에서 주로 사용되는 저장탱크에서 초저온의 LNG와 직접 접촉하는 내부 바닥 및 벽체에 주로 사용되는 재료는?,1,멤브레인,합금주철,탄소강,알루미늄,Gas Technology and Engineering,0.5532
"20℃, 120atm의 산소 100㎏이 들어 있는 용기의 내용적은 약 몇 m3인가? (단, 산소의 가스정수는 26.5 로 한다.)",3,0.34,0.52,0.63,0.77,Gas Technology and Engineering,0.4634
직경이 각각 4m와 8m인 2개의 액화석유가스 저장탱크가 인접해 있을 경우 두 저장 탱크 간에 유지하여야 할 거리는 몇 m 이상인가?,3,1m,2m,3m,4m,Gas Technology and Engineering,0.7391
공기액화분리장치에서 탄산가스를 제거하기 위한 물질은?,4,실리카겔,염화칼슘,활성알루미나,수산화나트륨,Gas Technology and Engineering,0.5435
용기 및 특정설비의 재검사기간의 기준으로 옳은 것은?,1,제조된 지 16년이 경과된 47ℓ용접용기는 2년 마다 재검사를 받아야 한다.,용기에 부착되지 아니한 용기부속품은 3년 마다 재검사를 받아야 한다.,1993년에 신규검사를 받은 600ℓ복합재료용기는 3년 마다 재검사를 받아야 한다.,제조된 지 20년이 경과된 차량에 고정된 탱크는 2년 마다 재검사를 받아야 한다.,Gas Technology and Engineering,0.5745
고압가스 저장에 대한 기술 기준으로 틀린 것은?,4,충전용기는 항상 40℃ 이하의 온도를 유지할 것,가연성가스를 저장하는 곳에 방폭용 휴대용 손전등 외의 등화를 휴대하지 아니할 것,산화에틸렌의 저장탱크에는 45℃에서 그 내부가스의 압력이 0.4㎫ 이상이 되도록 탄산가스를 충전할 것,시안화수소의 저장은 용기에 충전한 후 90일을 초과하지 아니할 것,Gas Technology and Engineering,0.8478
방폭전기 기기의 구조별 표시방법으로 옳은 것은?,3,내암밤폭구조 : P,유입방폭구조 : a,안전증 방폭구조 : e,본질안전 방폭구조 : ba,Gas Technology and Engineering,0.7447
가스보일러의 안전장치에 해당하지 않는 것은?,2,소화안전장치,과충전방지장치,과열방지장치,저가스압차단장치,Gas Technology and Engineering,0.551
"내용적 50ℓ의 LPG 용기에 프로판을 충전할 때 최대 충전량은 몇 ㎏인가? (단, 프로판의 충전정수는 2.35이다.)",2,19.15,21.28,32.62,117.5,Gas Technology and Engineering,0.7234
차량에 고정된 탱크의 충전시설에서 가연성가스 충전시설의 고압가스설비는 그 외면으로부터 다른 가연성가스 충전시설의 고압가스설비와 안전거리 이상을 유지하도록 하고 있다. 그 거리는 몇 m 이상 이어야 하는가?,3,2m,3m,5m,7m,Gas Technology and Engineering,0.8
고압가스 특정제조시설에 설치되는 가스누출 검지경보장치의 설치기준에 대한 설명으로 옳은 것은?,3,경보농도는 가연성가스의 경우 폭발한계의 1/2 이하로 하여야 한다.,검지에서 발신까지 걸리는 시간은 경보농도의 1.2배 농도에서 보통 20초 이내로 한다.,경보기의 정밀도는 경보농도 설정치에 대하여 가연성 가스용은 ±25% 이하이어야 한다.,검지경보장치의 경보정밀도는 전원의 전압 등 변동이 ±20% 정도일 때에도 저하되지 아니하여야 한다.,Gas Technology and Engineering,0.6667000000000001
"액화염소 142g을 기화시키면 표준상태에서 몇 ℓ의 기체염소가 되는가? (단, 염소의 원자량은 35.5이다.)",2,22.4,44.8,67.2,89.6,Gas Technology and Engineering,0.4524
정전기제거 또는 발생방지 조치에 대한 설명으로 틀린 것은?,4,대상물을 접지시킨다.,상대습도를 높인다.,공기를 이온화시킨다.,전기저항을 증가시킨다.,Gas Technology and Engineering,0.6957
프레온냉매가 실수로 눈에 들어갔을 경우 눈 세척에 주로 사용하는 약품으로 적당한 것은?,2,바셀린,희붕산용액,농피크린산용액,유동파라핀,Gas Technology and Engineering,0.5532
일반도시가스 정압기실 경계책의 설치기준에 대한 설명으로 틀린 것은?,3,높이 1.5m 이상의 철책 또는 철망으로 경계책을 설치한다.,경계책 주위에는 외부사람의 무단출입을 금하는 내용의 경계표지를 부착(설치)한다 .,철근콘크리트로 지상에서 6m 이상의 높이에 설치된 정압기는 경계책을 설치한다.,도로의 지하에 설치되어 사람 또는 차량통행에 지장을 주는 정압기는 경계표지를 설치하고 경계책 설치를 생략한다.,Gas Technology and Engineering,0.6364
"고압가스 제조, 저장, 판매, 수입 시 독성가스 배관용 밸브의 검사대상에 해당되지 않는 것은?",4,볼밸브,글로브밸브,콕,앵글밸브,Gas Technology and Engineering,0.4443999999999999
"최고사용압력이 고압인 가스혼합기, 가스정제설비, 배송기, 압송기 그 밖에 공급시설의 부대설비는 그 외면으로부터 사업장의 경계까지 얼마 이상의 거리를 유지하여야 하는가?",3,3m,10m,20m,30m,Gas Technology and Engineering,0.5625
실제 길이가 3.0cm 인 물체를 측정하여 2.95cm를 얻었다. 이때 오차는 얼마인가?,2,＋0.05cm,-0.05cm,＋1.67%,-1.67%,Gas Technology and Engineering,0.4828
액위(level)측정 계측기기의 종류 중 액체용 탱크에 많이 사용되는 사이트글라스(Sight Glass)의 단점에 해당하지 않는 것은?,4,측정범위가 넓은 곳에서 사용이 곤란하다.,동결방지를 위한 보호가 필요하다.,파손되기 쉬우므로 보호대책이 필요하다.,내부설치 시 요동(Turbulance)방지를 위해 Stilling Chamber 설치가 필요하다.,Gas Technology and Engineering,0.6591
어떤 비례 제어기가 50℃에서 100℃사이에 온도를 조절 하는데 사용되고 있다. 만일 이 제어기기가 측정한 온도가 84℃에서 90℃일 때 비례대(Propotional band)는 약 얼마인가?,3,10%,11%,12%,13%,Gas Technology and Engineering,0.6409999999999999
막식 가스미터에서 이물질로 인한 불량이 생기는 원인으로 가장 거리가 먼 것은?,4,크랭크축에 이물질이 들어가 회전부에 윤활유가 없어진 경우,밸브와 시트 사이에 점성물질이 부착된 경우,연동기구가 변형된 경우,계량기의 유리가 파손된 경우,Gas Technology and Engineering,0.8181999999999999
유황분 정량 시 표준용액으로 적절한 것은?,1,수산화나트륨,과산화수소,초산,요오드칼륨,Gas Technology and Engineering,0.7111
가스크로마토그래피의 주요 구성 요소가 아닌 것은?,4,분리관(컬럼),검출기,기록계,흡수액,Gas Technology and Engineering,0.5349
도시가스 사용시설에 대하여 실시하는 내압시험에서 내압시험을 공기 등의 기체로 하는 경우 압력을 일시에 시험압력까지 올리지 아니하여야 한다. 이에 대한 설명으로 옳은 것은?,1,"먼저 상용압력의 50%까지 승압하고, 그 후에는 상용압력의 10%씩 단계적으로 승압한다.","먼저 상용압력의 50%까지 승압하고, 그 후에는 상용압력의 20%씩 단계적으로 승압한다.","먼저 상용압력의 80%까지 승압하고, 그 후에는 상용압력의 10%씩 단계적으로 승압한다.","먼저 상용압력의 80%까지 승압하고, 그 후에는 상용압력의 20%씩 단계적으로 승압한다.",Gas Technology and Engineering,0.619
"H2와 O2 등에는 감응이 없고, 탄화수소에 대한 감응이 가장 좋은 검출기는?",2,열전도도(TCD) 검출기,불꽃이온화(FID) 검출기,전자포획(ECD) 검출기,열이온(TID) 검출기,Gas Technology and Engineering,0.7955
오리피스로 유량을 측정하는 경우 압력차가 4배로 증가 하면 유량은 몇 배로 변하는가?,1,2배 증가,4배 증가,8배 증가,16배 증가,Gas Technology and Engineering,0.6889
측정기의 감도에 대한 일반적인 설명으로 옳은 것은?,3,감도가 좋으면 측정시간이 짧아진다.,감도가 좋으면 측정범위가 넓어진다.,감도가 좋으면 아주 작은 양의 변화를 측정할 수 있다.,측정량의 변화를 지시량의 변화로 나누어 준 값이다.,Gas Technology and Engineering,0.6279
"메탄 70%, 에탄 20%, 프로판 8% 부탄 1%로 구성되는 혼합가스의 공기 중 폭발하한계는 약 몇 v%인가? (단, 메탄, 에탄, 프로판, 부탄의 폭발하한계치는 각각 5.0, 3.0, 2.1, 1.9이다.)",2,3.5,4,4.5,5,Gas Technology and Engineering,0.5091
"압력이 0.1㎫, 체적이 3m3인 273.15K의 공기가 이상적으로 단일압축되어 그 체적이 1/3으로 되었다. 엔탈피의 변화량은 약 몇 kJ인가? (단, 공기의 기체 상수는 0.287kJ/㎏·K, 비열비는 1.4이다.)",2,480,580,680,780,Gas Technology and Engineering,0.6786
기상 폭발 발생을 예방하기 위한 대책으로 옳지 않은 것은?,3,환기에 의해 가연성 기체의 농도 상승을 억제 한다.,집진장치 등으로 분진 및 분무의 퇴적을 방지 한다.,휘발성 액체를 불활성 기체와의 접촉을 피하기 위해 공기로 차단한다.,반응에 의해 가연성 기체의 발생 가능성을 검토하고 반응을 억제하거나 또는 발생한 기체를 밀봉한다.,Gas Technology and Engineering,0.7414000000000001
"프로판 30v% 및 부탄 70v%의 혼합가스 1L가 완전연소하는데 필요한 이론 공기량은 약 몇 L인가? (단, 공기 중 산소농도는 20%로 한다.)",3,10,20,30,40,Gas Technology and Engineering,0.54
"자연현상을 판명해주고, 열이동의 방향성을 제시해 주는 열역학 법칙은?",3,제0법칙,제1법칙,제2법칙,제3법칙,Gas Technology and Engineering,0.7193
비중(60/60℉)이 0.95인 액체연료의 API도는?,3,15.45,16.45,17.45,18.45,Gas Technology and Engineering,0.6537999999999999
고체연료의 착화에 대한 설명으로 옳은 것은?,1,고체연료의 착화에서 노벽온도가 높을수록 착화지연 시간은 짧아진다.,고체연료의 착화에서 노벽온도가 낮을수록 착화지연 시간은 짧아진다.,고체연료의 착화에서 노벽온도가 높을수록 착화지연 시간은 일정하다.,고체연료의 착화에서 노벽온도와 착화지연 시간은 무관하다.,Gas Technology and Engineering,0.8125
"100℃의 수증기 1㎏이 100℃의 물로 응결될 때 수증기 엔트로피 변화량은 몇 kJ/K인가? (단, 물의 증발잠열은 2256.7kJ/㎏이다.)",2,-4.87,-6.05,-7.24,-8.67,Gas Technology and Engineering,0.7907
잠재적인 사고결과를 평가하는 정량적 안전성평가 기법은?,4,위험과 운전분석,이상위험도분석,결함수분석,사건수분석,Gas Technology and Engineering,0.6225999999999999
액체 시안화수소를 장기간 저장치 못하게 하는 이유는?,2,산화폭발하기 때문에,중합폭발하기 때문에,분해폭발하기 때문에,고결되어 장치를 막기 때문에,Gas Technology and Engineering,0.7872
연소에서 사용되는 용어와 그 내용에 대하여 가장 바르게 연결된 것은?,3,폭발 - 정상연소,착화점 - 점화 시 최대에너지,연소범위 - 위험도의 계산 기준,자연발화 - 불씨에 의한 최고 연소시작 온도,Gas Technology and Engineering,0.8478
가연성 가스의 연소에서 산소의 농도가 증가할수록 일어나는 현상으로 옳은 것은?,4,연소속도가 늦어진다.,발화온도가 높아진다.,화염온도가 낮아진다.,폭발범위가 넓어진다.,Gas Technology and Engineering,0.8723000000000001
난조가 있는 예혼합기 속을 전파하는 난류 예혼합화염은 층류 예혼합화염과 다르다. 이에 대한 설명으로 옳은 것은?,2,화염의 배후에 미연소분이 존재하기 않는다.,층류 예혼합염의 비하여 화염의 휘도가 높다.,난류 예혼합염의 구조는 교란 없이 연소되는 분젠 화염 형태이다.,연소속도는 층류 예혼합화염의 연소속도와 같은 수준이고 화염의 휘도가 낮은 편이다.,Gas Technology and Engineering,0.5745
공기액화사이클 중 비등점이 점차 낮은 냉매를 사용하여 낮은 비등점의 기체를 액화시키는 액화사이클을 무엇이라 하는가?,2,캐피자 액화사이클,다원 액화사이클,린데식 액화사이클,클라우드 액화사이클,Gas Technology and Engineering,0.4894
배관 이음 방법 중 배관의 직경이 서로 다른 관을 이을 때 사용하는 부품은?,2,캡,리듀서,유니온,플러그,Gas Technology and Engineering,0.9111
용접결함의 종류 중 언더필(underfill)을 설명한 것은?,2,용접 시 양 모재의 단면이 불일치되어 굽어진 상태,용착부족으로 용접부 표면이 주위모재의 표면 보다 낮은 현상,용접금속이 루트부분까지 도달하지 못했기 때문에 모재와 모재사이에 발생한 결함,과잉용접으로 용접금속이 국부적으로 홈의 반대면으로 흘러 떨어진 것,Gas Technology and Engineering,0.6364
"펌프의 전효율 η를 구하는 식으로 옳은 것은? (단, ηv는 체적효율, ηm은 기계효율, ηh는 수력효율이다.)",2,η = (ηm＋ηh)/ηv,η = ηv•ηm•ηh,η = ηv＋ηh＋ηm,η = (ηm•ηh)/ηv,Gas Technology and Engineering,0.6341
"도시가스의 연소속도(Cp)를 구하는 식은? (단, K는 도시가스 중 산소함유율에 따라 정하는 정수, H2는 가스 중의 수소의 함유율(v%), CO는 가스 중의 CO함유율(v%), CmHn은 가스 중의 CH4를 제외한 탄화수소 함유율(v%), CH4은 가수 중의 CH4함유율 (v%), d는 가스의 비중이다.)",1,Cp = K•(1.0H2＋0.6(CO＋CmHn)＋0.3CH4)/√d,Cp = K•(1.0CH4＋0.6(CO)＋CmHn＋0.3H2)/√d,Cp = K•(1.0CH4＋0.3(CO)＋CmHn＋0.6H2)/√d,Cp = K•(1.0CO＋0.3CH4＋(CmHn)＋0.6H2)/√d,Gas Technology and Engineering,0.7
"용기 내압시험 시 뷰렛은 300㎖의 용적을 가지고 있으며 전증가는 200㎖, 항구증가는 15㎖일 때 이용기의 항구 증가율은?",3,5%,6%,7.5%,8.5%,Gas Technology and Engineering,0.7631999999999999
"20층인 아파트에서 1층의 가스 압력이 1.8㎪일 때, 20층에서의 압력은 약 몇 ㎪인가? (단, 20층까지의 고저차는 60m, 가스의 비중은 0.65, 공기의 비중량은 1.3㎏/m3이다.)",2,1,2,3,4,Gas Technology and Engineering,0.6111
"액화산소탱크 4000L에 충전할 수 있는 질량은 몇 ㎏인가? (단, 상용의 온도에서 액화가스의 비중은 1.14이다.)",1,4104,4154,5104,5154,Gas Technology and Engineering,0.7317
가스배관의 부식방지조치로서 피복에 의한 방식법이 아닌 것은?,4,아연도금,도장,도복장,희생양극법,Gas Technology and Engineering,0.9
"로딩(loading)형으로 정특성, 동특성이 양호한 정압기는?",1,Fisher식,Axial flow식,Reynolds식,KRF식,Gas Technology and Engineering,0.975
"용기 충전구에 “V"" 홈의 의미는?",1,왼나사를 나타낸다.,위험한 가스를 나타낸다.,가연성가스를 나타낸다.,독성가스를 나타낸다.,Gas Technology and Engineering,0.9268
시간당 50000㎉의 열을 흡수하는 냉동기의 용량은 몇 냉동톤에 해당하는가?,2,6.01,15.06,63.40,633.71,Gas Technology and Engineering,0.6842
자연기화와 비교한 강제기화기 사용 시 특징에 대한 설명 중 틀린 것은?,4,LPG 종류에 관계없이 한냉시에도 충분히 기화 된다.,공급가스의 조성이 일정하다.,기화량을 가감할 수 있다.,설비장소가 커지고 설비비는 많이 든다.,Gas Technology and Engineering,0.6744
고압가스 충전용기의 운반기준 중 동일 차량에 적재운반이 가능한 것은?,1,수소와 산소,염소와 수소,아세틸렌과 염소,암모니아와 염소,Gas Technology and Engineering,0.6857
