question,answer,A,B,C,D,Category,Human Accuracy
도시가스 제조시설의 플레어스택 기준에 적합하지 않은 것은?,1,스택에서 방출된 가스가 지상에서 폭발한계에 도달하지 아니하도록 할 것,연소능력은 긴급이송설비로 이송되는 가스를 안전하게 연소시킬 수 있을 것,스택에서 발생하는 최대열량에 장시간 견딜 수 있는 재료 및 구조로 되어 있을 것,폭발을 방지하기 위한 조치가 되어 있을 것,Gas Technology and Engineering,0.5207999999999999
독성가스의 제독제로 물을 사용하는 가스는?,4,염소,포스겐,황화수소,산화에틸렌,Gas Technology and Engineering,0.6555
특정설비 중 압력용기의 재검사 주기는?,2,3년마다,4년마다,5년마다,10년마다,Gas Technology and Engineering,0.4864
아세틸렌 제조설비의 방호벽 설치기준으로 틀린 것은?,1,압축기와 충전용주관밸브 조작밸브 사이,압축기와 가스충전용기 보관장소 사이,충전장소와 가스충전용기 보관장소 사이,충전장소와 충전용주관밸브 조작밸브 사이,Gas Technology and Engineering,0.5052
액화산소 저장탱크 저장능력이 1000m3일 때 방류둑의 용량은 얼마 이상으로 설치하여야 하는가?,3,400m3,500m3,600m3,1000m3,Gas Technology and Engineering,0.5455
당해 설비 내의 압력이 상용압력을 초과할 경우 즉시 상용압력 이하로 되돌릴 수 있는 안전장치의 종류에 해당하지 않는 것은?,2,안전밸브,감압밸브,바이패스밸브,파열판,Gas Technology and Engineering,0.507
일반도시가스 배관을 지하에 매설하는 경우에는 표지판을 설치해야 하는데 몇 m간격으로 1개 이상을 설치해야 하는가?,2,100m,200m,500m,1000m,Gas Technology and Engineering,0.6379
도시가스 보일러 중 전용 보일러실에 반드시 설치하여야 하는 것은?,3,밀폐식 보일러,옥외에 설치하는 가스보일러,반밀폐형 자연 배기식 보일러,전용급기통을 부착시키는 구조로 검사에 합격한 강제배기식 보일러,Gas Technology and Engineering,0.6028
고압가스 용기 제조의 시설기준에 대한 설명으로 옳은 것은?,4,용접용기 동판의 최대두께와 최소두께와의 차이는 평균 두께의 5% 이하로 한다.,초저온 용기는 고압배관용 탄소강관으로 제조한다.,아세틸렌용기에 충전하는 다공질물은 다공도가 72% 이상 95% 미만으로 한다.,용접용기에는 그 용기의 부속품을 보호하기 위하여 프로텍터 또는 캡을 고정식 또는 체인식으로 부착한다.,Gas Technology and Engineering,0.4945
"도시가스 배관 이음부와 전기점멸기, 전기접속기와는 몇 ㎝ 이상의 거리를 유지해야 하는가?",2,10㎝,15㎝,30㎝,40㎝,Gas Technology and Engineering,0.4514
용기종류별 부속품의 기호 표시로서 틀린 것은?,3,AG : 아세틸렌가스를 충전하는 용기의 부속품,PG : 압축가스를 충전하는 용기의 부속품,LG : 액화석유가스를 충전하는 용기의 부속품,LT : 초저온 용기 및 저온 용기의 부속품,Gas Technology and Engineering,0.75
독성가스 제독작업에 필요한 보호구의 보관에 대한 설명으로 틀린 것은?,2,독성가스가 누출할 우려가 있는 장소에 가까우면서 관리하기 쉬운 장소에 보관한다.,긴급 시 독성가스에 접하고 반출할 수 있는 장소에 보관한다.,정화통 등의 소모품은 정기적 또는 사용 후에 점검하여 교환 및 보충한다.,항상 청결하고 그 기능이 양호한 장소에 보관한다.,Gas Technology and Engineering,0.7243999999999999
일반 공업용 용기의 도색의 기준으로 틀린 것은?,4,액화염소-갈색,액화암모니아-백색,아세틸렌-황색,수소-회색,Gas Technology and Engineering,0.7008
액화석유가스의 안전관리 및 사업법에 규정된 용어의 정의에 대한 설명으로 틀린 것은?,4,"저장설비라 함은 액화석유가스를 저장하기 위한 설비로서 저장탱크, 마운드형 저장탱크, 소형저장탱크 및 용기를 말한다.","자동차에 고정된 탱크라 함은 액화석유가스의 수송, 운반을 위하여 자동차에 고정 설치된 탱크를 말한다.",소형저장탱크라 함은 액화석유가스를 저장하기 위하여 지상 또는 지하에 고정 설치된 탱크로서 그 저장능력이 3톤 미만인 탱크를 말한다.,가스설비라 함은 저장설비외의 설비로서 액화석유가스가 통하는 설비(배관을 포함한다)와 그 부속설비를 말한다.,Gas Technology and Engineering,0.62
1%에 해당하는 ppm의 값은?,3,102ppm,103ppm,104ppm,105ppm,Gas Technology and Engineering,0.4567
"가스배관의 시공 신뢰성을 높이는 일환으로 실시하는 비파괴검사 방법 중 내부선원법, 이중벽 이중상법 등을 이용하는 방법은?",3,초음파탐상시험,자분탐상시험,방사선투과시험,침투탐상방법,Gas Technology and Engineering,0.5827
도시가스 배관을 폭 8m 이상의 도로에서 지하에 매설 시 지표면으로부터 배관의 외면까지의 매설깊이의 기준은?,3,0.6m 이상,1.0m 이상,1.2m 이상,1.5m 이상,Gas Technology and Engineering,0.6768000000000001
도시가스시설의 설치공사 또는 변경공사를 하는 때에 이루어지는 주요공정 시공감리 대상은?,1,도시가스사업자외의 가스공급시설설치자의 배관 설치공사,가스도매사업자의 가스공급시설 설치공사,일반도시가스사업자의 정압기 설치공사,일반도시가스사업자의 제조소 설치공사,Gas Technology and Engineering,0.7008
고압가스 공급자의 안전점검 항목이 아닌 것은?,2,충전용기의 설치위치,충전용기의 운반방법 및 상태,충전용기와 화기와의 거리,"독성가스의 경우 합수장치, 제해장치 및 보호구 등에 대한 적합여부",Gas Technology and Engineering,0.5687
액화석유가스 판매업소의 우전용기 보관실에 강제통풍장치 설치 시 통풍능력의 기준은?,1,바닥면적 1m2당 0.5m3/분 이상,바닥면적 1m2당 1.0m3/분 이상,바닥면적 1m2당 1.5m3/분 이상,바닥면적 1m2당 2.0m3/분 이상,Gas Technology and Engineering,0.5
액화가스의 이송 펌프에서 발생하는 캐비테이션현상을 방지하기 위한 대책으로서 틀린 것은?,2,흡입 배관을 크게 한다.,펌프의 회전수를 크게 한다.,펌프의 설치위치를 낮게 한다.,펌프의 흡입구 부근을 냉각한다.,Gas Technology and Engineering,0.6934999999999999
공기액화분리기 내의 CO2를 제거하기 위해 NaOH 수용액을 사용한다. 1.0kg의 CO2를 제거하기 위해서는 약 몇 kg의 NaOH를 가해야 하는가?,2,0.9,1.8,3.0,3.8,Gas Technology and Engineering,0.674
왕복동 압축기 용량 조정 방법 중 단계적으로 조절하는 방법에 해당되는 것은?,4,회전수를 변경하는 방법,흡입 주밸브를 폐쇄하는 방법,타임드 밸브 제어에 의한 방법,클리어런스 밸브에 의해 용적 효율을 낮추는 방법,Gas Technology and Engineering,0.5207
LP가스에 공기를 희석시키는 목적이 아닌 것은?,4,발열량조절,연소효율 증대,누설 시 손실감소,재액화 촉진,Gas Technology and Engineering,0.7064
금속재료 중 저온 재료로 적당하지 않은 것은?,1,탄소강,황동,9% 니켈강,18-8 스테인리스강,Gas Technology and Engineering,0.6926000000000001
파이프 커터로 강관을 절단하면 거스러미(burr)가 생긴다. 이것을 제거하는 공구는?,4,파이프 벤더,파이프 렌치,파이프바이스,파이프리이머,Gas Technology and Engineering,0.8626999999999999
고속회전하는 임펠러의 원심력에 의해 속도에너지를 압력에너지로 바꾸어 압축하는 형식으로서 유량이 크고 설치면적이 적게 차지하는 압축기의 종류는?,2,왕복식,터보식,회전식,흡수식,Gas Technology and Engineering,0.6375
가스홀더의 압력을 이용하여 가스를 공급하며 가스제조공장과 공급지역이 가깝거나 공급면적이 좁을 때 적당한 가스공급 방법은?,1,저압공급방식,중앙공급방식,고압공급방식,초 고압공급방식,Gas Technology and Engineering,0.7872
가스종류에 따른 용기의 재질로서 부적합한 것은?,2,LPG : 탄소강,암모니아 : 동,수소 : 크롬강,초 고압공급방식,Gas Technology and Engineering,0.6008
표준상태에서 1000L의 체적을 갖는 가스상태의 부탄은 약 몇 kg인가?,1,2.6,3.1,5.0,6.1,Gas Technology and Engineering,0.4902
열역학 제1법칙에 대한 설명이 아닌 것은?,2,에너지 보존의 법칙이라고 한다.,열은 항상 고온에서 저온으로 흐른다.,열과 일은 일정한 관계로 상호 교환된다.,제1종 영구기관이 영구적으로 일하는 것은 불가능하다는 것을 알려준다.,Gas Technology and Engineering,0.4322999999999999
1kW의 열량을 환산한 것으로 옳은 것은?,4,536kcal/h,632kcal/h,720kcal/h,860kcal/h,Gas Technology and Engineering,0.6
섭씨온도와 화씨온도가 같은 경우는?,1,-40℃,32℉,273℃,45℉,Gas Technology and Engineering,0.733
이상 기체를 정적하에서 가열하면 압력과 온도의 변화는?,3,"압력증가, 온도일정","압력일정, 온도증가","압력증가, 온도상승","압력일정, 온도상승",Gas Technology and Engineering,0.6531999999999999
산소의 물리적인 성질에 대한 설명으로 틀린 것은?,4,산소는 약 -183℃에서 액화한다.,액체산소는 청색으로 비중이 약 1.13이다.,"무색, 무취의 기체이며 물에는 약간 녹는다.",강력한 조연성 가스이므로 자신이 연소한다.,Gas Technology and Engineering,0.7293999999999999
액화석유가스의 안전관리 및 사업법에서 정한 용어에 대한 설명으로 틀린 것은?,4,저장설비란 액화석유가스를 저장하기 위한 설비로서 각종 저장탱크 및 용기를 말한다.,저장탱크란 액화석유가스를 저장하기 위하여 지상 또는 지하에 고정 설치된 탱크로서 그 저장능력이 3톤 이상인 탱크를 말한다.,용기집합설비란 2개 이상의 용기를 집합하여 액화석유가스를 저장하기 위한 설비를 말한다.,충전용기란 액화석유가스 충전 질량의 90%이상이 충전되어 있는 상태의 용기를 말한다.,Gas Technology and Engineering,0.6172
공기와 혼합된 가스가 압력이 높아지면 폭발범위가 좁아지는 가스는?,3,메탄,프로판,일산화탄소,아세틸렌,Gas Technology and Engineering,0.6049
산소압축기의 내부 윤활유제로 주로 사용되는 것은?,2,석유,물,유지,황산,Gas Technology and Engineering,0.9338
충전용기 등을 적재한 차량의 운반 개시 전용기 적재상태의 점검내용이 아닌 것은?,4,차량의 적재중량 확인,용기 고정상태 확인,용기 보호캡의 부착유무 확인,운반계획서 확인,Gas Technology and Engineering,0.7902
도시가스 사용시설에서 안전을 확보하기위하여 최고사용 압력의 1.1배 또는 얼마의 압력 중 높은 압력으로 실시하는 기밀시험에 이상이 없어야 하는가?,4,5.4kPa,6.4kPa,7.4kPa,8.4kPa,Gas Technology and Engineering,0.6970000000000001
일반도시가스사업의 설치하는 가스공급시설 중 정압기의 설치에 대한 설명으로 틀린 것은?,2,건축물 내부에 설치된 도시가스사업자의 정압기로서 가스누출경보기와 연동하여 작동하는 기계환기설비를 설치하고 1일 1회 이상 안전점검을 실시하는 경우에는 건축물의 내부에 설치할 수 있다.,"정압기에 설치되는 가스방출관의 방출구는 주위에 불 등이 없는 안전한 위치로서 지면으로부터 3m 이상의 높이에 설치하여야 하며, 전기시설물과의 접촉 등으로 사고의 우려가 있는 장소에서는 5m 이상의 높이로 설치한다.",정압기에 설치하는 가스차단장치는 정압기의 입구 및 출구에 설치한다.,정압기는 2년에 1회 이상 분해점검을 실시하고 필터는 가스공급 개시 후 1월 이내 및 가스공급개시 후 매년 1회 이상 분해점검을 실시한다.,Gas Technology and Engineering,0.5587
아세틸렌(C2H2)에 대한 설명으로 틀린 것은?,2,폭발범위는 수소보다 넓다.,공기보다 무겁고 황색의 가스이다.,공기와 혼합되지 않아도 폭발하는 수가 있다.,"구리, 은, 수은 및 그 합금과 폭발성 화합물을 만든다.",Gas Technology and Engineering,0.6988
고압가스 충전용기는 항상 몇 ℃이하의 온도를 유지하여야 하는가?,3,10℃,30℃,40℃,50℃,Gas Technology and Engineering,0.9631
용기에 의한 고압가스 운반기준으로 틀린 것은?,1,3000kg의 액화 조연성가스를 차량에 적재하여 운반할 때에는 운반책임자가 동승하여야 한다.,허용농도가 500ppm 인 액화 독성가스 1000kg 을 차량에 적재하여 운반할 때에는 운반책임자가 동승하여야 한다.,충전용기와 위험물 안전관리법에서 정하는 위험물과는 동일 차량에 적재하여 운반할 수 없다.,300m3의 압축 가연성가스를 차량에 적재하여 운반할 때에는 운전자가 운반책임자의 자격을 가진 경우에는 자격이 없는 사람을 동승시킬 수 있다.,Gas Technology and Engineering,0.6074
공기 중으로 누출 시 냄새로 쉽게 알 수 있는 가스로만 나열된 것은?,1,"Cl2, NH3","CO, Ar","C2H2, CO","O2, Cl2",Gas Technology and Engineering,0.9355
신규검사 후 20년이 경과한 용접용기(액화석유가스용 용기는 제외한다)의 재검사 주기는?,3,3년마다,2년마다,1년마다,6개월마다,Gas Technology and Engineering,0.585
액화석유가스 저장탱크 벽면의 국부적인 온도상승에 따른 저장탱크의 파열을 방지하기 위하여 저장탱크 내벽에 설치하는 폭발방지장치의 재료로 맞는 것은?,2,다공성 철판,다공성 알루미늄판,다공성 아연판,오스테나이트계 스테인리스판,Gas Technology and Engineering,0.6179
최대지름이 6m인 가연성가스 저장탱크 2개가 서로 유지하여야 할 최소 거리는?,4,0.6m,1m,2m,3m,Gas Technology and Engineering,0.4939
고압가스 일반제조시설 중 에어졸의 제조기준에 대한 설명으로 틀린 것은?,3,에어졸의 분사제는 독성가스를 사용하지 아니한다.,35℃에서 그 용기의 내압이 0.8MPa 이하로 한다.,에어졸 제조설비는 화기 또는 인화성 물질과 5m 이상의 우회거리를 유지한다.,내용적이 30m3 이상인 용기는 에어졸의 제조에 재사용하지 아니한다.,Gas Technology and Engineering,0.6485
가스누출검지경보장치의 설치에 대한 설명으로 틀린 것은?,1,통풍이 잘 되는 곳에 설치한다.,가스의 누출을 신속하게 검지하고 경보하기에 충분한 개수 이상 설치한다.,장치의 기능은 가스의 종류에 적절한 것으로 한다.,가스가 체류할 우려가 있는 장소에 적절하게 설치한다.,Gas Technology and Engineering,0.8498
가스용기의 취급 및 주의사항에 대한 설명으로 틀린 것은?,2,충전 시 용기는 용기 재검사 기간이 지나지 않았는지 확인한다.,LPG용기나 밸브를 가열할 때는 뜨거운 물(40℃ 이상)을 사용한다.,충전한 후에는 용기밸브의 누출 여부를 확인한다.,용기 내에 잔류물이 있을 때에는 잔류물을 제거하고 충전한다.,Gas Technology and Engineering,0.8761
용기 신규검사에 합격된 용기 부속품기호 중 압축가스를 충전하는 용기 부속품의 기호는?,2,AG,PG,LG,LT,Gas Technology and Engineering,0.8240000000000001
일반 액화석유가스 압력조정기에 표시하는 사항이 아닌 것은?,4,제조자명이나 그 약호,제조번호나 로트번호,"입구압력(기호:P, 단위:MPa)",검사 연월일,Gas Technology and Engineering,0.4847999999999999
산화에틸렌 취급 시 주로 사용되는 제독제는?,4,가성소다 수용액,나산소다 수용액,소석회 수용액,물,Gas Technology and Engineering,0.7906
고압가스 설비에 설치하는 압력계의 최고눈금에 대한 측정범위의 기준으로 옳은 것은?,3,"상용압력의 1.0배 이상, 1.2배 이하","상용압력의 1.5배 이상, 1.5배 이하","상용압력의 1.5배 이상, 2.0배 이하","상용압력의 2.0배 이상, 3.0배 이하",Gas Technology and Engineering,0.8498
0종 장소에는 원칙적으로 어떤 방폭구조의 것으로 하여야 하는가?,2,내압방폭구조,본질안전방폭구조,특수방폭구조,안전증방폭구조,Gas Technology and Engineering,0.6293
도시가스 사용시설에서 PE배관은 온도가 몇℃ 이상이 되는 장소에 설치하지 아니하는가?,3,25℃,30℃,40℃,60℃,Gas Technology and Engineering,0.6867
액화 암모니아 10kg을 기화시키면 표준상태에서 약 몇 m3의 기체로 되는가?(오류 신고가 접수된 문제입니다. 반드시 정답과 해설을 확인하시기 바랍니다.),3,80,5,13,26,Gas Technology and Engineering,0.5665
방류둑의 내측 및 그 외면으로부터 몇 m 이내에 그 저장 탱크의 부속설비 외의 것을 설치하지 못하도록 되어 있는가?,4,3m,5m,8m,10m,Gas Technology and Engineering,0.4661
부취체를 외기로 분출하거나 부취설비로부터 부취제가 흘러나오는 경우 냄새를 감소시키는 방법으로 가장 거리가 먼 것은?,2,연소법,수동조절,화학적 산화처리,활성탄에 의한 흡착,Gas Technology and Engineering,0.6364
압력배관용 탄소강관의 사용압력 범위로 가장 적당한 것은?,2,1~2MPa,1~10MPa,10~20MPa,10~50MPa,Gas Technology and Engineering,0.6537000000000001
고압식 액화분리 장치의 작동 개요에 대한 설명이 아닌 것은?,3,원료 공기는 여과기를 통하여 압축기로 흡입하여 약 150~200kg/cm2으로 압축시킨다.,압축기를 빠져나온 원료 공기는 열교환기에서 약간 냉각되고 건조기에서 수분이 제거된다.,압축 공기는 수세정탑을 거쳐 축냉기로 송입되어 원료공기와 불순 질소류가 서로 교환된다.,액체 공기는 상부 정류탑에서 약 0.5atm정도의 압력으로 정류된다.,Gas Technology and Engineering,0.4703
"부유 피스톤형 압력계에서 실린더 지름 0.02m, 추와 피스톤의 무게가 20000g일 때 이 압력계에 접속된 부르동관의 압력계 눈금이 7kg/cm2를 나타내었다. 이 부르동관 압력계의 오차는 약 몇 % 인가?",2,5,10,15,20,Gas Technology and Engineering,0.4513
저비점(低沸點) 액체용 펌프 사용상의 주의사항으로 틀린 것은?,3,밸브와 펌프사이에 기화가스를 방출할 수 있는 안전밸브를 설치한다.,"펌프의 흡입, 토출관에는 신축 죠인트를 장치한다.",펌프는 가급적 저장용기(貯橦)로 부터 멀리 설치한다.,운전개시 전에는 펌프를 청정(淸淨)하여 건조한 다음 펌프를 충분히 예냉(豫冷)한다.,Gas Technology and Engineering,0.6667000000000001
금속재료의 저온에서의 성질에 대한 설명으로 가장 거리가 먼 것은?,2,강은 암모니아 냉동기용 재료로서 적당하다.,탄소강은 저온도가 될수록 인장강도가 감소한다.,구리는 액화분리장치용 금속재료로서 적당하다.,18-8 스테인리스강은 우수한 저온장치용 재료이다.,Gas Technology and Engineering,0.5493
압축기에 사용하는 윤활유 선택 시 주의사항으로 틀린 것은?,3,인화점이 높을 것,잔류탄소의 양이 적을 것,점도가 적당하고 항유화성이 적을 것,사용가스와 화학반응을 일으키지 않을 것,Gas Technology and Engineering,0.6195
1단 감압식 저압조정기의 성능에서 조정기 최대 폐쇄압력은?,2,2.5kPa 이하,3.5kPa 이하,4.5kPa 이하,5.5kPa 이하,Gas Technology and Engineering,0.5374
비열에 대한 설명 중 틀린 것은?,3,단위는 kcal/kg·℃ 이다.,비열비는 항상 1보다 크다.,정적비열은 정압비열보다 크다.,물의 비열은 얼음의 비열보다 크다.,Gas Technology and Engineering,0.6436
수소(H2)에 대한 설명으로 옳은 것은?,1,3중 수소는 방사능을 갖는다.,밀도가 크다.,금속재료를 취하시키지 않는다.,열전달율이 아주 작다.,Gas Technology and Engineering,0.6396000000000001
샤를의 법칙에서 기체의 압력이 일정할 때 모든 기체의 부피는 온도가 1℃ 상승함에 따라 0℃때의 부피보다 어떻게 되는가?,3,22.4배씩 증가한다.,22.4배씩 감소한다.,1/273씩 증가한다.,1/273씩 감소한다.,Gas Technology and Engineering,0.6244
현열에 대한 가장 적절한 설명은?,1,물질이 상태변화 없이 온도가 변할 때 필요한 열이다.,물질이 온도변화 없이 상태가 변할 때 필요한 열이다.,"물질이 상태, 온도 모두 변할 때 필요한 열이다.",물질이 온도변화 없이 압력이 변할 때 필요한 열이다.,Gas Technology and Engineering,0.7857
일산화탄소와 염소가 반응하였을 때 주로 생성되는 것은?,1,포스겐,카르보닐,포스핀,사염화탄소,Gas Technology and Engineering,0.6779999999999999
"대기압 하에서 0℃기체의 부피가 500mL이었다. 이 기체의 부피가 2배 될 때의 온도는 몇℃인가? (단, 압력은 일정하다.)",3,-100,32,273,500,Gas Technology and Engineering,0.6611
황화수소의 주된 용도는?,3,도료,냉매,형광 물질 원료,합성고무,Gas Technology and Engineering,0.7635
도시가스의 매설 배관에 설치하는 보호판은 누출가스가 지면으로 확산되도록 구멍을 뚫는데 그 간격의 기준으로 옳은 것은?,3,1m 이하 간격,2m 이하 간격,3m 이하 간격,5m 이하 간격,Gas Technology and Engineering,0.4911
"처리능력이 1일 35,000m3인 산소 처리설비로 전용공업지역이 아닌 지역일 경우 처리설비 외면과 사업소 밖에 있는 병원과는 몇 m 이상 안전거리를 유지하여야 하는가?",3,16m,17m,18m,20m,Gas Technology and Engineering,0.5857
도시가스사업자는 굴착공사정보지원센터로 부터 굴착계획의 통보내용을 통지받은 때에는 얼마 이내에 매설된 배관이 있는지를 확인하고 그 결과를 굴착공사정보지원센터에 통지하여야 하는가?,1,24시간,36시간,48시간,60시간,Gas Technology and Engineering,0.8581
용기에 의한 액화석유가스 저장소에서 실외저장소 주위의 경계 울타리와 용기보관장소 사이에는 얼마 이상의 거리를 유지하여야 하는가?,4,2m,8m,15m,20m,Gas Technology and Engineering,0.4485
가스도매사업 제조소의 배관장치에 설치하는 경보장치가 울려야 하는 시기의 기준으로 잘못된 것은?,4,배관 안의 압력이 상용압력의 1.05배를 초과한 때,배관 안의 압력이 정상운전 때의 압력보다 15% 이상 강하한 경우 이를 검지한 때,긴급차단밸브의 조작회로가 고장난 때 또는 긴급차단밸브가 폐쇄된 때,상용압력이 5MPa 이상인 경우에는 상용압력에 0.5MPa를 더한 압력을 초과한 때,Gas Technology and Engineering,0.6036
일반도시가스사업의 가스공급시설기준에서 배관을 지상에 설치할 경우 가스 배관의 표면 색상은?,4,흑색,청색,적색,황색,Gas Technology and Engineering,0.8804000000000001
운반 책임자를 동승시키지 않고 운반하는 액화석유가스용 차량에서 고정된 탱크에 설치하여야 하는 장치는?,3,살수장치,누설방지장치,폭발방지장치,누설경보장치,Gas Technology and Engineering,0.6367
가연성가스와 동일차량에 적재하여 운반할 경우 충전용기의 밸브가 서로 마주보지 않도록 적재해야 할 가스는?,2,수소,산소,질소,아르곤,Gas Technology and Engineering,0.7948999999999999
천연가스의 발열량이 10400kcal/Sm3이다. SI 단위인 MJ/Sm3으로 나타내면?,2,2.47,43.68,2476,43680,Gas Technology and Engineering,0.6708
가연성가스 충전용기 보관실의 벽 재료의 기준은?,1,불연재료,난연재료,가벼운 재료,불연 또는 난연재료,Gas Technology and Engineering,0.6931999999999999
고압가스 저장의 시설에서 가연성가스 시설에 설치하는 유동방지 시설의 기준은?,1,높이 2m 이상의 내화성 벽으로 한다.,높이 1.5m 이상의 내화성 벽으로 한다.,높이 2m 이상의 불연성 벽으로 한다.,높이 1.5m 이상의 불연성 벽으로 한다.,Gas Technology and Engineering,0.4640999999999999
고압가스 용기 재료의 구비조건이 아닌 것은?,2,"내식성, 내마모성을 가질 것",무겁고 충분한 강도를 가질 것,용접성이 좋고 가공 중 결함이 생기지 않을 것,저온 및 사용온도에 견디는 연성과 점성강도를 가질 것,Gas Technology and Engineering,0.8426
LPG충전소에는 시설의 안전확보 상 “충전 중 엔진 정지”를 주위의 보기 쉬운 곳에 설치해야 한다. 이 표지판의 바탕색과 문자색은?(오류 신고가 접수된 문제입니다. 반드시 정답과 해설을 확인하시기 바랍니다.),4,흑색바탕에 백색글씨,흑색바탕에 황색글씨,백색바탕에 흑색글씨,황색바탕에 흑색글씨,Gas Technology and Engineering,0.6197
도시가스 배관의 지름이 15㎜인 배관에 대한 고정장치의 설치간격은 몇 m 이내마다 설치하여야 하는가?,2,1,2,3,4,Gas Technology and Engineering,0.7741
