question,answer,A,B,C,D,Category,Human Accuracy
실내디자인 프로세스의 기본계획 단계에 포함되지 않는 것은?,3,내부적 요구 분석,계획의 평가기준 설정,기본계획 대안들의 도면화,건축적 요소와 설비적 요소의 분석,Interior Architecture and Design,0.0
시스템 가구에 관한 설명으로 옳은 것은?,3,기능보다 디자인 측면에서 단순미가 강조되어야 한다.,특정한 사용목적이나 많은 물품을 수납하기 위해 건축화된 가구이다.,기능에 따라 여러 가지 형으로 조립 및 해체가 가능하여 공간의 융통성을 꾀할 수 있다.,모듈화된 단위 구성재의 결합을 통해 다양한 디자인으로 변형이 가능해야 하기 때문에 대량생산이 어렵다.,Interior Architecture and Design,0.0
JPG와 GIF의 장점만을 가진 포맷으로 트루컬러를 지원하고 비손실 압축을 사용하여 이미지 변형 없이 원래 이미지를 웹상에 그대로 표현할 수 있는 포맷 형식은?,3,PCX,BMP,PNG,PDF,Interior Architecture and Design,0.0
광원에 따라 물체의 색이 달라 보이는 것과는 달리 서로 다른 두 색이 어떤 광원 아래서는 같은 색으로 보이는 현상은?,4,연색성,잔상,분광반사,메타메리즘,Interior Architecture and Design,0.0
스컬러 모멘트(scalar moment)라는 면적 비례를 적용하여 조화론을 전개한 학자는?,3,오스트발트,먼셀,문∙스펜서,비렌,Interior Architecture and Design,0.0
NCS 표기법의 “S2030-Y90R”에 대한 설명 중 틀린 것은?,4,NCS색 견본 두 번째 판(second edition)을 뜻한다.,20%의 검정색도와 30%의 유체색도이다.,YR의 혼합비율로 90%의 빨강 색도를 띤 노란색이다.,90%의 노란 색도를 띤 빨간색을 뜻한다.,Interior Architecture and Design,0.0
색채의 강약감과 관련이 있는 색의 속성은?,1,채도,명도,색상,배색,Interior Architecture and Design,1.0
빛의 강도가 바뀌거나 눈의 순응상태가 바뀌어도 눈에 보이는 색은 변하는 것이 아니라는 것을 경험하는 현상은?,1,색순응,암순응,명순응,무채순응,Interior Architecture and Design,1.0
잔상이나 대비현상을 간단하게 설명할 수 있는 색각이론을 만든 사람은?,2,영∙헬름홀츠,헤링,오스트발트,먼셀,Interior Architecture and Design,0.0
어둠이 깔리기 시작하면 추상체와 간상체가 작용하여 상이 흐릿하게 보이는 상태는?,2,시감도,박명시,항상성,색순응,Interior Architecture and Design,0.0
관용색명 중 원료에 따른 색명으로 맞는 것은?,4,피콕그린,베이지,라벤더,세피아,Interior Architecture and Design,0.0
실내색채에 있어서 특히 천장에 적합한 반사율과 색으로 가장 적합한 것은?,4,"반사율 약 50~60%의 청색, 남색","반사율 약 15~20%의 검정, 군청색","반사율 약 15~30%의 녹색, 황토색, 회색","반사율 약 80~90%의 백색, 상아(象牙)색, 크림(cream)색",Interior Architecture and Design,0.0
인체의 각 기관계와 해당하는 기관이 맞게 연결된 것은?,2,순환계 : 신경,호흡기계 : 후두,순환계 : 위장,호흡기계 : 림프관,Interior Architecture and Design,0.0
눈의 시세포에 관한 설명으로 맞는 것은?,4,원추세포는 색을 구분할 수 없다.,원추세포의 수는 간상세포의 수보다 많다.,간상세포는 난색계열의 색을 구분할 수 있다.,사람의 한 눈에는 1억 3천만여개의 간상세포가 있다.,Interior Architecture and Design,0.0
물리적 자극을 상대적으로 판단할 때 변화감지역은 기준 자극의 크기에 비례한다는 법칙은?,3,Fitts 법칙,Miller 법칙,Weber 법칙,Norman 법칙,Interior Architecture and Design,0.0
인간-기계 체계(Man-machine System) 분류 중 기계화 체계의 예로 적합한 것은?,2,자동교환기,자동차의 운전,컴퓨터공정제어,장인과 공구의 사용,Interior Architecture and Design,0.0
“소음작업”은 1일 8시간 작업을 기준으로 얼마 이상의 소음이 발생하는 작업을 말하는가?,1,85dB,90dB,95dB,100dB,Interior Architecture and Design,1.0
운전대에 대한 일반적인 설명으로 틀린 것은?,4,운전대의 직경은 35.6~38cm가 적당하다.,스포츠카의 운전대는 경사도 60~90° 사이가 이상적이다.,버스나 화물차등의 운전대는 45~60° 정도로 기울어져 있는 것이 좋다.,크고 무거운 차량의 동력조절 장치가 없는 운전대는 수직으로 설치한다.,Interior Architecture and Design,0.0
인간공학에 대한 설명 중 틀린 것은?,1,인간요소를 고려한 학문으로서 일본에서 태동하였다.,실용적 효능과 인생의 가치 기준을 높이는데 목표를 두고 있다.,인간의 특성이나 행동에 대한 적절한 정보를 체계적으로 적용하는 것이다.,"물건, 기구, 환경을 설계하는 과정에서 인간을 고려하는데 초점을 두고 있다.",Interior Architecture and Design,1.0
안전색과 그 일반적인 의미의 사용예가 바르게 짝지어진 것은?,1,파랑 - 지시 표지,노랑 - 방화 표지,빨강 - 안내 표지,녹색 - 방사능 표지,Interior Architecture and Design,1.0
"수평 작업대 설계 시, 상완을 자연스럽게 수직으로 늘어 뜨린 상태에서 전완을 뻗어 파악할 수 있는 영역은?",3,최대작업영역,통상작업영역,정상적업영역,대칭작업영역,Interior Architecture and Design,0.0
색채조절에 대한 설명으로 맞는 것은?,3,보통 기기에는 채도를 8 이상으로 유지해야 한다.,색을 볼 때 피로를 느끼는 것은 주로 명도에 영향을 받기 때문이다.,기계류의 중요한 부분은 주의를 집중시킬 수 있는 색으로 두드러지게 한다.,기계의 움직이는 부분과 조작의 중심점같이 집점이 되는 부분은 다른 부분과 비슷한 색채를 사용하는 것이 좋다.,Interior Architecture and Design,0.0
일반적인 지침(指針)의 설계의 요령으로 볼 수 없는 것은?,2,선각이 약 20°정도 되는 뾰족한 지침을 사용한다.,"지침의 끝은 작은 눈금과 맞닿고, 겹치도록 해야 한다.",시차를 줄이기 위하여 지침은 눈금면과 밀착시킨다.,원형 눈금의 경우 지침의 색은 선단에서 눈금의 중심까지 칠한다.,Interior Architecture and Design,0.0
"사람이 정확하고 정밀한 동작을 수행하기 위해 근육들이 반대 방향으로 작용을 하며 정적인 반응을 보이는데 이 때 근육의 잔잔한 떨림(진전, 振顫)이 일어난다. 진전을 감소시킬 수 있는 방법이 아닌 것은?",2,시각적인 참조,손이 심장높이보다 높게 함,작업 대상물에 기계적인 마찰을 생성,몸과 작업에 관계되는 부위를 잘 받침,Interior Architecture and Design,0.0
감각기관을 통하여 환경의 자극에 대한 정보를 감지하여 받아들이는 과정을 무엇이라 하는가?,1,지각,순응,청각,반응,Interior Architecture and Design,1.0
"상하, 전진, 좌우운동을 탐지하는 귀 내부의 평형기관은?",4,고막,외이,중이,세반고리관,Interior Architecture and Design,0.0
생체리듬에 관한 설명으로 틀린 것은?,2,"육체적 리듬(Physical rhythm)은 23일의 반복주기로 활동력, 지구력 등과 밀접한 관계가 있다.","위험일(Critical day)은 각각의 리듬이 (-)의 최저점에 이르는 때를 의미하며, 한 달에 6일 정도 발생한다.","지성적 리듬(Intellecrual rhythm)은 33일의 반복주기로 사고력, 기억력, 의지 판단 및 비판력과 밀접한 관계가 있다.","감성적 리듬(Sensitivity rhythm)은 28일의 반복주기로 신체 조직의 모든 기능을 통하여 발현되는 감정, 즉 정서적 희로애락, 주의력, 예감 및 통찰력 등을 좌우한다.",Interior Architecture and Design,0.0
생리적 긴장을 나타내는 척도(지표)가 아닌 것은?,3,혈압,심박수,작업 속도,호흡수,Interior Architecture and Design,0.0
연속적으로 변화하는 값을 표시하기에 가장 적합한 표시 장치(display)는?,4,계수형(digital),회화형(pictogram),동목형(moving scale),동침형(moving pointer),Interior Architecture and Design,0.0
미장재료의 경화작용에 관한 설명으로 옳지 않은 것은?,2,시멘트 모르타르는 물과 화학반응을 일으켜 경화한다.,회반죽은 물과 화학반응을 일으켜 경화한다.,"반수석고는 가수 후 20~30분에서 급속 경화하지만, 무수석고는 경화가 늦기 때문에 경화촉진제를 필요로 한다.",돌로마이트 플라스터는 공기 중의 탄산가스와 화학반응을 일으켜 경화한다.,Interior Architecture and Design,0.0
굳지 않은 콘크리트의 성질을 나타내는 용어에 관한 설명으로 옳지 않은 것은?,3,펌퍼빌리티(pumpability)는 콘크리트 펌프를 사용하여 시공하는 콘크리트의 워커빌리티를 판단하는 하나의 척도로 사용된다.,워커빌리티(workability)는 컨시스턴시에 의한 부어넣기의 난이도 정도 및 재료분리에 저항하는 정도를 나타낸다.,플라스티시티(plasticity)는 수량에 의해서 변화하는 콘크리트 유동성의 정도이다.,피니셔빌리티(finishability)는 마무리하기 쉬운 정도를 말한다.,Interior Architecture and Design,0.0
목재의 건조방법 중 천연건조에 관한 설명으로 옳지 않은 것은?,4,비교적 균일한 건조가 가능하다.,시설 투자비용 및 작업비용이 적다.,건조 소요시간이 오래 걸린다.,잔적장소가 좁아도 가능하다.,Interior Architecture and Design,0.0
"표준시방서에 따른 에폭시계도료 도장의 종류 중 내수, 내해수를 목적으로 사용할 때 가장 적합한 것은?",4,에폭시 에스테르 도료,2액형 에폭시 도료,2액형 후도막 에폭시 도료,2액형 타르 에폭시 도료,Interior Architecture and Design,0.0
"대리석, 사문암, 화강암의 쇄석을 종석으로 하여 보통포틀랜드 시멘트 또는 백색포틀랜드 시멘트에 안료를 섞어 충분히 다진 후 양생하여 가공연마 한 것으로 미려한 광택을 나타내는 시멘트 제품은?",1,테라조판,펄라이트 시멘트판,듀리졸,펄프 시멘트판,Interior Architecture and Design,1.0
일종의 못박기총을 사용하여 콘크리트나 강재등에 박는 특수못을 의미하는 것은?,1,드라이브핀,인서트,익스팬션볼트,듀벨,Interior Architecture and Design,1.0
"투명도가 높으므로 유기유리라는 명칭이 있으며, 착색이 자유롭고 내충격강도가 크고, 평판, 골판 등의 각종 형태의 성형품으로 만들어 채광판, 도어판, 칸막이벽 등에 쓰이는 합성수지는?",4,폴리스티렌수지,에폭시수지,요소수지,아크릴수지,Interior Architecture and Design,0.0
목재의 역학적 성질에 관한 설명으로 옳지 않은 것은?,2,목재 섬유 평행방향에 대한 인장강도가 다른 여러 강도 중 가장 크다.,목재의 압축강도는 옹이가 있으면 증가한다.,"목재를 휨부재로 사용하여 외력에 저항할 때는 압축, 인장, 전단력이 동시에 일어난다.","목재의 전단강도는 섬유간의 부착력, 섬유의 곧음, 수선의 유무 등에 의해 결정된다.",Interior Architecture and Design,0.0
목재를 조성하고 있는 원소 중 차지하는 비중이 가장 큰 것은?,1,탄소,산소,질소,수소,Interior Architecture and Design,1.0
콘크리트의 블리딩 현상에 의한 성능저하와 가장 거리가 먼 것은?,4,골재와 페이스트의 부착력 저하,철근과 페이스트의 부착력 저하,콘크리트의 수밀성 저하,콘크리트의 응결성 저하,Interior Architecture and Design,0.0
각 목재 방부제의 특징에 관한 설명으로 옳지 않은 것은?,2,"크레오소트유 : 도장이 불가능하며, 독성이 적고 자극적인 냄새가 난다.",CCA : 도장이 가능하고 독성이 없으며 처리재는 무색이다.,PCP : 도장이 가능하며 처리재는 무색으로 성능이 우수한 유용성 방부제이다.,PF : 도장이 가능하고 독성이 있으며 처리재는 황록색이다.,Interior Architecture and Design,0.0
일반 석재와 비교한 화강암의 성질에 관한 설명으로 옳지 않은 것은?,3,내구성 및 강도가 크다.,내화도가 낮아 가열시 균열이 생긴다.,조각재료로 매우 적합하다.,절리의 거리가 비교적 커서 큰 판재로 생산할 수 있다.,Interior Architecture and Design,0.0
온도에 따른 탄소강의 기계적 성질에 관한 설명으로 옳지 않은 것은?,3,연신율은 200~300℃에서 최소로 된다.,인장강도는 500℃ 정도에서 상온 강도의 약 1/2로 된다.,인장강도는 100℃ 정도에서 최대로 된다.,항복점과 탄성한계는 온도가 상승함에 따라 감소한다.,Interior Architecture and Design,0.0
"목재접합, 합판제조 등에 사용되며, 다른 접착제와 비교하여 내수성이 부족하고 값이 저렴한 접착제는?",1,요소수지 접착제,푸린수지 접착제,에폭시수지 접착제,실리콘수지 접착제,Interior Architecture and Design,1.0
실리콘 수지에 관한 설명으로 옳은 것은?,2,평판 성형되어 글라스와 같이 이용되는 경우가 많으며 유기유리라고도 불린다.,물을 튀기는 성질이 있어 방습켜가 없는 벽체에 주입하여 습기가 스며 오르는 것을 막는데 쓰인다.,아미노계에 속하는 열가소성수지로 내수성이 크고 열탕에서도 침식되지 않는다.,"발포제로서 보드상으로 성형하여 단열재로 널리 사용되며 건축용 벽타일, 천장재, 전기용품 등에 쓰인다.",Interior Architecture and Design,0.0
미장 바탕이 갖추어야 할 조건으로 옳지 않은 것은?,3,바름층과 유해한 화학반응을 하지 않을 것,바름층을 지지하는데 필요한 접착강도를 얻을 수 있을 것,"바름층보다 강도, 강성이 크지 않을 것","바름층의 경화, 건조를 방해하지 않을 것",Interior Architecture and Design,0.0
"학교 교실의 채광을 위하여 설치하는 창문 등의 면적은 교실 바닥면적의 최소 얼마 이상이어야 하는가? (단, 거실의 용도에 따른 기준 조도 이상의 조명장치를 설치한 경우는 제외한다.)",3,1/5,1/8,1/10,1/20,Interior Architecture and Design,0.0
외벽 중 비내력벽의 경우 내화구조로 인정받기 위한 기준으로 옳지 않은 것은?,4,철근콘크리트조 또는 철골철근콘크리트조로서 두께가 7cm 이상인 것,골구를 철골조로 하고 그 양면을 두께 3cm 이상의 철망모르타르 또는 두께 4cm 이상의 콘크리트블록∙벽돌 또는 석재로 덮은 것,철재로 보강된 콘크리트블록조∙벽돌조 또는 석조로서 철재에 덮은 콘크리트블록등의 두께가 4cm 이상인 것,무근콘크리트조 ㆍ 콘크리트블록조∙벽돌조 또는 석조로서 그 두께가 5cm 이상인 것,Interior Architecture and Design,0.0
주요구조부를 내화구조로 하여야 하는 대상 건축물의 기준으로 옳지 않은 것은?,3,문화 및 집회시설 중 전시장의 용도로 쓰이는 건축물로서 그 용도로 쓰는 바닥면적의 합계가 500m 이상인 건축물,창고시설의 용도로 쓰는 건축물로서 그 용도로 쓰는 바닥면적의 합계가 500m2 이상인 건축물,공장의 용도로 쓰는 건축물로서 그 용도로 쓰는 바닥면적의 합계가 1000m2 이상인 건축물,운동시설 중 체육관의 용도로 쓰는 건축물로서 그 용도로 쓰는 바닥면적의 합계가 500m2 이상인 건축물,Interior Architecture and Design,0.0
건축물의 피난・방화구조 등의 기준에 관한 규칙에 따른 방화구조의 기준으로 옳지 않은 것은?,2,철망모르타르로서 그 바름두께가 2cm 이상인 것,석고판위에 시멘트모르타르 또는 회반죽을 바른 것으로서 그 두께의 합계가 1.5cm 이상인 것,시멘트모르타르위에 타일을 붙인 것으로서 그 두께의 합계가 2.5cm 이상인 것,심벽에 흙으로 맞벽치기한 것,Interior Architecture and Design,0.0
한국건축의 조형 의장상 특징과 거리가 먼 것은?,4,친근감을 주는 척도,착시현상 조정,자연과의 조화,인위적인 기교,Interior Architecture and Design,0.0
숙박시설의 객실간 경계벽의 구조 및 설치 기준으로 옳지 않은 것은?,4,내화구조로 하여야 한다.,지붕밑 또는 바로 윗층의 바닥판까지 닿게 한다.,철근콘크리트조의 경우에는 그 두께가 10cm 이상이어야 한다.,콘크리트블록조의 경우에는 그 두께가 15cm 이상이어야 한다.,Interior Architecture and Design,0.0
"문화 및 집회시설 중 공연장의 각층별 거실면적이 1000m 일 때, 이 공연장에 설치하여야 하는 승용승강기의 최소대수는? (단, 공연장의 층수는 10층이며, 8인승 이상 15인승 이하 승강기 적용)",1,3대,4대,5대,6대,Interior Architecture and Design,1.0
소방시설 중 경보설비의 종류에 해당하지 않는 것은?,4,비상방송설비,자동화재탐지설비,자동화재속보설비,무선통신보조설비,Interior Architecture and Design,0.0
목조건물의 내진(耐震)설계에 관여하는 요소 중 가장 중요한 것은?,3,기초의 구조형태,마감재의 형태와 치수,가새의 배치법과 치수,지붕의 구조와 형태,Interior Architecture and Design,0.0
"수평면, 수직면, 수직선과 수평선 및 기본색을 근간으로하여 순수 기하학적 추상주의를 표방하는 사조는?",1,신조형주의(Neo Plasticism),요소주의(Elementalism),순수주의(Purism),절대주의(Suprematism),Interior Architecture and Design,1.0
널의 옆물림을 위하여 한옆에는 혀를 내고 다른 옆은 홈을 파서 물린 형태로 보행의 진동이 있는 마루널깔기에 적합한 쪽매는?,1,제혀쪽매,맞댄쪽매,반턱쪽매,틈막이쪽매,Interior Architecture and Design,1.0
문화 및 집회시설 중 공연장의 개별 관람석의 바깥쪽에 있어 그 양쪽 및 뒤쪽에 각각 복도를 설치하여야 하는 최소 바닥면적의 기준으로 옳은 것은?,1,개별 관람석의 바닥면적이 300m2 이상,개별 관람석의 바닥면적이 400m2 이상,개별 관람석의 바닥면적이 500m2 이상,개별 관람석의 바닥면적이 600m2 이상,Interior Architecture and Design,1.0
"건축물의 신축∙증축∙개축 등에 대한 행정기관의 동의 요구를 받은 소방본부장 또는 소방서장은 건축허가 등의 동의요구서류를 접수한 날부터 얼마 이내에 동의여부를 회신 하여야 하는가? (단, 특급 소방안전관리대상물이 아닌 경우)",3,3일 이내,4일 이내,5일 이내,6일 이내,Interior Architecture and Design,0.0
아파트가 특급 소방안전관리대상물로 되기 위한 기준으로 옳은 것은?,1,50층 이상(지하층은 제외한다)이거나 지상으로부터 높이가 200m 이상인 아파트,30층 이상(지하층은 제외한다)이거나 지상으로부터 높이가 120m 이상인 아파트,25층 이상(지하층은 제외한다)이거나 지상으로부터 높이가 100m 이상인 아파트,연면적 20만 m 이상인 아파트,Interior Architecture and Design,1.0
복사난방에 관한 설명으로 옳은 것은?,4,천장이 높은 방의 난방은 불가능하다.,실내의 쾌감도가 다른 방식에 비하여 가장 낮다.,외기 침입이 있는 곳에서는 난방감을 얻을 수 없다.,열용량이 크기 때문에 방열량 조절에 시간이 걸린다.,Interior Architecture and Design,0.0
연속기포 다공질 흡음재료에 속하지 않는 것은?,3,암면,유리면,석고보드,목모시멘트판,Interior Architecture and Design,0.0
열이나 유해물질이 실내에 널리 산재되어 있거나 이동되는 경우에 급기로 실내의 공기를 희석하여 배출시키는 환기방법은?,2,상향환기,전체환기,국소환기,집중환기,Interior Architecture and Design,0.0
"실내 어느 한 점의 수평면 조도가 200lx이고, 이때 옥외 전천공 수평면 조도가 20000lx인 경우, 이 점의 주광률은?",3,0.01%,0.1%,1%,10%,Interior Architecture and Design,0.0
전기사업법령에 따른 저압의 범위로 옳은 것은?(2021년 개정된 KEC 규정 적용됨),4,"직류 500V 이하, 교류 1000V 이하","직류 1000V 이하, 교류 500V 이하","직류 600V 이하, 교류 750V 이하","직류 1000 이하, 교류 1500V 이하",Interior Architecture and Design,0.0
음파는 파동의 하나이기 때문에 물체가 진행방향을 가로막고 있다고 해도 그 물체의 후면에도 전달된다. 이러한 현상을 무엇이라 하는가?,3,잔향,굴절,회절,간섭,Interior Architecture and Design,0.0
열전도율에 관한 설명으로 옳은 것은?(오류 신고가 접수된 문제입니다. 반드시 정답과 해설을 확인하시기 바랍니다.),2,열전도율의 단위는 W/m2K이다.,열전도율의 역수를 열전도 비저항이라고 한다.,"액체는 고체보다 열전도율이 크고, 기체는 더욱더 크다.",열전도율이란 두께 1cm판의 양면에 1℃의 온도차가 있을때 1cm의 표면적을 통해 흐르는 열량을 나타낸 것이다.,Interior Architecture and Design,0.0
광원의 광색 및 색온도에 관한 설명으로 옳지 않은 것은?,3,색온도가 낮은 광색은 따뜻하게 느껴진다.,일반적으로 광색을 나타내는데 색온도를 사용한다.,주광색 형광램프에 비해 할로겐전구의 색온도가 높다.,일반적으로 조도가 낮은 곳에서는 색온도가 낮은 광색이좋다.,Interior Architecture and Design,0.0
겨울철 벽체 표면 결로의 방지 대책으로 옳지 않은 것은?,1,실내의 환기 횟수를 줄인다.,실내의 발생 수증기량을 줄인다.,단열강화에 의해 실내측 표면온도를 상승시킨다.,직접가열이나 기류촉진에 의해 표면온도를 상승시킨다.,Interior Architecture and Design,1.0
배수트랩에 관한 설명으로 옳지 않은 것은?,1,트랩은 배수능력을 촉진시킨다.,"관트랩에는 P트랩, S트랩, U트랩 등이 있다.",트랩은 기구에 가능한 한 근접하여 설치하는 것이 좋다.,트랩의 유효봉수깊이가 너무 낮으면 봉수가 손실되기 쉽다.,Interior Architecture and Design,1.0
일반적으로 하향급수 배관방식을 사용하는 급수방식은?,1,고가수조방식,수도직결방식,압력수조방식,펌프직송방식,Interior Architecture and Design,1.0
간접가열식 급탕방법에 관한 설명으로 옳지 않은 것은?,3,열효율은 직접가열식에 비해 낮다.,가열 보일러로 저압 보일러의 사용이 가능하다.,가열 보일러는 난방용 보일러와 겸용할 수 없다.,저탕조는 가열코일을 내장하는 등 구조가 약간 복잡하다.,Interior Architecture and Design,0.0
실내에서 눈부심(glare)을 방지하기 위한 방법으로 옳지 않은 것은?,4,휘도가 낮은 광원을 사용한다.,고휘도의 물체가 시야 속에 들어오지 않게 한다.,플라스틱 커버가 되어 있는 조명기구를 선정한다.,시선을 중심으로 30° 범위 내의 글레어 존에 광원을 설치한다.,Interior Architecture and Design,0.0
다중이용시설 중 대규모 점포의 실내공기질 유지 기준에 따른 이산화탄소의 기준 농도는?,1,1000ppm 이하,1500ppm 이하,2000ppm 이하,3000ppm 이하,Interior Architecture and Design,1.0
일사에 관한 설명으로 옳지 않은 것은?,4,차폐계수가 낮은 유리일수록 차폐효과가 크다.,일사에 의한 벽면의 수열량은 방위에 따라 차이가 있다.,창면에서의 일사조절 방법으로 추녀와 차양 등이 있다.,벽면의 흡수율이 크면 벽체내부로 전달되는 일사량은 적어진다.,Interior Architecture and Design,0.0
조명 연출 기법 중 실루엣(silhouette) 기법에 관한 설명으로 옳은 것은?,1,물체의 형상만을 강조하는 기법으로 시각적인 눈부심이 없다.,빛의 각도를 이용하는 기법으로 벽면 마감재료의 재질감을 강조시킨다.,물체를 강조하기 위해 사용되는 기법으로 하이라이팅(high lighting)이라고도 한다.,강조하고자 하는 물체에 의도적인 광선으로 조사시킴으로써 광선 그 자체가 시각적인 특성을 지니게 하는 기법이다.,Interior Architecture and Design,1.0
황금비례에 관한 설명으로 옳지 않은 것은?,2,1 : 1.618의 비율이다.,고대 로마인들이 창안했다.,몬드리안의 작품에서 예를 들 수 있다.,건축물과 조각 등에 이용된 기하학적 분할 방식이다.,Interior Architecture and Design,0.0
사무소 건축에서 엘리베이터 배치에 관한 설명으로 옳지 않은 것은?,4,교통동선의 중심에 설치하여 보행거리가 짧도록 배치한다.,대면배치 시 대면거리는 동일 군 관리의 경우는 3.5~4.5m로 한다.,"여러 대의 엘리베이터를 설치하는 경우, 그룹별배치와 군 관리 운전방식으로 한다.","일렬 배치는 8대를 한도로 하고, 엘리베이터 중심 간거리는 8m 이하가 되도록 한다.",Interior Architecture and Design,0.0
