question,answer,A,B,C,D,Category,Human Accuracy
건축물에 경계벽 및 간막이벽을 설치함에 있어 소리를 차단하는데 장애가 되는 부분이 없도록 하기 위한 구조기준으로 옳지 않은 것은?,3,철근콘크리트조로서 두께가 10cm 이상인 것,무근콘크리트조로서 두께가 10cm 이상인 것,석조로서 두께가 15cm 이상인 것,콘크리트블록조로서 두께가 19cm 이상인 것,Interior Architecture and Design,0.7273000000000001
스테인드 글라스(Stained Glass)에 대한 설명을 중 옳지 않은 것은?,1,르네상스시대가 스테인드글라스 예술의 전성기다.,아르누보를 통해 스테인드글라스 예술이 부활하였으나 곧 근대건축운동에 의해 쇠퇴하였다.,스테인드글라스는 빛의 투과광을 주로 이용한다.,스테인드글라스의 기원은 로마시대 초기의 교회 건물내부에서 찾아볼 수 있다.,Interior Architecture and Design,0.5455
田자형 주택에 관한 설명 중 올지 않은 것은?,4,대청이나 마루 공긴아 없다.,"부엌, 정주간, 방의 온돌기능을 최대한 활용한 주택이다.","후면이 북향이 되므로 균등한 일조, 일사를 이루지 못한다.",제주도 지방의 독특한 평면 형태이다.,Interior Architecture and Design,0.6818000000000001
점광원으로부터 일정 거리 떨어진 수평면의 조도에 관한 설명으로 옳지 않은 것은?,4,광원의 광도에 비례한다.,거리의 제곱에 반비례한다.,cosθ(입사각)에 비례한다.,측정점의 반사율에 반비례한다.,Interior Architecture and Design,0.5161
자연환기량에 관한 설명으로 옳지 않은 것은?,1,풍속이 높으수록 작아진다.,실내외의 온도차가 클수록 많아진다.,실내외의 압력차가 클수록 많아진다.,공기유입구와 유출구의 높이의 차이가 클수록 많아진다.,Interior Architecture and Design,0.5714
주관적 온열요소 중 착의상태의 단위는?,3,met,m/s,clo,%,Interior Architecture and Design,0.8181999999999999
각종 흡음재에 관한 설명으로 옳지 않은 것은?,4,판진동 흡음재는 저음역의 흡음재로 유용하다.,판진동 흡음재는 강성벽의 앞에 공기층을 설치하여 부착시킨다.,다공성 흡음재는 재료의 두께를 증가시키믕로서 저주파수에서의 흡음률을 증가시킬 수 있다.,다공성 흡음재의 표면을 다른 재료로 피복하여 통기성을 낮출 경우 중·고주파수에서의 흡음률이 높아진다.,Interior Architecture and Design,0.4783
램프광속 중 조명범위에 유효하게 이용되는 광속의 비율을 의미하는 것은?,3,보수율,수용률,조명률,주광률,Interior Architecture and Design,0.6364
전기설비의 전압 구분에서 저압의 기준으로 옳은 것은?,3,"교류 300V 이하, 직류 600V 이하","교류 600V 이하, 직류 300V 이하","교류 600V 이하, 직류 750V 이하","교류 750V 이하, 직류 600V 이하",Interior Architecture and Design,0.5455
건축물의 에너지 절약을 위한 단열계획으로 옳지 않은 것은?,2,외벽 부위는 외단열로 시공한다.,건물의 창호는 태양열 유입을 위해 가능한 크게 설계한다.,외피의 모서리 부분은 열교가 발생하지 않도록 단열재를 연속적으로 설치하고 충분히 단열되도록 한다.,발코니 확장을 하는 공동주택이나 창호면적이 큰 건물에는 단열성이 우수한 로이(Low-E) 복층유리 등을 설치한다.,Interior Architecture and Design,0.6957
바닥충격음에 대한 차음대책으로 옳지 않은 것은?,2,뜬바닥 구조를 활요한다.,투과손실이 작은 재료를 사용한다.,쿠션성이 있는 바닥마감재를 사용한다.,천장반자 시공에 의한 이중천장으로 설치한다.,Interior Architecture and Design,0.6087
실내의 압력이 외부보다 높아지고 공기가 실외에서 유입되는 경우가 적은 기계환기법은?,3,흡출식,풍력식,압입식,중력식,Interior Architecture and Design,0.8
급탕배관의 설계 및 시공상의 주의점으로 옳지 않은 것은?,2,중앙식 급탕설비는 원칙적으로 강제순환방식으로 한다.,수시로 원하는 온도의 탕을 얻을 수 있도록 단관식으로 한다.,관의 신축을 고려하여 건물의 벽관통부분의 배관에는 슬리브를 설치한다.,순환식 배관에서 탕의 순환을 방해하는 공기가 정체하지 않도록 수평관에는 일정한 구배를 둔다.,Interior Architecture and Design,0.6818000000000001
공간을 분할하는 방법에 관한 설명으로 옳지 않은 것은?,1,열주를 이용한 구획은 기둥의 간격과 높이에 관계없이 동일한 공간분할의 효과가 있다.,이동 스크린벽을 사용할 경우 필요에 따라 공간을 구획할 수 있으므로 공간 사용에 융통성이 있다.,"공간을 어떤 요소로 구획하느냐에 따라 차단적구획, 심리ㆍ도덕적 구획, 지각적 구획으로 구분할 수 있다.","마감재료의 재질감, 패턴, 색 등을 이용한 변화나 서로 다른 재료를 사용하여 공간분할의 효과를 얻을 수 있다.",Interior Architecture and Design,0.8065000000000001
수직벽면을 및으로 쓸어 내리는 듯한 효과를 주기 위해 비태칭 배광방식의 조명기구를 사용하여 수직벽면에 균일한 조도의 빛을 비추는 조명 연출기법은?,3,그레이징(glazing) 기법,빔플레이(beam play) 기법,월워싱(wall washing) 기법,그림자연출(shadow play) 기법,Interior Architecture and Design,0.8234999999999999
실내디자인의 프로그래밍 진행단계로 가장 알맞은 것은?,2,조사 - 분석 - 결정 - 종합 - 목표설정,목표설정 - 조사 - 분석 - 종합 - 결정,목표설정 -  분석- 조사 - 종합 - 결정,조사 - 분석 - 종합 - 목표설정 - 결정,Interior Architecture and Design,0.7813
실내디자인의 과정을 “프로그래밍 - 디자인 - 시공 - 사용 후 평가”로 볼 때 사용 후 평가에 관한 설명으로 옳지 않은 것은?,3,문제점을 발견하고 다음 작업의 기초자료로 활용한다.,시공 후 실내디자인에 대한 거구자의 만족도를 조사하는 것이다.,다음 작업의 시행착오를 줄이기 위하여 디자이너가 평가하는 것이 보통이다.,입주 후 충분한 시간이 경과한 후 실시하는 것이 결과의 정확도를 높일 수 있다.,Interior Architecture and Design,0.8667
선이 갖는 조형심리적 효과에 관한 설명으로 옳은 것은?,2,곡선을 경쾌하며 남성적인 느낌을 들게 한다.,수직선을 구조적인 높이와 존엄성을 느끼게 한다.,"사선은 생동감이 넘치는 에너지를 느끼게 하며, 동시에 안정되고 편안함을 준다.","수평선은 확대, 무한 등의 느낌을 줌과 동시에 감정을 동요시키는 특성이 있다.",Interior Architecture and Design,0.4839
저드(D. B. Judd)의 색채조화론과 관계없는 것은?,4,질서의 원리,동류의 원리,숙지의 원리,모호성의 원리,Interior Architecture and Design,0.6667000000000001
"신인상파 화가들의 점묘화, 교직물(交織物), 사진인쇄 등에 이용되는 색의 혼합현상은?",2,회전혼합,병치혼합,감산혼합,색료혼합,Interior Architecture and Design,0.7059000000000001
먼셀기호 ‘5Y 8/10’에서 숫자 10은?,4,색상,명도,색조,채도,Interior Architecture and Design,0.7429000000000001
감법혼색에 관한 설명 중 옳은 것은?,2,무대 조명에 많이 사용한다.,컬러 인쇄에 많이 사용한다.,컬러 TV에 많이 사용한다.,흑백 TV에 많이 사용한다.,Interior Architecture and Design,0.6
우리가 영화를 볼 때 규칙적으로 화면이 연결되거나 언제나 상이 지속되어 보이는 것은 어떤 현상에 의한 것인가?,2,푸르킨예 현상,잔상현상,동화현상,연상작용,Interior Architecture and Design,0.7059000000000001
정상적인 눈을 가진 사람도 미소한 색을 볼 때 일어나는 생각혼란은?,3,색상이상,잔상현상,소면적 제 3 색각이상,주관색 현상,Interior Architecture and Design,0.8056
하늘의 색과 같이 넓이의 느낌은 있으나 거리감이 불확실하고 물체감 없이 색 자체만을 느끼게 하는 색은?,4,표면색,공간색,광원색,면색,Interior Architecture and Design,0.5789
"색입체를 수평으로 절단하면 중심축의 회색 주위에 나타나는 모양은? (단, 먼셀 색체계 기준)",3,같은 채도의 여러 색상,같은 색상의 채도 변화,같은 명도의 여러 색상,같은 명도의 같은 색상,Interior Architecture and Design,0.5556
물체가 가지고 있는 정확한 색체와 형체를 감지할 수 있는 것은?,2,각막,망막,맥락막,공막,Interior Architecture and Design,0.6053000000000001
오스트발트의 색체 조화론과 관계있는 것은?,2,"동등조화, 유사조화","등백색 계열 조화, 등순색 계열 조화","대비조화, 유사조화","제1부조화, 제2부조화",Interior Architecture and Design,0.6944
아름다운 결을 갖는 고급목재로부터 무늬목을 얻는데 쓰이는 합판의 제조법과 가장 거리가 먼 것은?,1,로터리 베니어,소우드 베니어,반원 슬라이스드 베니어,슬라이스드 베니어,Interior Architecture and Design,0.5714
셀프레벨링재에 대한 설명으로 옳지 않은 것은?,3,"석고계 셀프레벨링재는 석고, 모래, 경화지연제 및 동화제로 구성된다.","시멘트계 셀프레벨링재는 포틀랜드시멘트, 모래, 분산제 및 유동화제로 구성된다.",석고계 셀프레벨링재는 차수성이 좋아 옥외 및 실내에서 모두 사용한다.,"셀프레벨링재 시공 후, 요철부는 연마기로 다듬고 기포는 된비빔석고로 보수한다.",Interior Architecture and Design,0.7879
유리섬유로 보강하면 강철과 유사한 강도를 나타내며 구조제나 설비재로 이용되는 합성수지는?,2,프란수지,폴리에스테르수지,폴리우레탄수지,에폭시수지,Interior Architecture and Design,0.7143
도장결함 중 광택불량의 원인으로 가장 거리가 먼 것은?,3,바탕재의 흡수가 큰 경우,너무 두껍게 바른 경우,초벌바름면이 너무 편평할 경우,백화현상이 발생한 경우,Interior Architecture and Design,0.7143
각종 시멘트에 관한 설명으로 옳지 않은 것은?,4,고로시멘트 : 초기강도는 약간 작은 편이며 화학저항성이 높다.,중용열포틀랜드시멘트 : 건조수축이 작고 화학저항성이 높다.,"백색포틀랜드시멘트 : 건축물 내외면의 마감, 각종 인조석 제조에 사용된다.",알루미나시멘트 : 보통포틀랜드시멘트에 비해 응결 및 경화시에 발열량이 작다.,Interior Architecture and Design,0.6175999999999999
트래버틴(travertine)은 어떤 암석의 일종인가?,3,화강암,안산암,대리석,응회암,Interior Architecture and Design,0.6154
환기공이나 방열기 덮개 등으로 사용되는 것은?,4,인서트(insert),와이어메쉬(wire mesh),폼타이(form tie),펀칭메탈(punching metal),Interior Architecture and Design,0.525
화성암은 규산(SiO2)의 함유량에 따라 각각 4종류로 분류할 수 있는데 함유량과 명칭이 잘못 연결된 것은?,4,규산(SiO2)의 함유량 45% 이하 - 초염기성암,규산(SiO2)의 함유량 45~55% - 염기성암,규산(SiO2)의 함유량 55~66% - 중성암,규산(SiO2)의 함유량 66% 이상 - 초중성암,Interior Architecture and Design,0.5832999999999999
"소방방재청장, 소방본부장 또는 소방서장은 소방특별조사를 하려면 며칠 전에 관계인에게 조사대상, 조사기간 및 조사 사유 등을 서면으로 알려야 하는가?",2,5일,7일,9일,12일,Interior Architecture and Design,0.8065000000000001
조적구조에 관한 설명 중 옳지 않은 것은?,4,"조적구조는 내화성, 내구성 등의 성능을 고루 갖추면서 시공이 용이한 편이다.",기초침하 등으로 벽면이 쉽게 균열이 생긴다.,조적구조는 3~4층 이하의 소규모 건축물의 내력벽으로 널리 쓰인다.,횡력 및 충격에 강하고 습기에 의해 동파되지 않는다.,Interior Architecture and Design,0.6207
"문화 및 집회시설, 업무시설, 숙박시설 등에 배연설비를 설치해야 할 건축물은 최소 몇 층 이상인가?",2,3층,6층,9층,11층,Interior Architecture and Design,0.5861999999999999
아르누보 건축가와 작품의 연결이 잘못된 것은?,4,빅토르 오르타(Victor Horta) - 타셀주택,안토니오 가우디(Antonio Gaudi) - 카사 밀라,핵토르 귀마르(Hector Guimard) - 파리 지하철역 입구,피터 베렌스(Peter Berens) - 귀엘 공원,Interior Architecture and Design,0.5667
블록쌓기에 관한 설명 중 옳지 않은 것은?,4,블록벽체에는 온도나 습도의 변화에 따라 벽체에 발생하는 수평방향의 응력을 조절하기 위하여 조절 줄눈을 설치할 수 있다.,블록의 이음색 및 빈속에 콘크리트를 부어 넣을 때에는 둥근막대로 충분히 다지면서 채워넣는다.,"인방블록쌓기는 인방블록, 혹은 가로근용 블록을 창문틀의 좌우 턱에 20cm 이상 물린다.",블록은 살두께가 두꺼운 쪽이 아래로 향하게 하여 쌓는다.,Interior Architecture and Design,0.6429
"철근콘크리트 슬래브에서 단변길이 lx, 장변길이 ly라 할 때 2방향 슬래브가 되기 위한 조건은?",3,ly/lx ≧ 1,ly/lx ≦ 1,ly/lx ≦ 2,ly/lx ≧ 2,Interior Architecture and Design,0.6
"1층의 층고는 5m, 2층부터 11층까지의 층고는 3m, 각 층의 바닥면적은 2000m2인 업무시설에 설치하여야 하는 비상용승강기의 최소 대수는?",3,설치대상이 아님,1대,2대,3대,Interior Architecture and Design,0.5517
"인체의 열방출 과정 중 일반적으로 가장 높은 비율을 차지하는 것은? (단, 전도에 의한 소실이 없는 경우)",2,관류,복사,대류,증발,Interior Architecture and Design,0.6207
언어의 명료도에 직접적인 영향을 주는 요인에 해당하지 않는 것은?,2,소음,실지수,잔향시간,음의 세기,Interior Architecture and Design,0.6429
음향장해 현상의 하나인 공명을 피하기 위한 대책으로 옳지 않은 것은?,2,확산체를 적절히 사용한다.,많은 반사재를 분산배치시킨다.,실의 표면을 불규칙한 형태로 한다.,"실의 높이, 폭, 길이의 비율을 음향학적으로 바람직하도록 조절한다.",Interior Architecture and Design,0.4839
"풍력에 의한 환기량을 계산하려고 한다. 유입구 면적과 건물이 받고 있는 풍속을 각각 2배로 증가시켰을 경우 환기량의 변화는? (단, 기타 조건은 동일함)",2,2배 증가,4배 증가,6배 증가,8배 증가,Interior Architecture and Design,0.5484
복사에 의한 전열에 관한 설명으로 옳지 않은 것은?,4,일반적으로 흡수율이 작은 표면은 복사율도 작다.,물체에서 복사되는 열량은 그 표면의 절대온도의 4승에 비례한다.,"물질의 표면에 복사열 에너지가 닿으면 그 일부는 물질 내부에 흡수되고 일부는 반사되고, 나머지는 투과된다.",알루미늄박과 같은 금속의 연마면은 복사율이 1 정도로 매우 크므로 복사에 의한 열의 이동을 방지하기 위하여 표면에 사용된다.,Interior Architecture and Design,0.6897
여름철 일사를 받는 대공간 아트리움에서 자연환기가 발생되는 주동력원은?,3,습도차에 의한 환기,풍압차에 의한 환기,공기밀도차에 의한 환기,개구부 틈새에 의한 환기,Interior Architecture and Design,0.6774
임펠러의 원심력에 의해 냉매가스를 압축하는 것으로 중ㆍ대형 규모의 중앙식 공조에서 냉방용으로 사용되는 냉동기는?,1,터보식 냉동기,흡수식 냉동기,스크류식 냉동기,왕복동식 냉동기,Interior Architecture and Design,0.5861999999999999
간접조명에 관한 설명으로 옳지 않은 것은?,4,조명률이 낮다.,실내 반사율의 영향이 크다.,높은 조도가 요구되는 전반조명에는 적합하지 않다.,그림자가 거의 형성되지 않아 국부조명에 적합하다.,Interior Architecture and Design,0.5455
전시공간의 바닥에 대한 설명 중 옳지 않은 것은?,2,요철이나 잦은 단차는 피한다.,색은 벽보다 밝고 반사율이 높은 것이 좋다.,바닥재의 문양은 전시실을 압도하지 않는 것으로 한다.,미끄럽지 않고 발소리가 나지 않는 마감재료가 요구된다.,Interior Architecture and Design,0.8695999999999999
사무소 건축의 실단위계획 중 개실시스템에 대한 설명으로 옳은 것은?,2,방깊이에 변화를 주기 쉽다.,독립성과 쾌적감의 이점이 있다.,전면적을 유용하게 이용할 수 있다.,칸막이벽이 없어 공사비가 저렴하다.,Interior Architecture and Design,0.6522
질감(texture)에 대한 설명 중 옳지 않은 것은?,1,매끄러운 질감은 빛을 흡수한다.,물체가 갖고 있는 표면상의 특징이다.,촉감적 질감과 시각적 질감으로 구분할 수 있다.,효과적인 질감 표현을 위해서는 색채와 조명을 동시에 고려하여야 한다.,Interior Architecture and Design,0.88
실내디자인 프로젝트에 대한 설명 중 틀린 것은?,4,개보수인 경우는 현장의 정확한 실측과 조사가 필요하다.,건축 설계와 병행되는 경우는 건축설계자와 협조가 필요하다.,기존 공간의 개보수는 물론 신축공간의 디자인도 실내 디자인에 포함된다.,대수선 허가가 필요한 주요 구조부의 변경은 어떠한 경우에도 할 수 없다.,Interior Architecture and Design,0.7391
인테리어 이미지에 대한 설명 중 옳지 않은 것은?,1,댄디(Dandy)는 강하고 분명한 디자인으로 활동감과 약동감을 갖게 한다.,자연스러움(Natural)은 단순하면서 소박함과 따스함이 있는 형태를 기본으로 한다.,고저스(Gorgeous)는 호화롭고 사치스런 이미지로 전통적인 표현은 물론 현대적 표현도 가능하다.,"캐쥬얼(Causal)은 자유롭고 편한 이미지를 나타내며, 신선함, 활동감, 즐거움 등이 연출 포인트가 된다.",Interior Architecture and Design,0.7619
실내의 색채조절에 있어서 틀린 설명은?,2,천장색의 경우 반사율이 높으면서 눈이 부시지 않는 무광택 재료로 시공하는 것이 좋다.,벽의 아랫부분 굽도리는 벽의 윗부분보다 더 밝게 해 주는 것이 좋다.,"바닥의 경우 반사율이 낮은 색이 좋으며, 너무 어둡거나 너무 밝은 것은 좋지 않다.",문의 양쪽기둥이나 창문틀은 벽의 색과 맞도록 고려하여야 한다.,Interior Architecture and Design,0.72
스펙트럼 분광색의 파장이 긴 색부터 파장이 짧은 색으로 나열된 것은?,4,노랑 - 파랑 - 주황,빨강 - 보라 - 초록,보라 - 빨강 - 노랑,노랑 - 초록 - 파랑,Interior Architecture and Design,0.5
무대 디자인과 디스플레이를 할 때 색광을 다르게 하여 한정된 공간이 여러 가지 색으로 보여질 수 있다. 이처럼 조명에 의하여 물체의 색이 결정되는 광원의 성질은?,2,조건등색,연색성,색각이상,발괄성,Interior Architecture and Design,0.5217
동시대비현상과 관계없는 것은?,4,명도대비,마하밴드효과,진출과 후퇴,잔상효과,Interior Architecture and Design,0.5417000000000001
유채색의 수식형용사 중 ‘선명한’을 뜻하는 것은?,3,pale,light,vivid,dull,Interior Architecture and Design,0.5652
색채가 주는 감정적 효과에 대한 내용으로 틀린 것은?,1,"난색, 고채도일수록 무거운 느낌이다.","처재도, 저명도일수록 어두운 느낌이다.","고채도, 고명도일수록 화려한 느낌이다.","한색, 저채도일수록 차분한 느낌이다.",Interior Architecture and Design,0.5417000000000001
색의 연상에 대한 내용 중 틀린 것은?,4,"빨강, 주황 등은 식욕을 증진시키는데 효과적인 색이다.","파랑, 하늘색 등은 일반적으로 청결한 이미지를 나타낸다.","금속색(주로 은회색 등)은 첨단적, 현대적인 이미지를 나타낸다.","검정색은 죽음, 공포, 암흑은 연상시켜 공겁제품의 색으로는 부적합하므로 사용하고 있지 않다.",Interior Architecture and Design,0.6957
JPEG이미지 파일형식에 대한 설명으로 틀린 것은?,2,사진 등 정교한 색상표현에 많이 쓰인다.,JPEG 포맷은 256색이라는 한계를 갖는다.,압축률을 높일수록 이미지의 손상이 커지므로 사용시 압축 정도를 조절해야 한다.,호환성이 우수하다.,Interior Architecture and Design,0.5455
강재의 응력-변형률 곡선에서 항복비란 항복점과 무엇에 대한 비율을 의미하는가?,4,비례한계점,탄성한계점,피로강도점,인장강도점,Interior Architecture and Design,0.7037
"알칼리 황화물과 폴리할로겐의 탄화수소 반응으로 얻어지는 고분자 물질로 내유성, 내약품성이 우수하며, 줄눈재 또는 구멍 메꿈재로 사용되는 것은?",1,치오콜,네오프렌,실리콘수지,카세인,Interior Architecture and Design,0.6667000000000001
"최근 개발되고 있는 새로운 건축용 금속재료 중, 초고층 인텔리젼트 빌딩이나, 핵융합로 등과 같이 강력한 자기장이 발생할 가능성이 있는 철골 구조물의 강재나, 철근 콘크리트용 봉강으로 사용되는 것은?",3,초고장력강,비정질(Amorphous)금속,구조용 비자성강,고크롬강,Interior Architecture and Design,0.5185
세라믹재료의 특성에 대한 설명 중 옳지 않은 것은?,2,"내열성, 화학저항성이 우수하다.","내후성이 나쁘며, 취성이다.","단단하고, 압축강도가 높다.",전기절연성이 있다.,Interior Architecture and Design,0.5417000000000001
에폭시수지 도료에 있어서 저항성과 적응성에 대한 설명 중 옳지 않은 것은?,1,알칼리에 침식되지 않으나 산에는 비교적 약하다.,도막이 충격에 비교적 강하고 내마모성도 좋다.,습기에 대한 변질의 염려가 적다.,용제와 혼합성이 좋다.,Interior Architecture and Design,0.7778
비철금속의 성질에 관한 설명 중 옳은 것은?,1,동은 내알칼리성이 약하므로 콘크리트와 접하는 곳에서는 부식속도가 빠르다.,"주석은 인체에 유해한 성분이 있어 장식철물, 땜납으로 사용시 주의가 필요하다.",알루미늄은 표면에 산화피막을 형성하기 때문에 내해수성이 우수하다.,"납은 천연수, 경수에 용해되기 때문에 수도관으로 사용시 주의가 필요하다.",Interior Architecture and Design,0.6537999999999999
바닥으로부터 높이 1m까지는 내수재료로 안벽마감을 하여야 하는 대상이 아닌 것은?,1,제1종 근린생활시설 중 치과의원의 치료실,제2종 근린생활시설 중 휴게음식점의 조리장,제1종 근린생활시설 중 목욕장의 욕실,제2종 근린생활시설 중 일반음식점의 조리장,Interior Architecture and Design,0.8695999999999999
건축물 지하층에 환기설비를 설치해야 하는 거실바닥면적합계의 최소기준은?,3,200m2 이상,500m2 이상,1000m2 이상,2000m2 이상,Interior Architecture and Design,0.6
방염성능기준 이상의 실내장식물을 설치하여야 하는 특정소방대상물에 해당하지 않는 것은?,3,아파트를 제외한 11층 이상 건축물,다중이용업의 영업장,옥내에 있는 수영장,노유자시설,Interior Architecture and Design,0.6957
거실의 채광 및 환기에 관한 규정으로 옳지 않은 것은?,1,채광을 위하여 거실에 설치하는 창문 등의 면적은 그 거실의 바닥면적의 1/20이상이어야 한다.,환기를 위하여 거실에 설치하는 창문 등의 면적은 그 거실의 바닥면적의 1/20이상이어야 한다.,채광 및 환기를 위하여 거실에 설치하는 창문 등의 면적을 정하는 경우 수시로 개방할 수 있는 미닫이로 구획된 2개의 거실은 이를 1개의 거실로 본다.,오피스텔에 거실 바닥으로부터 높이 1.2m이하 부분에 여닫을 수 있는 창문을 설치하는 경우에는 국토해양부령으로 정하는 기준에 따라 추락방지를 위한 안전시설을 설치하여야 한다.,Interior Architecture and Design,0.8261
건축관계법규에 따라 계단의 벽에 손잡이를 설치하여야 할 경우 벽으로부터 최소 얼마 이상 떨어져 설치해야 하는가?,2,3cm,5cm,8cm,10cm,Interior Architecture and Design,0.7826000000000001
조립식구조의 접합부(Joint)에 대한 요구성능과 가장 거리가 먼 것은?,1,내화성,기밀성,방수성,구조 일체성,Interior Architecture and Design,0.5
동바리 마루에서 마루널 바로 밑에 오는 부재는 무엇인가?,3,동바리,멍에,장성,동아리돌,Interior Architecture and Design,0.5417000000000001
건축물의 출입구에 설치하는 회전문의 설치기준에 대한 설명으로 옳지 않은 것은?,1,회전문의 회전속도는 분당 10회를 넘지 않도록 한다.,계단으로부터 2m 이상 거리를 두어야 한다.,에스컬레이터로부터 2m 이상 거리를 두어야 한다.,회전문과 문틈사이는 5cm 이상 되어야 한다.,Interior Architecture and Design,0.7826000000000001
