question,answer,A,B,C,D,Category,Human Accuracy
전시공간의 조명계획에 대한 설명 중 옳지 않은 것은?,3,실내의 조도 및 휘도 분포가 적당해야 한다.,"전시물의 대상에 따라 국부조명(spot light)의 방향성, 연색성 등을 고려한다.",전체조명과 국부조명의 비율은 1:5 이상이 되도록 한다.,전체조명은 보행이나 메모하기에 적당한 범위로 한다.,Interior Architecture and Design,0.0
인테리어 이미지에 대한 설명 중 틀린 것은?,4,"캐쥬얼(Casual)은 자유롭고 편한 이미지를 나타내며, 신선함, 활동감, 즐거움 등이 연출 포인트가 된다.",자연스러움(Natural)은 단순하면서 소박함과 따스함이 있는 형태를 기본으로 한다.,고저스(Gorgeous)는 호화롭고 사치스런 이미지로 전통적인 표현은 물론 현대적인 표현도 가능하다.,댄디(Dandy)는 강하고 분명한 디자인으로 활동감과 약동감을 갖게 한다.,Interior Architecture and Design,0.0
"오피스에서 업무를 수행하는 사람이 업무수행을 효율적으로 하기 위하여 필요한 기가, 가구, 집기를 포함하는 최소 단위의 기능공간은?",4,오피스 랜드스케이프(Office Landscape),시스템 가구(System Furniture),모듈러 시스템(Modular System),워크 스테이션(Work Station),Interior Architecture and Design,0.0
실내공간의 기본 요소에 대한 설명으로서 잘못된 것은?,3,다른 요소들이 시대와 양식에 의한 변화가 현저한데 비하여 바닥은 매우 고정적이다.,천장의 형태는 그 재료와 질감과 함께 실내공간의 음향적인 부분에 영향을 미친다.,벽은 수직적 요소이므로 보는 시점의 높낮이에 의한 시각적 특성의 변화가 거의 없다.,"기둥은 하중에 관계없이 실내에 설치되어 강조적, 상징적요소로도 사용된다.",Interior Architecture and Design,0.0
먼셀의 색상환에서 BG는 무슨 색인가?,1,청록,연두,남색,노랑,Interior Architecture and Design,1.0
흰색 배경의 회색보다 검정색 배경의 회색이 더 밝게 보이는 것은 무슨 대비인가?,3,보색대비,채도대비,명도대비,색상대비,Interior Architecture and Design,0.0
오스트발트(Ostwald) 색채조화론에서 보색조화를 나타낸 것은?,4,2 간격 조화,4 간격 조화,8 간격 조화,12 간격 조화,Interior Architecture and Design,0.0
색의 지각현상에 관한 설명 중 잘못된 것은?,3,난색이 한색 보다 팽창되어 보인다.,검정색 배경 위의 고명도 색이 저명도 색보다 명시도가 높다.,한색이 난색보다 주목성이 높다.,고명도 색이 저명도색보다 팽창되어 보인다.,Interior Architecture and Design,0.0
문 스펜서의 색채조화론에서 ‘미도는 (   )이상이 되면 그 배색은 좋다.’의 (   )에 들어갈 기준 수치는?,2,0.2,0.5,0.7,0.9,Interior Architecture and Design,0.0
색채조화론에서 면적의 효과에 대한 설명 중 옳은 것은?,1,작은 면적의 강한 색과 큰 면적의 약한 색은 서로 잘 어울린다.,채도가 높고 강한 색은 어떤 면적에도 잘 어울리며 안정감을 준다.,채도가 높고 강한 색은 넓은 면적에 사용하면 좋은 효과를 얻을 수 있다.,"배색에 수반되는 감정효과는 균형점의 색상, 명도, 채도와 관계없이 조화된다.",Interior Architecture and Design,1.0
컬러 4도 인쇄에서 일반적으로 4도에 포함되지 않는 색은?,1,흰색,검정,시안,노랑,Interior Architecture and Design,1.0
먼셀기호 5Y 8/10에서 숫자 10은 무엇을 나타내는가?,4,색상,명도,색조,채도,Interior Architecture and Design,0.0
보라의 색채감정으로 적절하지 않은 것은?,4,고귀,우아,신비,비애,Interior Architecture and Design,0.0
독일의 심리학자 카츠(David Kats)의 색채 분류에서 ‘맑은 하늘에서 느껴지는 파란색’ 처럼 깊이를 알수 없은 색으로 질감이나 음영을 알 수 없는 색의 분류는?,1,면색,표면색,공간색,간섭색,Interior Architecture and Design,1.0
조종 장치를 촉감에 의하여 구별할 수 있도록 설계하기 위하여 두께는 최소한 얼마 이상 차이가 나도록 하여야 하는가?,2,0.95mm,9.5mm,95mm,950mm,Interior Architecture and Design,0.0
같은 밝기의 불빛일 경우 암순응(暗順應)을 촉진하기 위해 사용하는 색으로 가장 적절한 것은?,1,적색,백색,노란색,초록색,Interior Architecture and Design,1.0
시각적 표시장치의 유형 중 원하는 값으로부터의 대략적인 편차 또는 고도 등 그 시각적인 변화 반향을 알아보는데 가장 적합한 형태는?,1,지침이동형(moving pointer),지침고정형(moving scale),계수형(digital),그림 표시형(pictogram),Interior Architecture and Design,1.0
단위면적당 표면에서 반사 또는 송출되는 광량을 무엇이라 하는가?,2,광속(luminous flux),휘도(luminance),조도(illuminance),반사율(reflectance),Interior Architecture and Design,0.0
인체측정치 중 최대집단치를 적용하는 대상으로 볼 수 없는 것은?,4,탈출구의 넓이,출입문의 높이,그네의 지지 하중,선반의 높이,Interior Architecture and Design,0.0
지각에 영향을 미치는 게스탈트(Gestalt)의 4법칙에 해당하지 않는 것은?,4,근접성의 법칙,유사성의 법칙,연속성의 법칙,다양성의 법칙,Interior Architecture and Design,0.0
Miller는 인간의 절대식별 한계를 “magical number 7호”라 하였는데 이것의 의미로 옳은 것은?,2,장기기억의 한계,작업기억의 한계,감각보관의 한계,감각수용기의 한계,Interior Architecture and Design,0.0
음의 한 성분이 다른 성분에 대한 감수성을 감소시키는 현상을 무엇이라 하는가?,2,resonance,masking,interference,damping,Interior Architecture and Design,0.0
목재의 인화점은 몇 ℃ 정도인가?,3,100℃,160℃,240℃,450℃,Interior Architecture and Design,0.0
굳지 않은 콘크리트의 성질을 표시하는 용어 중 콘시스텐시에 의한 부어넣기의 난이도 정도 및 재료분리에 저항하는 정도를 나타내는 것은?,4,플라스티시티,피니셔빌리티,펌퍼빌리티,워커빌리티,Interior Architecture and Design,0.0
중용역포틀랜드시멘트에 대한 설명 중 틀린 것은?,4,"C3S나 C3A가 적고, 장기강도를 지배하는 C2S를 많이 함유한 시멘트이다.",수화속도를 지연시켜 수화열을 작게 한 시멘트이다.,건조수축이 작고 건축용 매스콘크리트에 사용된다.,내황산염성이 작기 때문에 댐공사에는 사용이 불가능하다.,Interior Architecture and Design,0.0
미장재료 중 고온소성의 무수석고를 특별한 화학처리를 한 것으로 킨즈시멘트라고도 불리우는 것은?,4,순석고 플라스터,혼합석고 플라스터,보드용 석고 플라스터,경석고 플라스터,Interior Architecture and Design,0.0
목재의 결점 중 벌채시의 충격이나 그 밖의 생리적 원인으로 인하여 세로축에 직각으로 섬유가 절단된 형태를 의미하는 것은?,4,수지낭,미숙재,옹이,컴프레션페일러,Interior Architecture and Design,0.0
페인트 도장에 있어서 건조제를 지나치게 많이 넣을 경우 정벌칠 결과 나타나는 주된 현상은?,3,블로킹(blocking)발생,도막의 흐름성(sagging) 발생,도막에 균열 발생,접착력 증가,Interior Architecture and Design,0.0
일반적으로 단열재에 습기나 물기가 침투하면 어떤 현상이 발생하는가?,2,열전도율이 높아져 단열성능이 좋아진다.,열전도율이 높아져 단열성능이 나빠진다.,열전도율이 낮아져 단열성능이 좋아진다.,열전도율이 낮아져 단열성능이 나빠진다.,Interior Architecture and Design,0.0
목재의 일반적인 성질에 관한 설명으로 옳지 않은 것은?,2,섬유포화점 이상의 함수상태에서는 함수율의 증감에도 불구하고 신축을 일으키지 않는다.,섬유포화점 이상에서는 함수율이 증가할수록 강도는 감소한다.,"기건상태란 목재가 통상 대기의 온도, 습도와 평형된 수분을 함유한 말한다.",섬유방향에 따라서 전기전도율은 다르다.,Interior Architecture and Design,0.0
석재사용상의 주의점에 대한 설명 중 옳지 않은 것은?,1,외벽 특히 콘크리트 표면 첨부용 석재는 연석을 사용하여야 한다.,동일건축물에는 동일석재로 시공하도록 한다.,석재를 구조재로 사용할 경우 직압력재로 사용하여야 한다.,중량이 큰 것은 높은 곳에 사용하지 않도록 한다.,Interior Architecture and Design,1.0
연질타일계 바닥재에 대한 설명 중 옳지 않은 것은?,4,고무계 타일은 내마모성이 우수하고 내수성이 있다.,"리놀륨계 타일은 내유성이 우수하고 탄력성이 있으나 내알칼리성, 내마모성, 내수성이 약하다.","전도성 타일은 정전기 발생이 우려되는 반도체, 전기 전자제품의 생산장소에 주로 사용된다.",아스팔트 타일은 내마모성과 내유성이 우수하여 실내 주차장 바닥재로 많이 사용된다.,Interior Architecture and Design,0.0
미장재료 중 소석회는 대기 중 어느 것과 작용해서 경화하는가?,2,O2,CO2,NO2,H2,Interior Architecture and Design,0.0
강의 열처리 방법에 대한 설명으로 옳지 않은 것은?,4,풀림 : 강을 연화하거나 내부응력을 제거할 목적으로 실시한다.,불림 : 조직을 개선하고 결정을 미세화하기 위해 실시한다.,"담금질 : 고온으로 가열하여 소정의 시간동안 유지한 후에 냉수, 온수 또는 기름에 담가 냉각하는 처리를 말한다.",뜨임질 : 경도를 증가시키고 연성과 인성을 작게하기 위해 실시한다.,Interior Architecture and Design,0.0
"난간동자를 세워댄 난간을 말하며, 장식겸 난간으로 사용되는 것은?",2,멍에,부란,두겁대,챌판,Interior Architecture and Design,0.0
건축허가 등을 함에 있어서 미리 소방본부장 또는 소방서장의 동의를 받아야 하는 건축물 등에 속하지 않는 것은?,1,연면적이 330m2인 건축물,연면적이 100m2인 위험물 제조소,바닥면적이 200m2인 무창층이 있는 건축물,바닥면적이 100m2인 지하층이 있는 건축물,Interior Architecture and Design,1.0
건축물의 내무 마감재료를 방화상 지장이 없는 재료로 하여야 하는 대상건축물이 아닌 것은?,3,판매시설의 용도에 쓰이는 건축물로서 당해 용도에 쓰이는 거실의 바닥면적의 합계가 200m2인 건축물,위험물저장 및 처리시설,업무시설 중 오피스텔의 용도에 쓰이는 건축물로서 2층의 당해 용도에 쓰이는 거실바닥면적의 합계가 300m2인 건축물,6층의 거실 바닥면적의 합계가 500m2인 건축물,Interior Architecture and Design,0.0
"작품으로는 바르셀로나 파빌리온, 판스워스 하우스 등이 있으며, “자유로운 평면과 명쾌한 구조는 서로 뗄수 없는 것이다. 구조는 전체의 골격이며, 자유로운 평면을 가능하게 해 준다.” 라고 말한 사람은?",1,미스 반 델 로에,프랭크 로이드 라이트,월터 그로피우스,르 코르뷔지에,Interior Architecture and Design,1.0
소방시설의 관계가 서로 잘못 짝지어진 것은?,4,소화설비 - 스프링클러설비,경보설비 - 자동화재탐지설비,피난설비 - 유도등 및 유도표지,소화활동설비 - 옥내소화전설비,Interior Architecture and Design,0.0
"6층 이상의 거실 면적의 합계가 9000m2 이상인 의료시설 중 병원의 승용승강기의 설치 기준 대수로 옳은 것은? (단, 15인승 승용승강기를 기준으로 한다.)",4,2대,3대,4대,5대,Interior Architecture and Design,0.0
목구조의 가새에 대한 설명 중 옳지 않은 것은?,4,목조벽체를 수평력에 견디게 하고 안정한 구조로 하기 위한 것이다.,가새의 경사는 45°에 가까울수록 유리하다.,주요 건물에서는 한 방향 가새로만 하지 않고 X자형으로 한다.,중요한 곳은 가새보다 버팀대를 설치하는 것이 강력하다.,Interior Architecture and Design,0.0
배연설비의 설치와 구조기준에 대한 설명으로 옳지 않은 것은?,4,6층 이상의 건축물로서 의료시설의 용도에 쓰이는 거실에는 배연설비를 설치하여야 한다.,6층 이상의 건축물로서 업무시설의 용도에 쓰이는 거실에는 배연설비를 설치하여야 한다.,배연구는 예비전원에 의하여 열 수 있도록 하여야 한다.,배연구는 연기(열)감지기에 의하여 자동개폐되는 구조로 하되 손으로는 개폐가 불가능하여야 한다.,Interior Architecture and Design,0.0
문화 및 집회시설 중 공연장의 개별 관람석의 바닥면적이 660m2일 때 바깥으로의 출구의 유효너비의 합계는 최소 얼마 이상으로 하여야 하는가?,3,1.98m,3.30m,3.96m,5.94m,Interior Architecture and Design,0.0
"열전도저항이 0.4m2h℃/kcal인 벽체의 양측표면 온도가 각각 20℃, 10℃일 때, 벽면적 10m2를 통해 하루 동안 전도되는 열량은?",3,"2,000 kcal","4,000 kcal","6,000 kcal","8,000 kcal",Interior Architecture and Design,0.0
자연환기에 관한 설명 중 옳은 것은?,3,자연환기는 외부풍압의 작용에 의해서만 이루어진다.,환기량은 개구부의 면적에 반비례한다.,환기량은 실내의 압력차의 제곱근에 비례한다.,연돌효과는 자연환기와는 무관하다.,Interior Architecture and Design,0.0
방음대책 중 옳지 않은 것은?,3,방음벽 설치,공장건물 내벽의 흡음처리,차음성 감소에 의한 소음조절,거리감쇠,Interior Architecture and Design,0.0
조도에 관한 설명 중 틀린 것은?,1,조도는 피도면 경사각의 sine 값에 비례한다.,조도는 광도에 비례한다.,조도는 광원으로부터 떨어진 거리의 제곱에 반비례 한다.,입사과옥의 면적당 밀도가 높을수록 조도는 커진다.,Interior Architecture and Design,1.0
잔향시간에 관한 설명으로 거리가 먼 것은?,2,잔향시간을 이용하면 대상 실내의 평균 흡음율을 측정할 수 있다.,반사음과 직접음의 양을 측정하는 데 사용되는 것이 일반적이다.,음에너지의 밀도가 원음의 크기와 비교해서 1/1000000로 감소하는데 소요되는 시간이다.,잔향시간이란 실내에서 음원을 끈 순간부터 음압레벨이 60dB 감소할 때까지 걸리는 시간이다.,Interior Architecture and Design,0.0
흡수식 냉동기의 특징으로 옳은 것은?,4,흡수제와 흡수작용에 의해서 냉동을 행한다.,소음 및 진동이 작다.,온수공급도 행할 수 있다.,동일 용량의 압축식과 비교시 냉각탑의 냉동능력이 작아도 된다.,Interior Architecture and Design,0.0
물질의 이동없이 온도가 다른 일정한 물체 사이 에서 고온의 분자로부터 저온의 분자로 전달되는 열의 형태는?,1,전도(Conduction),대류(Convection),복사(Radiation),방사(Emission),Interior Architecture and Design,1.0
"총광속이 2,000 lumen인 구형 점광원으로부터 수직방향으로 2m 떨어진 지점의 조도는?",1,40 [lx],50 [lx],60 [lx],70 [lx],Interior Architecture and Design,1.0
원심력에 의해 유체를 송출시키는 펌프는?,4,제트펌프,플런저펌프,기포펌프,볼류트펌프,Interior Architecture and Design,0.0
온열환경 평가지표 중 유효온도는 어떠한 조건을 기준으로 이와 동일한 온열감을 갖도록 작성된 것인가?,3,"상대습도 50%, 기류속도 0m/s","상대습도 50%, 기류속도 1m/s","상대습도 100%, 기류속도 0m/s","상대습도 100%, 기류속도 1m/s",Interior Architecture and Design,0.0
단일벽체의 투과손실에 대한 설명을 옳지 않은 것은?,4,벽체의 면밀도가 증가할수록 투과손실은 커진다.,주파수가 커질수록 투과손실은 커진다.,투과손실은 벽체의 면밀도와 주파수의 곱의 대수값에 비례한다.,중고주파수역에서는 일치효과에 의해 투과손실이 증가한다.,Interior Architecture and Design,0.0
소음의 크기 등을 나타내는데 사용되는 단위는?,2,cd,dB,kcal,ppm,Interior Architecture and Design,0.0
인체에 영향을 미치는 온열환경 요소로 거리가 먼 것은?,1,분진,건구온도,상대습도,기류,Interior Architecture and Design,1.0
선에 대한 설명으로 옳지 않은 것은?,3,"점이 이동한 궤적이며 면의 한계, 교차에서 나타난다.","선은 어떤 형상을 규정하거나 한정하고, 면적을 분할한다.","선은 길이, 폭, 부피만 있고 위치는 없다.",수직선은 구조적인 높이의 존엄성을 느끼게 한다.,Interior Architecture and Design,0.0
은행의 실내계획에 대한 설명 중 옳지 않은 것은?,3,영업장과 객장의 효율적 배치로 사무 동선을 단순화하여 업무가 신속히 처리되도록 한다.,"은행의 고유의 색채, 심볼마크 등을 실내에 도입하여 이미지를 부각시킨다.",도난방지를 위해 고객에게 심리적 긴장감을 주도록 영업장과 객장은 시각적으로 차단시킨다.,객장은 대기공간으로 고객에게 안전하고 편리한 서비스를 제공하는 시설을 구비하도록 한다.,Interior Architecture and Design,0.0
주거공간의 부엌에 대한 설명 중 옳은 것은?,3,일반적으로 부엌의 크기는 주택 연면적의 3% 정도가 가장 적당하다.,작업대의 배치유형 중 일렬형은 대규모부엌에 가장 적당하다.,작업대는 일반적으로 준비대→개수대→조리대→가열대→배선대 순으로 하는 배치가 이상적이다.,"일반적으로 작업대의 높이는 600mm ~ 650mm, 길이는 750mm ~ 800mm가 적당하다.",Interior Architecture and Design,0.0
실내디자인의 과정을 “프로그래밍-디자인-시공-사용 후 평가”로 볼 때 사용 후 평가에 대한 설명으로 적합하지 않은 것은?,3,시공 후 실내디자인에 대한 거주자의 만족도를 조사하는 것이다.,문제점을 발견하고 다음 작업의 기초자료로 활용한다.,다음 작업의 시행착오를 줄이기 위하여 디자이너가 평가하는 것이 보통이다.,입주 후 충분한 시간이 경과한 후 실시하는 것이 결과의 정확도를 높일 수 있다.,Interior Architecture and Design,0.0
치수계획에 있어 적정치수를 설정하는 방법이 아닌 것은? (α : 적정치수를 구하기 위한 조정치수),1,평균치 -α,최소치 +α,목표치 ±α,최대치 -α,Interior Architecture and Design,1.0
부엌의 평면형 중 작업동선이 짧고 부엌의 면적을 줄일 수 있는 이점이 있으나 평면계획상 외부로 통하는 출입구의 설치가 곤란한 형식은?,2,일렬형,ㄷ자형,병렬형,ㄱ자형,Interior Architecture and Design,0.0
실내디자이너의 역할과 가장 관계가 먼 것은?,3,실내공간을 설계하는 디자이너,실내디자인 관련 요소를 계획하는 디자이너,실내공간에 필요한 그래픽을 제작하는 디자이너,"건물내부와 가구디자인, 배치를 계획하는 디자이너",Interior Architecture and Design,0.0
주택의 욕실 계획에 대한 설명 중 옳지 않은 것은?,3,욕실은 침실전용으로 설치되는 것이 이상적이다.,"방수성, 방오성이 큰 마감재료를 사용한다.","모든 욕실에는 기능상 욕조, 변기, 세면기가 통합적으로 갖추어지게 하여야 한다.",욕실의 조명은 방습형 조명기구를 사용한다.,Interior Architecture and Design,0.0
“Design image를 구축한다.”의 의미로 가장 알맞은 것은?,1,"기능적, 정서적, 특징적 공간이미지를 만드는 것",소유물을 list-up하는 것,사용되는 재료를 선택하는 것,디자인의 우위성을 부각시키는 것,Interior Architecture and Design,1.0
상업공간에서 비주얼 머천다이징(VMD) 전개 시스템에 대한 설명으로 옳은 것은?,1,비주얼 프레젠테이션(VP)은 고객의 시선이 처음 닿는 곳을 중심으로 점 이미지를 표현한다.,"포인트 프레젠테이션(PP)은 쇼 윈도우, 층별 메인스테이지 등에서 블록 이미지를 표현한다.","아이템 프레젠테이션(IP)은 테이블, 벽면 상단이나 상판등에서 기본 상품을 표현한다.","아이템 프레젠테이션(IP)은 불록별 상품의 포인트를 표현하며, 블록의 이미지를 높인다.",Interior Architecture and Design,1.0
실내공간 구성요소 중 벽(Wall)에 대한 설명으로 옳지 않은 것은?,3,벽은 공간을 에워싸는 수직적 요소로 수평방향을 차단하여 공간을 형성한다.,시각적 대상물이 되거나 공간에 초점적 요소가 되기도 한다.,높은 벽은 주로 영역과 영역을 구분하고 낮은 벽은 공간의 폐쇄성이 요구되는 곳에 사용된다.,"가구, 조명 등 실내에 놓여지는 설치물에 대해 배경적 요소가 되기도 한다.",Interior Architecture and Design,0.0
사선이 주는 느낌과 가장 관계가 먼 것은?,2,생동감,안정감,운동감,약동감,Interior Architecture and Design,0.0
살찐 사람이 입었을 때 날씬하게 보이는 옷의 배색은?,2,"가로 줄무늬, 고채도, 저명도, 난색","세로 줄무늬, 저채도, 저명도, 한색","가로 줄무늬, 저채도, 고명도, 한색","세로 줄무늬, 고채도, 고명도, 난색",Interior Architecture and Design,0.0
우리 눈의 구조 중 카메라의 렌즈와 같은 역할을 하는 부분은?,3,각막,동공,수정체,홍채,Interior Architecture and Design,0.0
오스트발트 색채조화에서 gc-lg-pl의 기호는 어떤 조화에 해당하는가?,3,등백 계열 조화,등흑 계열 조화,등순 계열 조화,무채색의 조화,Interior Architecture and Design,0.0
똑같은 에너지를 가진 각 단색광의 밝기에 대한 감각은?,2,비시감도(比視感度),시감도(視感度),명시도(明視度),암시도(暗視度),Interior Architecture and Design,0.0
색채조절의 일반적인 기준이 적용된 예로 타당성이 가장 낮은 것은?,2,달리는 자동차에는 명시도가 높은 색을 사용하는 것이 안전하다.,주택의 큰 가구에 주목성이 강한 색을 사용하여 내부에 통일성을 준다.,산업시설에서의 창틀은 흰색으로 하거나 외부 밝기 와의 대조를 줄이기 위해 밝은 색조로 한다.,"유치원은 연노랑, 산호색, 복숭아색과 같은 온색의 밝은 환경이 적합하다.",Interior Architecture and Design,0.0
연변대비란?,3,"면적이 커지면 실제보다 명도, 채도가 높아 보이는 현상이다.",색의 차고 따뜻함에 변화가 오는 대비현상이다.,어떤 두 색이 맞붙어 있을 때 그 경계 부분에서 대비현상이 더 강하게 나타나는 현상이다.,어떤 색을 보고 난 뒤 다른 색을 보는 경우 먼저 본 색의 영향으로 색이 다르게 보이는 현상이다.,Interior Architecture and Design,0.0
인간공학의 연구분석방법 중 직접적 관찰법과 관련이 없는 것은?,2,Time Motion Study에 의한 방법,반응조사에 의한 방법,"조사자의 의견, 면접 또는 제안에 의한 방법",Layout에 의한 방법,Interior Architecture and Design,0.0
밝은 곳에서 갑자기 어두운 곳으로 들어가면 잘 보이지 않는 암순응(dark adaptation)에 대한 설명으로 틀린 것은?,2,동공이 확대된다.,완전 암순응은 보통 1분 이내 가능하다.,암순된 눈은 적색이나 보라색에 가장 둔감하다.,색에 민감한 원추 세포는 감수성을 잃게 된다.,Interior Architecture and Design,0.0
실내조명에 관한 설명 중 바람직하지 않은 것은?,4,특정한 장소의 조도나 휘도가 극단적으로 높거나 낮지 않아야 한다.,빛의 방향성과 확산성이 적절해야 한다.,작업내용에 따라 조도가 적절히 선정되어야 한다.,가능한 한 광원으로부터의 직접광(直接光)을 이용하는 것이 좋다.,Interior Architecture and Design,0.0
"표지판과 등록상표, 기계 등에 쓰이는 활자체에 대한 설명으로 적절하지 않은 것은?",3,"정교한 것보다는 간단한 활자체, 즉 장식선이 없는 직선체를 사용한다.",이탤릭체 보다는 고딕체를 사용한다.,그림자를 표현하여 입체감을 줌으로 식별이 명확하도록 한다.,간결한 말로 된 상표나 표지판에는 대문자를 쓰는 것이 바람직하다.,Interior Architecture and Design,0.0
소음 방지 방법에 관한 설명으로 적절하지 않은 것은?,4,"딱딱한 충격면을 줄이고, 충격력을 제한할 것","반사면(벽, 천장 등)을 연질목재, 화이버 보드(fiber board) 등으로 할 것",소음원을 칸막이 등으로 분리시킬 것,반사면은 반사가 잘 되는 재료를 사용하여 반대방향으로 흡수되도록 할 것,Interior Architecture and Design,0.0
장기적으로 소음에 노출될 때 청력손실에 대한 내용으로 틀린 것은?,1,장기적으로 소음에 노출됨에 따른 청력손실은 회복 가능하다.,청력손실의 정도는 노출 소음수준에 따라 증가한다.,청력손실은 4000Hz 정도에서 크게 나타난다.,강한 소음은 노출시간에 따라 청력손실이 증가한다.,Interior Architecture and Design,1.0
