question,answer,A,B,C,D,Category,Human Accuracy
고객의 가치를 계산하는 방식 중 RFM 모델에 대한 설명으로 틀린 것은?,3,recency - 얼마나 최근에 우리 제품을 구입했는가,frequency - 얼마나 자주 우리 제품을 구입하는가,reflection - 얼마나 우리 제품생산에 영향을 끼치는가?,monetary - 제품구입에 어느 정도의 돈을 쓰고 있는가,Marketing,0.0
아웃바운드 텔레마케팅의 특성으로 틀린 것은?,1,아웃바운드에서는 고객 리스트가 반응률을 결정하며 기본적으로 객주도형이다.,아웃바운드는 무차별적 전화세일즈와는 달리 전화를 걸기 위한 사전준비가 필요하다.,고정고객관리는 신규고객 획득에 비해 시간과 비용면에서 더 경제적이고 효과도 높다.,"아웃바운드가 인바운드보다 더 고도의 기술을 요하며 마케팅전략, 통합기법 등의 노하우, 텔레마케터의 자질 등에 큰 영향을 받는다.",Marketing,1.0
아웃바운드 텔레마케팅의 대상인 고객의 정보에 대한 효율적인 관리방법이 아닌 것은?,3,고객정보의 유출방지,고객정보의 시속적인 확충,고객속성에 따른 획일적 대응,고객정보 및 속성별 질적 개선,Marketing,0.0
판매 전략을 위한 시장세분화 변수 중 인구통계적 변수에 해당하지 않는 것은?,3,성별,연령,개성,교육수준,Marketing,0.0
아웃바운드 텔레마케팅시 상품을 효과적으로 설명하는 방법으로 틀린 것은?,4,고객의 말을 경청하고 질문을 곁들이면서 설명한다.,경쟁 상품과 비교하여 고객이 쉽게 판단할 수 있어야 한다.,상품의 장점을 반복해서 설명하여 고객이 납득할 수 있어야 한다.,고객 불평 처리를 효과적으로 하기 위해 문제해결 방안을 모색하여 대응한다.,Marketing,0.0
소비재 중 전문품의 특성이 아닌 것은?,4,제품이 가지는 전문성이나 독특한 성격 때문에 대체품이 존재하지 않고 브랜드 인지도가 높다.,소비자는 자기가 원하는 상표를 찾아내기 위해 쇼핑에 많은 노력을 기울인다.,생산자가 대부분의 촉진부담을 가진다.,가격에 대해서는 탄력적이다.,Marketing,0.0
표적시장을 선정하기 위한 세분시장의 평가요소에 해당하지 않는 것은?,1,기업의 고객,기업의 목표와 재원,세분시장의 규모와 성장,세분시장의 구조적 매력성,Marketing,1.0
고객이 구매를 결정하기까지의 심리적인 의사결정 단계에 해당하지 않는 것은?,1,접촉(touch),행동(action),흥미(interest),주의(attention),Marketing,1.0
"신규고객유지율, 기존고객보유율, 고객반복이용률 등의 효과를 측정하는 데 사용되는 척도는?",2,고객신뢰도,고객반응률,고객기여도,고객성장률,Marketing,0.0
제품 또는 서비스의 가격세분화 기준에 관한 설명으로 틀린 것은?,2,세분시장이 충분히 커야 한다.,상이한 세분시장의 고객들은 가격의 변화에 대해 동일하게 반응해야 한다.,"세분시장을 확인할 수 있어야하고, 차별적으로 가격을 책정할 수 있는 수단이 마련되어야 한다.",특정 세분시장에서 저가격에 상품 또는 서비스를 구매한 고객이 다른 세분시장의 고객엫서 동일한 서비스를 판매할 기회를 주어서는 안된다.,Marketing,0.0
제품 수명주기 중 성숙기의 특징으로 옳은 것은?,3,원가가 높다.,경쟁자가 거의 없다.,판매가 절정에 이른다.,혁신적인 고객이 제품을 산다.,Marketing,0.0
효과적인 전화조사를 위하여 고려하여야 할 사항과 가장 거리가 먼 것은?,4,응답자가 불편을 느끼지 않는 시간대를 선택한다.,전화조사시 질문은 짧고 단순하게 구성하고 질문의 수를 줄인다.,전화조사는 중간에 전화가 끊기거나 소음 등에 방해를 받지 않도록 한다.,전화조사시에는 경제성을 고려하여 다양한 주제에 대하여 많은 내용을 조사하도록 한다.,Marketing,0.0
시장조사가 기여할 수 있는 마케팅의사결정의 주요 구성요소가 아닌 것은?,4,마케팅 계획의 수립과 실행,마케팅 계획의 유효성과 평가,마케팅 기회와 제약 요인의 규명,마케팅 조사에 할당되는 자금의 규모,Marketing,0.0
마케팅 조사설계시 내적 타당성을 저해하는 요소에 해당되지 않는 것은?,4,통계적 회귀,특정사건의 영향,사전검사의 영향,반작용효과,Marketing,0.0
비표준화 면접에 비해 표준화면접이 가지는 장점이 아닌 것은?,2,반복적인 면접이 가능하다.,면접상황에 대한 적응도가 높다.,면접결과의 숫자화 측정이 용이하다.,조사자의 행동이 통일성을 갖게 된다.,Marketing,0.0
1차 자료의 수집방법에 해당하지 않는 것은?,2,설문조사,문헌조사,실험조사,전화조사,Marketing,0.0
면접조사 방법과 비교하여 전화조사가 가지는 장점으로 틀린 것은?,2,전화조사 방법은 면접조사 방법에 비해 시간과 비용을 절약할 수 있다.,전화조사는 면접조사보다 응답자가 긴 시간을 할애할 수 있어 구체적이고 자세한 조사를 할 수 있다.,면접원을 용무가 없는 사람으로 생각하고 방문을 금지하는 경우가 있지만 전화는 이러한 상황을 극복할 수 있다.,면접조사는 면접원들이 조사결과에 영향을 미쳐 각각 다른 결과를 가져올 수 있으나 전화조사는 그럴 위험이 비교적 적다.,Marketing,0.0
연구의 단위(unit)를 혼동하여 집합단위의 자료를 바탕으로 개인의 특성을 추리할 때 저지를 수 있는 오류는?,2,집단주의 오류,생태주의 오류,개인주의 오류,환원주의 오류,Marketing,0.0
콜센터의 중요성에 관한 설명으로 틀린 것은?,3,정보수집의 창구이다.,고객접점의 제1선이다.,기업의 핵심전략을 수립한다.,기업 이미지 제고에 기여한다.,Marketing,0.0
유통업체에 직접 텔레마케팅을 운영하는 직용체제의 장점이 아닌 것은?,3,통제의 용이성,종업원의 몰입도,고정투자비의 감소,교육/훈련의 숙련도,Marketing,0.0
인바운드 텔레마케팅의 활용분야가 아닌 것은?,4,"주문, 예약처리",신규가입 문의 및 상담,고객 불만사항 처리,"구매감사, 해피콜",Marketing,0.0
인바운드텔레마케팅과 아운바운드텔레마케팅을 구분하는 기준은?,4,텔레마케팅의 소구대상,텔레마케팅의 전개장소,콜센터의 운영주체,전화를 거는 주체,Marketing,0.0
"견습 및 경험중심의 OJT 교육내용에 해당하지 않는 것ㅇ,ㄴ?",4,역할연기,보고하기,발표기회 제공,주의 및 질책,Marketing,0.0
인적자원의 개발을 위한 교육훈련의 성과를 측정하기 위한 평가 방법에 관한 설명으로 틀린 것은?,1,전이 평가 - 교육의 결과를 얼마나 동료에게 전달하는지 측정한다.,학습 평가 - 실제 교육을 통해 향상된 지식과 기술 및 태도를 측정한다.,반응 평가 - 설문을 통해 피교육자가 교육을 어떻게 생각하는지 조사한다.,"효과성 평가 - 교육을 통해 향상된 지식, 기술, 태도를 활용하여 조직성과를 얼마나 높였는지 측정한다.",Marketing,1.0
OJT가 성공하기 위한 관리자의 태도로 틀린 것은?,4,결과를 평가하고 확인한다.,적시에 Feed Back을 행한다.,상담원과 공동으로 목표를 세운다.,관리자 자신의 관심사만을 열거한다.,Marketing,0.0
콜센터 생산성 평가를 위한 핵심요소로 적절하지 않은 것은?,2,매출ㆍ이익률,모니터링 횟수,실시간 성과분석,고객데이터 생산성,Marketing,0.0
경영진이 조직의 목표와 성과향상을 성취하고 비전을 달성하기 위한 활동으로 틀린 것은?,3,비전과 목표를 전파할 수 있는 설명회 등을 개최한다.,전략수립단계에서 설정된 중장기 성과 목표와 전략 및 세부활동 등을 주기적으로 점검한다.,"조직의 경영방침과 본부, 부서, 팀 등과 같은 조직 단위의 중장기, 단기 경영계획을 분리한다.","주주, 고객, 종업원, 파트너 등의 제반 이해관계자들과 접촉하는 시간을 마련하고 이해관계를 균형있게 조절한다.",Marketing,0.0
텔레마케팅의 전개과정을 바르게 나열한 것은?,1,기획 → 실행 → 반응 → 측정 → 평가,기획 → 실행 → 측정 → 반응 → 평가,기획 → 측정 → 실행 → 평가 → 반응,기획 → 측정 → 실행 → 반응 → 평가,Marketing,1.0
구매전 단계에서 커뮤니케이션의 목표에 해당하지 않는 것은?,4,구매위험의 감소,상표인지의 증대,기업이미지의 개발,반복구매행동의 증대,Marketing,0.0
고객과의 대화시 효과적인 언어표현방법으로 가장 거리가 먼 것은?,4,명령형보다는 의뢰형으로 표현해야 한다.,전문용어보다는 이해하기 쉬운 단어로 표현해야 한다.,텔레마케터 중심의 언어보다는 고객중심의 언어로 표현해야 한다.,평상시 언어로 자연스럽게 표현해야 한다.,Marketing,0.0
고객불만 상담의 원칙에 해당하지 않는 것은?,2,고객의 입장을 존중한다.,회사의 규정과 기준에 대해 자세히 설명한다.,상담원의 개인감정을 표출하지 않는다.,고객의 가치관을 바꾸려 하지 않는다.,Marketing,0.0
CRM의 활용에 대한 설명으로 틀린 것은?,2,시장점유율보다 고객점유율에 비중을 둔다.,고객유지보다는 고객획득에 중점을 둔다.,제품판매보다는 고객관계관리에 중점을 둔다.,고객로열티 극대화를 중시한다.,Marketing,0.0
발신자에 의한 커뮤니케이션 장애요인이 아닌 것은?,1,반응과 피드백 부족,커뮤니케이션 스킬 부족,발신자의 신뢰 부족,타인에 의한 민감성 부족,Marketing,1.0
연세가 많은 고객에 대한 상담시 피해야 할 사항은?,3,호칭에 신경을 쓰드록 한다.,공손하게 응대하고 질문에 정중하게 답한다.,순발력 있고 빠른 속도로 응대한다.,고객의 의견을 존중한다.,Marketing,0.0
구매후 고객응대의 유형이 아닌 것은?,1,구매행동을 위한 대안제시,고객의 불만과 문제접수 및 해결,불만사항에 대한 책임소재와 이해 촉구,"지불, 환불, 교환에 관한 응대",Marketing,1.0
전화에 의한 고객응대와 전자우편에 의한 고객응대의 비교설명으로 가장 옳은 것은?,3,전화 응대는 공손하게 경어를 사용해야 하지만 전자우편 응대는 속어를 사용하는 것이 친밀감을 높이는 데 좋다.,전화 응대는 바로 답변해야 하기 때문에 신속한 응대가 중요하지만 전자우편은 며칠 간격을 두고 천천히 답변해도 된다.,전화는 실시간으로 답변해야 하나 전자우편은 시차를 두고 답변하므로 상담원 배치 및 일의 분배 측면에서는 전자우편 답변이 훨씬 쉽다.,전화나 전자우편이나 상담원에게 요구되는 자질이 동일하다.,Marketing,0.0
구매후 고객응대에 관한 설명으로 틀린 것은?,2,고객이 구입한 제품이나 서비스를 사용하는 과정 혹은 배달 및 운송에서 발생한 문제 등에 대해 효과적이고 전문적인 상담을 수행한다.,"고객이 구입한 제품의 결함, 정신적 또는 물질적 피해에 대한 보상을 요구했을 때 이미 판매한 이후의 일이므로 고객의 요구를 무마시킨다.","고객들로부터 제품이나 서비스의 성능, 재질, 가격, 배송, 사후관리 등에 대한 만족도와 상담의 질에 대한 만족도를 측정,관리한다.",고객의 정기적 또는 비정기적 온오프라인 상의 모니터링 참여를 유도하여 이를 마케팅 정책이나 상담관리에 반영한다.,Marketing,0.0
커뮤니케이션에서 나타날 수 있는 문제점으로써 전달자 측면의 요인에 관한 설명이 아닌 것은?,1,"전달경로의 특성 - 커뮤니케이션의 통로를 의미하며 대면, 문서, 통화 상징물 등이 포함된다.",메세지 명확화 능력 - 전달하고자 하는 정보의 내용을 얼마나 명확하게 할 수 있는가 하는 능력이다.,전달능력 - 자신의 메세지를 정확하고 신속하게 전달할 수 있는 매체를 선정하고 이를 활용할 수 있는 능력을 말한다.,"개인적 특성 - 전달자의 감정과 태도 또는 가치관이나 기질 등에 관련되는 인격이 내향성인가 외향성인가, 지배성향이 강한가 약한가 등에 따라 커뮤니케이션의 효과는 달라질 수 있다.",Marketing,1.0
소비자의 욕구가 다양해지고 기업간의 경쟁이 치열하기 때문에 고객만족 경영이 필수적이 되었다. 이러한 경영 환경의 변화에 관한 설명으로 틀린 것은?,3,산업화 사회에서 정보화 사회로 변화하였다.,소비자 요구가 소유 개념에서 개성 개념으로 변하였다.,시장의 중심이 소비자에서 생산자로 변하여싿.,규모의 경제에 따른 경쟁에서 부가가치로 변하였다.,Marketing,0.0
텔레마케터가 고객과의 전화에서 활용할 수 있는 음성 연출로 적합하지 않은 것은?,4,음성의 크고 작음,말의 빠르고 느림,말의 색깔과 느낌,억양의 특이한 엑센트,Marketing,0.0
"남이 아직 모르는 좋은 곳, 빈틈을 찾아 그 곳을 공략하는 마케팅전략은?",1,니치마케팅,마이크로마케팅,무점포마케팅,바이러스마케팅,Marketing,0.8571
촉진전략에 관한 설명 중 틀린 것은?,2,상품에 따라 촉진믹스의 성격이 달라진다.,불황기에는 촉진활동보다 경로 및 가격설정전략이 주효하다.,마케팅 커뮤니케이션은 기업 커뮤니케이션과 연계되어 있다.,촉진의 본질은 소비자에 대한 정보의 전달에 있다.,Marketing,0.0
고객속성데이터에 대한 설명으로 옳은 것은?,3,주로 콜센터나 기업의 내부에서 직접 확보 또는 생성한 데이터베이스를 말한다.,"외부 전문기관에서 구입한 명단, 제휴마케팅을 통해 획득한 데이터베이스를 말한다.","고객이 지닌 고유속성으로 주소, 전화번호, 주민등록번호 등의 데이터를 의미한다.","거래나 구매사실, 구매행동 결과로 나타나는 속성으로 회원가입일, 최초구매일, 연체내역 등의 데이터를 말한다.",Marketing,0.0
기존 고객의 이탈을 방지하고 제품이용도를 제고하고자 이탈고객을 대상으로 거래 단절의 원인을 조사하여 이에 대한 대책을 수립하는 마케팅 전략은?,2,다이렉트마케팅,리텐션마케팅,내부마케팅,로얄티마케팅,Marketing,0.0
축적된 고객관련 데이터에 숨겨진 규칙이나 패턴을 찾아내는 것은?,2,DBMS,데이터마이닝,필터링,CRM,Marketing,0.0
아웃바운드 텔레마케팅의 판매촉진 강화를 위한 방안이 아닌 것은?,1,상담원은 고객의 요구만을 열심히 경청하게 한다.,상담원들에게 상품에 대한 사전지식을 철저히 준비하도록 한다.,고객에게 호감을 줄 수 있는 커뮤니케이션 기술을 갖추도록 한다.,상담원은 고객의 반론에 대한 자연스러운 대응력을 갖추도록 한다.,Marketing,1.0
개방형 질문의 유형에 해당하지 않는 것은?,4,자유응답 질문,투사기법 질문,문장완성형 질문,척도형 질문,Marketing,0.0
텔레마케터가 응답자에게 질문을 할 때 고려해야 할 사항으로 옳은 것은?,4,응답자들의 교육수준에 상관없이 동일한 질문을 주고 응답을 받아야 한다.,응답할 항목을 불러줄 때 “기타”나 “모르겠다”는 항목을 절대 말해서는 안 된다.,질문을 할 때 가능하면 전문용어를 많이 사용하도록 한다.,응답자에게 질문 초기에는 친밀감이 형성될 수 있도록 하는 것이 좋다.,Marketing,0.0
전화조사시 고려하여야 할 사항으로 틀린 것은?,4,조사시간대는 응답자가 불편을 느끼지 않는 평일 오전이나 오후가 적당하다.,전화조사에 적당한 시간은 10분 내외로 10개 전후의 문항으로 한다.,전화조사시 질문은 질문지와 최대한 유사하게 질문하며 질문지에 나타난 순서대로 질문한다.,"조사원은 조사대상자의 답변을 그대로 기록하기보다는 적절히 요약, 정리, 의역, 부연설명을 할 수 있다.",Marketing,0.0
시장조사에 대한 설명으로 옳은 것은?,2,시장조사에 있어 특정한 분석모델은 없다.,"시장조사는 고객의 욕구와 문제를 파악하고, 성장기회를 포착하기 위해 이용된다.",시장조사의 분석자료는 의사결정에만 이용된다.,시장조사는 상품이 완성된 후 실시한다.,Marketing,0.0
조사보고서의 작성 목적으로 적절하지 않은 것은?,1,조사자와 조사대상자 간의 의사소통,통제수단,타당성 검증,결과활용,Marketing,1.0
표본의 크기를 결정하는 데 고려해야 하는 요소 중 적절하지 않은 것은?,1,비표집 오차,모집단 요소의 동질성,조사의 목적,모집단의 크기,Marketing,1.0
시장조사에 활용되는 측정척도에 대한 설명으로 틀린 것은?,4,명목척도는 숫자에 의해 양적인 개념이 전혀 내포되어 있지 않으며 단지 확인과 분류에 관한 정보만을 내포한다.,"서열척도는 순서(순위, 등급)에 대한 정보를 포함하는 자료이다.",등간척도는 명목자료와 서열자료에 포함된 정보와 측정값 간의 양적 차이에 관한 정보를 포함 한다.,"비율척도는 모든 산술계산이 가능하며, 절대영점이 존재하지 않는 유일한 척도이다.",Marketing,0.0
전화조사에서 응답률(Response Rate)의 의미로 옳은 것은?,2,전화를 걸었을 때 신호가 가는 비율,전화를 걸었을 때 누군가 받는 비율,전화를 걸었을 때 조사대상자가 받는 비율,전화를 걸었을 때 원하는 정보를 얻어내는 비율,Marketing,0.0
표본추출을 할 때 가장 먼저 해야 할 사항은?,1,모집단 규정,표본크기 산출,표본체계 확인,표본할당,Marketing,1.0
구매관련 자료 수집을 위한 횡단조사의 조사항목으로 적절하지 않은 것은?,1,고객 개인정보,선호 상표,구매의사,상표 및 광고 인지도,Marketing,1.0
표본조사와 전수조사에 대한 설명으로 옳은 것은?,1,모집단 내에 대상자의 수가 너무 많을 경우 표본조사를 한다.,전수조사가 표본조사보다 항상 오류가 없으나 비용이 많이 들어서 표본조사를 한다.,마케팅 부서는 항상 전수조사를 선호한다.,표본조사는 조사결과에 심각한 오류가 많아 기피된다.,Marketing,1.0
이처럼 동시에 집단으로 조사하는 방식은?,3,신디케이트 조사,회장법,갱서베이,소비자패널조사,Marketing,0.0
리스트 클리닝 활용 증대를 위한 전략적 방안과 제반요소가 아닌 것은?,3,리스트 클리닝 목적의 명확화,리스트 클리닝 대상 데이터 확보,리스트 클리닝 데이터 업데이트 금지,리스트 클리닝 연계 마케팅 툴,Marketing,0.0
최근 전화조사에 있어서 설문지 대신 컴퓨터에 설문을 입력해 놓고 면접원이 질문을 보면서 면접하고 응답을 바로 입력하는 방법은?,1,CATI(Computer Aided Telephone Interviewing),Internet Survey,Call Center,Mail Survey,Marketing,1.0
마케팅조사와 마케팅정보시스템의 비교 설명으로 틀린 것은?,2,"마케팅조사는 문제해결에 초점을 맞추고, 마케팅정보시스템은 문제해결 및 문제예방에도 초점을 맞춘다.","정보와 자료에 있어서 마케팅조사는 미래지향적이고, 마케팅정보시스템은 과거중심적이다.",마케팅조사는 마케팅정보시스템에 정보를 제공하는 하나의 자료원이다.,마케팅정보시스템은 경영정보시스템 개념을 도입하여 마케팅 분야에 적합하도록 수정하였다.,Marketing,0.0
자료수집방법 중 정보를 가장 빨리 입수하는 것은?,2,우편질문방법,전화면접방법,대인면접방법,대리질문방법,Marketing,0.0
콜센터 조직의 특성으로 맞는 것은?,2,기업 중심적이다.,고객의 가치를 중시한다.,1：1 대면 접촉이다.,정보와 커뮤니케이션을 매개로 하지 않는다.,Marketing,0.0
콜센터의 역할로 틀린 것은?,4,고객접점 센터이다.,고객중심의 마케팅을 전개한다.,"전화, 우편, 이메일 등 다양한 매체중심의 마케팅을 전개한다.",고객봉사센터라고 할 수 있다.,Marketing,0.0
인바운드 텔레마케팅의 특성이 아닌 것은?,1,시간관리가 용이하다.,통화량을 조절하기 어렵다.,불만고객에 의한 스트레스가 크다.,상품에 대한 충분한 지식이 필요하다.,Marketing,1.0
모니터링의 목적이 아닌 것은?,4,상담원의 통화품질 평가,상담원의 스킬 향상,고객만족과 로열티·수익성 향상을 위한 관리수단,상담원의 실적관리 및 통제수단,Marketing,0.0
텔레마케팅 조직의 슈퍼바이저 역할에 대한 설명으로 틀린 것은?,4,일반적으로 10~15명의 텔레마케터를 1명의 슈퍼바이저가 관리한다.,모니터링을 통해 텔레마케터의 성과를 분석한다.,텔레마케터의 능력계발을 위한 교육을 지원한다.,콜 예측을 통한 신규인력 투입시기를 결정한다.,Marketing,0.0
콜센터에서 사용되는 하드웨어에 대한 용어 설명으로 옳은 것은?,2,CTI - 녹취장비,PBX - 사내전화 교환기,UMS - 자동호 분배기,UPS - 음성메일 시스템,Marketing,0.0
모니터링 평가요소가 아닌 것은?,4,음성의 친절성,업무의 정확성,응대의 신속성,근무태도의 성실성,Marketing,0.0
텔레마케팅의 특성이 아닌 것은?,3,"텔레마케팅은 시간, 공간, 거리의 장벽을 극복할 수 있다.",텔레마케팅은 고객의 생애가치를 존중한다.,텔레마케팅은 고객관계보다 고객획득에 적합한 마케팅이다.,텔레마케팅은 기업을 정보창조조직으로 만들지만 시스템적 사고로 접근할 필요는 없다.,Marketing,0.0
상담원 OJT의 절차가 맞는 것은?,1,니즈의 간파 → 목표설정 → 계획서 작성 → 실시 → 평가와 피드백,목표설정 → 니즈의 간파 → 계획서 작성 → 실시 → 평가와 피드백,계획서 작성 → 목표설정 → 니즈의 간파 → 실시 → 평가와 피드백,계획서 작성 → 니즈의 간파 → 목표설정 → 실시 → 평가와 피드백,Marketing,1.0
고객불평처리의 중요성에 대한 설명으로 틀린 것은?,2,고객불평을 잘 처리하면 고객유지율이 향상된다.,고객불평의 해결은 기업이윤을 감소시키는 요인이 된다.,경영에 유용한 정보를 얻게 된다.,기업의 좋은 이미지를 구축할 수 있다.,Marketing,0.0
고객의 불만에 대한 응답편지 작성 및 발송시의 유의사항이 아닌 것은?,3,편지를 쓸 목적을 분명히 한다.,무엇을 쓸 것인가를 5W 1H로 요약한다.,일반우편으로 발송한다.,편지는 고객입장에서 작성한다.,Marketing,0.0
텔레마케팅의 아웃소싱업체 선정시 유의할 사항이 아닌 것은?,4,"콜센터 아웃소싱업체가 인바운드 텔레마케팅 성향이 강한지, 아웃바운드 텔레마케팅 성향이 강한지 해당 업체의 특성을 고려해야 한다.",아웃소싱업체의 고객 데이터베이스 관리의 신뢰성 정도를 반드시 점검해야 한다.,"아웃소싱업체의 상담원의 자질이 어떠한지를 평가하여야 하며, 편차가 심할 경우 업체 선정을 고려해야 한다.","규모가 큰 아웃소싱업체를 선정하는 것이 가장 효율적이고, 콜생산성을 높일 수 있다.",Marketing,0.0
콜센터 조직구성의 원칙과 거리가 먼 것은?,3,콜센터 조직의 구성원은 가능한 한 한 가지 특수한 전문화된 업무만을 담당할 때 효율성과 생산성이 더욱 향상될 수 있다.,상담원은 라인에 따라 한 사람의 상사로부터 명령이나 지시를 받아야 업무지침의 혼란과 조직관리의 혼선을 방지할 수 있다.,콜센터에서 리더는 누구에게나 리더십을 발휘하여 모든 상담원을 지휘·감독할 수 있어야 한다.,콜센터 내 조직원들에게 보다 명확한 업무분장과 수행에 따른 적정한 권한의 부여가 이루어져야 한다.,Marketing,0.0
텔레마케터에게 요구되는 자질이 아닌 것은?,3,기업의 이미지 향상을 위해 최선을 다한다.,회사의 업무와 상품 내용을 숙지한다.,전화통화의 내용을 가능한 간략하게 기록한다.,고객과 우호적인 관계를 갖는다.,Marketing,0.0
텔레마케팅의 정의와 거리가 먼 것은?,3,쌍방향으로 이루어지는 공감적인 커뮤니케이션 기법이다.,다양한 고객접점채널을 융합하는 새로운 커뮤니케이션 기법이다.,"Product, Price, Place, Promotion의 수단을 활용하는 첨단 비즈니스이다.",CRM 속성과 고객심리적 속성을 복합적으로 활용하는 마케팅 기법이다.,Marketing,0.0
