question,answer,A,B,C,D,Category,Human Accuracy
텔레마케팅에 대한 설명으로 틀린 것은?,1,텔레마케팅은 테스트마케팅이 필요치 않다.,텔레마케팅은 비용 효율적이다.,텔레마케팅은 쌍방향 커뮤니케이션이다.,텔레마케팅은 효과측정이 용이하다.,Marketing,1.0
개방형 설문지의 특성과 가장 거리가 먼 것은?,3,명확한 응답을 구할 수 있다.,소규모 조사에 많이 활용된다.,오류 발생 소지가 적다.,예비조사나 탐색적인 조사 등을 위해 흔히 쓰인다.,Marketing,0.0
“본 제품을 처음으로 사용하게 된 계기는 무엇입니까?”라는 식으로 응답자가 질문에 대해 자신의 의견을 제약 없이 표현할 수 있도록 해주는 질문형태는?,1,자유응답형 질문,다지선다형 질문,양자택일형 질문,집단토의형 질문,Marketing,1.0
CLT(Central Location Test)조사에 대한 설명으로 맞는 것은?,1,일정한 장소에 소비자들을 모은 후 새로운 마케팅 믹스에 대한 개별 소비자의 반응을 조사하는 방법,소비자들에게 실제로 가정에서 상품을 사용토록 한 후 이에 대한 반응을 조사하는 방법,기존제품이나 신제품에 대한 소비자들의 의식을 심층조사하는 방법,상품 기획 아이디어에 대한 검토 및 스크리닝 방법,Marketing,0.8332999999999999
조사보고서 작성시 유의해야 할 사항과 거리가 먼 것은?,1,조사시행과 분석과정에서 시장 환경변화를 반영하기 위해 처음에 설정한 조사문제와 조사목적을 벗어나도 된다.,관리자가 쉽게 이해하고 활용할 수 있도록 보고서는 작성되어야 한다.,시장조사에 따른 분석결과에 대한 진술과 설명은 객관적인 증거를 바탕으로 이루어져야 한다.,지나치게 확정적으로 전략대안을 제시하는 것은 회피하여야 한다.,Marketing,1.0
텔레마케팅 운영방법 중 일반적으로 자체운영방식이 대행운영방식보다 더 비효율적인 경우는?,3,"고객 정보, DB의 외부유출방지가 요구될 경우",텔레마케팅 교육 및 경험이 축적되어 있을 경우,짧은 기간 집중적으로 고객과 통화해야 하는 경우,새로운 고객이나 시장에 기술적인 상품을 아웃바운딩해야 하는 경우,Marketing,0.0
OJT(On the Job Training) 교육단계로 맞는 것은?,1,학습준비 → 업무설명 → 업무실행 → 결과확인,업무실행 → 학습준비 → 업무설명 → 결과확인,업무실행 → 결과확인 → 업무설명 → 학습준비,업무실행 → 업무설명 → 학습준비 → 결과확인,Marketing,1.0
아웃바운드 텔레마케팅의 성과지표로 적합하지 않은 것은?,3,총 통화시간,평균 판매가치,평균포기 콜,판매건당 비용,Marketing,0.0
콜센터 성과측정 중 고객 접근가능성 여부를 측정하는 지표로 가장 거리가 먼 것은?,4,Service Level,Response Rate,Average Speed of Answer,First-call Resolution,Marketing,0.0
기업과 고객의 만남과 상호작용을 통한 고객변화의 단계에 관한 설명으로 틀린 것은?,3,"예상고객 단계 - 개인적 접촉, 우편, 텔레마케팅 등을 통해 첫 거래를 성사시킬 수 있는 상태이다.",고객 단계 - 금전적 인센티브 등에 의해 재구매 동기를 갖게 된다.,단골 단계 - 제품 또는 서비스에 불만이 생겨도 동일한 점포나 동일한 브랜드를 이용하는 성향을 보인다.,기업의 옹호자 단계 - 좋은 구전을 전파함으로써 간접적인 광고역할을 하며 고객을 끌어오기도 한다.,Marketing,0.0
성공적인 CRM을 위한 전략으로 틀린 것은?,1,고객 점유율보다는 시장 점유율에 비중을 둔다.,고객획득보다는 고객유지에 중점을 둔다.,상품판매보다는 고객관계에 중점을 둔다.,단기적인 안목보다는 장기적인 관점에서 접근해야 한다.,Marketing,0.8332999999999999
고객의 행동유형에 따른 효과적인 응대요령으로 가장 적합한 것은?,1,추진형 - 요점만을 제시하고 결정은 본인 스스로 내리게 한다.,온화형 - 자료를 제시하고 애매한 일반화는 피한다.,"표현형 - 반박을 하지 않도록 주의하고, 편안하고 친근감 있게 대한다.",분석형 - 관심을 갖는 시간이 짧기 때문에 흥미를 잃지 않도록 유의해야 한다.,Marketing,1.0
고객이 기업과 만나는 모든 장면에서‘결정적인 순간’을 의미하는 용어는?,1,MOT,RFM,LTV,FAB,Marketing,1.0
소비자 상담의 촉진관계를 위해 필요한 상담자의 바람직한 태도 및 행동 특징이 아닌 것은?,4,공감적 이해,일관적 성실,수용적 존중,일반적 능력,Marketing,0.0
판매 후 서비스(After Service)는 어느 제품수준에 속하는가?,1,확장제품,서비스제품,유형제품,핵심제품,Marketing,0.875
독립이나 신규 사업을 생각하고 있을 때 오픈데이터 수집만으로도 분석 가능한 것은?,1,성장분야·업계와 시장규모,특정기업의 소속업계 구조,특정기업의 경영내용,특정상권의 입지조사,Marketing,1.0
조사대상이 표본으로 추출될 확률이 알려져 있지 않아 인위적인 표본추출을 해야 하는 경우 시간과 비용의 절감 효과는 있으나 표본 오차의 추정이 불가능한 표본추출법은?,1,비확률표본추출법,확률표본추출법,층화표본추출,군집표본추출,Marketing,0.75
우편조사의 단점으로 거리가 먼 것은?,2,질문에 대한 답변 회수율이 저조하다.,상세한 보기나 내용을 관찰하기 어렵다.,조사자의 통제나 조정이 불가능하다.,사전조사 대상자가 극히 한정적이다.,Marketing,0.0
표본추출과정이나 표본크기와 무관하게 발생하는 표본프레임오류는 불완전한 표본프레임을 변형시켜 줄일 수 있는데 전화조사에서 전화번호에 고정된 정수를 포함하여 표본으로 선택하는 방법은?,2,Random-Digit Dialing,Plus-One Dialing,Voice Activated Dialing,Dialing Complete Rate,Marketing,0.0
모집단으로부터 이를 대표할 수 있는 부분을 선택하는 과정을 무엇이라고 하는가?,2,가설의 설정,표본추출,설문지조사,실험조사,Marketing,0.8
콜센터 리더가 갖추어야 할 주요 자질로 가장 거리가 먼 것은?,3,경험적 리더십,평가진단 및 조직 재설계능력,고객에게 친밀한 목소리,학습적 리더십,Marketing,0.75
모니터링을 효과적으로 실행하는 방법으로 잘못된 것은?,2,모니터링의 평가기준을 텔레마케터가 충분히 숙지할 수 있도록 한다.,모니터링의 평가기준은 텔레마케터의 수준이 우선 고려되어야 한다.,모니터링 평가결과에 따른 개별코칭이 필요하다.,모니터링 평가기준은 정기적으로 수정·보완해야 한다.,Marketing,0.0
텔레마케팅에 관한 설명으로 틀린 것은?,2,텔레마케팅은 짧은 시간에 많은 고객을 만날 수 있다.,텔레마케팅은 다이렉트 메일보다 비용이 적게 들며 고객의 반응도는 5~10배 정도 더 많이 얻을 수 있다.,제품 구입 후 반송률은 다이렉트 메일보다 텔레마케팅이 더 높다.,텔레마케팅의 성공과 실패를 좌우하는 데 고객 리스트는 중요한 요인이다.,Marketing,0.0
콜센터의 역할로 거리가 먼 것은?,4,고객접점 센터이다.,고객중심 마케팅을 전개한다.,"전화, 우편, 이메일 등 다양한 매체중심의 마케팅을 전개한다.",충성고객만을 위한 서비스만 제공한다.,Marketing,0.75
CRM의 성공요인을 조직 측면과 시스템 측면으로 구분할 때 조직 측면의 성공요인이 아닌 것은?,4,최고경영자의 관심과 지원,고객 및 정보 지향적 기업문화,전문 인력 확보,데이터 통합수준,Marketing,0.0
마케팅 커뮤니케이션의 분류에 속하지 않는 것은?,3,광고 커뮤니케이션,대인판매 커뮤니케이션,선전 커뮤니케이션,판매촉진 커뮤니케이션,Marketing,0.0
고객이 기업과 만나는 모든 장면에서 결정적인 순간을 의미하며 텔레마케팅이나 CRM에 널리 쓰이는 개념은?,1,MOT,CSP,LTV,CTI,Marketing,1.0
경청(Listening)에 대한 설명으로 적절하지 않은 것은?,1,경청은 수동적이며 인지적인 과정이다.,"경청의 과정은 언어적 측면, 음성적 측면 모두에 집중하는 것이다.",경청이 어려운 이유 중 하나로 집중력의 부족이 있다.,심리적 잡음은 경청의 방해요소가 된다.,Marketing,1.0
아웃바운드 텔레마케팅의 성공요소가 아닌 것은?,1,부정확한 대상고객의 선정,고객의 니즈에 맞는 전용상품,판매이후의 신뢰성 확보와 사후관리,잘 정리되고 업그레이드된 데이터베이스,Marketing,0.7273000000000001
제품/시장 확장 그리드(Product/Market Expansion Grid)에 관한 설명으로 틀린 것은?,2,시장개발(Market Development)은 시장을 개발하여 기존제품을 판매하는 것이다.,시장침투(Market penetration)는 기존제품을 변경하여 기존고객에게 더 많이 판매하는 것이다.,"제품개발(Product development)은 기존시장을 대상으로 수정된, 혹은 새로운 제품을 제공하는 것이다.",다각화(Diversification)는 기존제품과 기존시장 밖에서 새로운 사업을 시작하거나 매입하는 것이다.,Marketing,0.0
조사 진행 과정 중 사전조사의 결과 활용으로 가장 적합한 것은?,4,발생할 가능성이 있는 문제점이 확인되었으면 본 조사를 진행해도 좋다.,문제점이 나타나면 현 단계에서 문제점을 수정하고 본 조사를 진행하면 된다.,문제점이 확인되면 앞의 단계로 돌아가 수정 후 본 조사를 진행하면 된다.,문제점이 나타나면 앞의 단계로 돌아가 수정 후 다시 사전조사의 과정을 반복한다.,Marketing,0.0
측정한 자료의 적합성을 검증하는 두 가지 주요한 기준으로 옳은 것은?,1,타당성과 신뢰성,효율성과 효과성,타당성과 효율성,효과성과 신뢰성,Marketing,1.0
설문지작성을 위한 응답의 형태 중 응답의 항목들은 상호 배타적이고 모든 응답을 포괄할 수 있는 조건을 만족시키는 응답형태는?,2,자유응답형,다지선다형,양자택일형,문장완성형,Marketing,0.0
서스톤 척도(Theuston Scale)에 관한 설명으로 틀린 것은?,2,처음 문장을 분류하는 평가자들의 성격에 따라 분포가 달라질 수 있다.,절차가 다른 척도보다 단순하고 문장이나 평가자의 수가 적어도 된다.,척도용으로 선정된 문장들이 평균값은 같으나 분산도가 다를 수 있다.,응답자의 점수가 같더라도 그가 선택하는 문항의 종류와 내용이 다를 수 있다.,Marketing,0.0
소비자욕구를 파악하기 위해 고객조사를 할 때 폐쇄형 질문이 적절한 경우는?,3,문제의 원인이나 배경에 대해 새로운 정보를 얻어야 할 경우에 사용한다.,편견 없이 가능한 한 다양하고 많은 정보를 모아야 할 경우에 사용한다.,여러 대안 중 소비자의 최종결정사항을 확인하고자 할 경우에 사용한다.,소비자들의 보편적인 사고방식에 대한 기존 정보가 없을 경우에 사용한다.,Marketing,0.0
대한민국에 거주하는 외국인을 대상으로 한 달에 지출되는 교육비에 대한 기초자료를 수집할 때 다양한 국적을 가진 사람과 비용 측면을 고려한다면 어떠한 조사방법이 가장 적합한가?,1,우편조사,면접조사,방문조사,관찰조사,Marketing,1.0
설문지를 구조적 설문지와 비구조적 설문지로 분류하는 기준으로 옳은 것은?,3,적용방법,피조사자의 이름을 밝히는 여부,질문구성형식,질문방법,Marketing,0.0
측정의 신뢰성을 높이는 방법에 대한 설명으로 틀린 것은?,1,측정항목의 수를 줄인다.,측정항목의 모호성을 제거한다.,중요한 질문의 경우 동일하거나 유사한 질문을 2회 이상 한다.,조사대상자가 잘 모르거나 전혀 관심이 없는 내용은 측정 하지 않는다.,Marketing,1.0
표집오차와 표본의 크기에 관한 설명으로 틀린 것은?,4,일반적으로 표본의 크기가 클수록 표집오차는 작아진다.,일반적으로 표본의 분산이 작을수록 표집오차는 작아진다.,층화표집에서는 표본의 크기가 같다고 했을 때 단순무작위표집에서보다 표집오차가 작아진다.,집락표집은 표본의 크기가 같을 때 단순무작위표집에서보다 표집오차가 작아진다.,Marketing,0.0
기존의 콜센터와 웹 콜센터의 차이점을 올바르게 설명한 것은?,1,기존의 콜센터는 PSTN(공중망)을 통하여 고객과 접촉하나 웹 콜센터는 IP를 통하여 고객과 접촉한다.,기존 콜센터에 비해 웹 콜센터는 고객 불만을 효과적으로 해결할 수 있다.,웹 콜센터는 기존 콜센터에 비해 비용측면에서 매우 효율적이다.,기존의 콜센터는 웹 콜센터에 비해 기업의 마케팅 활동을 효과적으로 수행할 수 있다.,Marketing,1.0
모니터링의 목적과 가장 거리가 먼 것은?,4,상담원의 통화품질 평가,상담원의 스킬 향상,"고객 만족과 로열티, 수익성 향상을 위한 관리수단",상담원의 실적 관리 및 통제수단,Marketing,0.0
개인 혹은 집단의 조직변화에 대한 거부적 행위를 변화에 대한 저항(Resistance to change) 이라고 하는데 이 변수에 속하지 않는 것은?,2,근무의욕 감퇴,정시 출퇴근,조직 내 불신,갈등,Marketing,0.0
달성 가능성이 높은 목표를 세우기 위해 SMART기법을 사용한다. ‘SMART’ 용어에 대한 표기가 잘못된 것은?,1,S - Special,M - Measurable,A - Achievable,T - Timely,Marketing,0.8
교육을 받고 현장에 복귀 후 교육의 효과를 측정하는 평가방법은?,4,사전평가,중간평가,반응평가,적용평가,Marketing,0.0
우수한 리더의 특성으로 옳지 않은 것은?,1,솔직하고 즉각적인 감정표현,상호역할에 대한 이해,팀원 행동에 대한 이해,성과에 대한 공정한 평가,Marketing,1.0
금융기관에서 수행하는 고객등급화는 목적과 용도에 따라서 구분할 수 있다. 고객에 관한 신상정보와 연계된 거래활동을 분석하고 평가하여 이를 점수로 산정하고 등급을 부여하는 것은?,1,행동평점,신청평점,요인평점,가중평점,Marketing,0.8
텔레마케팅의 정의에 관한 설명으로 틀린 것은?,4,통신수단을 활용한 마케팅이다.,고객밀착형의 쌍방향 커뮤니케이션이다.,다이렉트마케팅 중 가장 효과적인 매체이다.,대중매체를 통하여 정보를 보내는 것이다.,Marketing,0.0
"고객의 응대사항 및 통화내용, 응대결과 등을 정확히 기록 유지하는 일종의 통화기록노트라고 하는 것은?",2,스크립트,데이터 시트,질의와 응답서,컴퓨터와 텔레마케팅의 도구 및 장비,Marketing,0.0
고객관계발전의 단계 중 ‘관계탐색단계’에 해당하는 것은?,2,고객과 종업원의 충성도가 형성되는 단계이다.,시험적으로 잠재적인 교환의 상대를 찾는 단계이다.,종업원이 고객을 인식하거나 고객이 종업원을 적당한 교환상대로 인식한다.,관계의 각 당사자가 상대방의 역할 수행과 그 결과에 만족하여 기존의 관계가 확대되고 거래가 발전하는 단계이다.,Marketing,0.0
기업이 고객과 직 ㆍ 간접적으로 접촉하는 모든 채널과 방법들을 유기적으로 연관시키는 CRM의 형태는?,2,기능적 CRM,고객접점 통합 CRM,전략적 CRM,운영적 CRM,Marketing,0.0
CRM(Customer Relationship Management)에 대한 설명으로 틀린 것은?,4,"CRM은 고객과의 관계 관리에 기반하는 고객 중심적, 고객 지향적 경영방식이다.",CRM은 고객의 생에 전체에 걸친 장기적이고 지속적인 이윤을 추구하는 동적인 경영방식이다.,CRM은 고객 관계 관리를 위해 사용되는 고객 데이터 분석 등에 정보기술을 효율적으로 활용한다.,CRM은 고객과의 직접적인 접촉을 통해 한 방향 커뮤니케이션을 지속함으로써 고객과의 관계를 강화시킨다.,Marketing,0.0
CRM에서 마케팅 성과측정 지표인 고객점유율에 관한 설명으로 거리가 가장 먼 것은?,4,고객관리를 통하여 이루어지 기업제품의 구입 빈도를 의미한다.,한 고객의 구입금액이 기업의 매출에서 차지하는 비율을 말하는 범위중심의 척도이다.,고객 속의 집중도로서 의미가 있다.,시장점유율과 동일한 의미이다.,Marketing,0.0
고객 문의에 대한 해결방법으로 가장 적합한 것은?,3,고객보다는 회사의 입장과 나를 먼저 생각한다.,시간을 끌어 고객이 포기하도록 한다.,정확한 고객요구를 먼저 파악한다.,사내 규정만을 고객에게 정확하게 전달한다.,Marketing,0.0
우유부단한 고객에 대한 상담기술을 설명하는 것으로 적합하지 않은 것은?,1,적극적으로 고객의 말을 들어주는 시간만을 가지는 것이 중요하다.,개방형 질문을 통하여 그들이 원하는 것이 무엇인지 적절히 표현할 수 있도록 도와준다.,적절한 아이디어를 제공해 줌으로써 고객이 의사결정 하는 데 도움을 준다.,"의사결정을 강화시킬 수 있는 다른 대안들을 설명해 주고, 적절한 보상기준도 설명하여 문제해결에 대한 신뢰를 가지도록 해준다.",Marketing,1.0
아웃바운드 텔레마케팅의 업무영역 중 고객니즈의 자극영역은?,1,판매촉진,벤치마킹,시장조사,상담창구,Marketing,1.0
코틀러 교수의 3단계 제품수준에 해당하지 않는 것은?,2,핵심제품,명품제품,유형제품,포괄제품,Marketing,0.7646999999999999
전화조사 질문 Script의 기본적인 구성에 있어 바람직하지 않은 것은?,1,전화조사 대상자의 나이 및 가족구성,전화조사의 대상,전화조사의 목적,전화조사 주체의 소속,Marketing,1.0
표본의 크기를 결정하는데 고려해야 하는 요소 중 적절하지 않은 것은?,1,비표집 오차,모집단 요소의 동질성,조사의 목적,모집단의 크기,Marketing,0.7778
"A회사 콜센터는 직접 고객을 상담하는 상담팀,교육을 담당하는 교육팀, 모니터링을 담당하는 QA팀, 각종 통계관리를 담당하는 운영지원팀, 그리고 시스템 관리를 담당하는 시스템 관리팀으로 구분되어 있다. 이와 같이 담당하는 업무의 성격에 따라 팀이 구분되는 조직을 무엇이라고 하는가?",1,기능별 조직,피라미드 조직,라인별 조직,매트릭스 조직,Marketing,0.8332999999999999
평균처리시간이 길어질 경우 생산성 관리를 위한 조치로 적합하지 않은 것은?,1,모든 상담을 ARS로만 처리한다.,근무 집중도가 떨어지는 이유가 있는지를 확인한다.,스크립트가 불충분하거나 부정확한지 확인한다.,적정인력의 투입 여부를 확인한다.,Marketing,0.8332999999999999
"회원가입,캠페인,이벤트 등을 실시할 때 사전에 보내진 메일을 수신한 고객에게 전화고지를 해서 개봉 촉진 또는 반응 효과를 향상시키기 위해 실시하는 것은?",1,pre-call,clod call,pay-per-call,handled call,Marketing,0.8332999999999999
아웃바운드 텔레마케팅에 대한 설명으로 부적절한 것은?,1,스크립트에 의존하는 경향이 매우 낮다.,"신문, 잡지, TV, DM 등을 복합적으로 활용하면 효과적이다.","텔레마케터의 대화진행 기술, 언어선택에 따라 판매율이 좌우된다.",고정고객관리에 효과적이다.,Marketing,0.8332999999999999
텔레마케터의 통화품질 평가 시 고려사항이 아닌 것은?,1,텔레마케터의 통화품질을 평가할 때는 인바운드와 아웃바운드를 구분하지 않고 텔레마케터의 개인적 품성 중심으로 평가한다.,"인바운드 업무와 아웃바운드 업무를 중심으로 평가목적, 평가방법, 평가 체크포인트를 달리 해야 한다.","인바운드 텔레마케팅에서는 텔레마케터의 인성, 전화받는 태도, 음성, 발성의 진지함과 정밀성, 인내력 정도를 중심으로 평가한다.","아웃바운드에서는 진취적 성격, 제품 또는 서비스에 대한 전문지식의 전달, 고객설득능력, 상황대응능력을 평가 한다.",Marketing,1.0
CRM의 등장배경이 된 마케팅역할의 변화 현상 중 틀린 것은?,1,규모의 경제 지향,다중채널 지향,고객점유율 지향,일대일 지향,Marketing,0.8332999999999999
성공적인 인바운드 상담을 위한 기술에 관한 설명으로 옳은 것은?,1,고객의 언어적 표현뿐 아니라 억양과 속도를 고려하여 고객의 요구를 잘 파악하도록 한다.,상담을 할 때 고객에 대한 신뢰감을 높이기 위해 전문적인 용어로 고객을 설득한다.,고객과 직접 만나는 상황이 아니란 점을 크게 인식할 필요가 없다.,고객과 친밀감을 조성해야 하므로 간결한 말투를 사용하는 것은 피한다.,Marketing,1.0
고객 상담 처리 기술에 대한 설명으로 옳지 않은 것은?,1,고객에 대한 다양한 정보를 얻기 위해서는 폐쇄형 질문을 한다.,고객이 말하기를 시작하면 경청하도록 한다.,고객에게 상품의 특징과 이점에 대해 설명한다.,고객의 반론에 대해서는 먼저 공감하는 자세를 취한다.,Marketing,1.0
제품 또는 서비스의 가격 결정시 상대적인 고가전략이 적합한 경우는?,4,시장수요의 가격탄력성이 높을 때,원가우위를 확보하고 있어 경쟁기업이 자사 상품의 가격만큼 낮추기 힘들 때,시장에 경쟁자의 수가 많을 것으로 예상될 때,진입장벽이 높아 경쟁기업의 진입이 어려울 때,Marketing,0.8
"가격 결정에 영향을 미치는 요인을 내적 요인과 외적 요인으로 구분할 때, 내적 요인이 아닌 것은?",4,마케팅목표,마케팅믹스 전략,원 가,시장과 수요,Marketing,0.75
상표전략 중 계열확장(Line Extension)에 관한 설명으로 옳은 것은,1,"기존의 상표명을 기존의 제품범주의 새로운 형태, 크기, 맛 등에 확대한다.",기존의 상표명을 새로운 제품범주로 확대한다.,새로운 상표명을 동일한 제품범주에 도입한다.,신제품 범주에 새로운 상표명을 부여한다.,Marketing,1.0
아웃바운드 텔레마케팅의 특성으로 옳은 것은?,1,인바운드 판매보다 고도의 마케팅기법이 요구된다.,인바운드 판매보다 텔레마케터의 자질에 큰 영향을 받지 않는다.,인바운드 판매보다 성과에 대한 부담이 적다.,인바운드 판매보다 판매경험에 큰 영향을 받지 않는다.,Marketing,1.0
서비스의 특성 중 이질성을 해소하기 위한 방안으로 가장 적합한 것은?,1,맞춤 서비스를 제공한다.,다 지역 입지를 활용한다.,유형적 단서를 이용한다.,개인 정보원천을 활용한다.,Marketing,0.7778
BCG(Boston Consulting Group)매트릭스에 관한 설명으로 틀린 것은?,1,현금젖소(Cash Cow)는 투자를 확대하여 별(Star)의 범주로 이동시키는 것이 바람직하다.,개(Dog)는 부진제품을 폐기하고 적극적으로 자금을 회수하는 전략을 취하는 것이 바람직하다.,물음표(Question Mark)에 속하는 사업단위들은 시장점유율을 높이기 위해 많은 자금투자를 필요로 한다.,"별(Star)에 속한 사업단위들은 높은 시장점유율로 인해 마진이 증대되기 때문에 연구개발, 새로운 시설투자를 위한 자금을 늘려야 한다.",Marketing,1.0
조사대상이 표본으로 추출될 확률이 알려져 있지 않아 인위적인 표본추출을 해야 하는경우 시간과 비용의 절감 효과는 있으나 표본오차의 추정이 불가능한 표본추출법은?,1,비확률표본추출법,확률표본추출법,층화표본추출,군집표본추출,Marketing,0.8332999999999999
개인의 사생활(Privacy)보호와 면접조사가 어려울 때 실시할 수 있는 조사방법으로 가장 적합한 것은?,1,조사원을 이용하여 질문지를 배포하고 우편으로 회수한다.,조사원을 이용하여 질문지를 배포하고 전화로 조사한다.,우편으로 질문지를 배포하고 전화로 조사한다.,조사대상자들을 한 자리에 모아 질문지를 배포하고 전화로 조사한다.,Marketing,0.8332999999999999
기업의 하부구조(판매원 등)가 CRM의 실패원인이 되는 이유로 가장 적합한 것은?,1,고객의 관점보다는 개인의 매출성과에 더 무게를 두기 때문이다.,CRM은 고객과의 관계형성에 더 신경을 쓰기 때문이다.,CRM은 판매를 목적으로 하지 않기 때문이다.,CRM은 마케팅 프로그램이라기보다는 광범위한 기업과정의 일환이기 때문이다.,Marketing,0.75
아웃바운드 텔레마케팅의 효과적인 전개를 위한 핵심적 요소와 가장 거리가 먼 것은?,3,명확한 대상고객의 데이터,유능한 텔레마케터,최신 인기상품의 준비,스크립트,Marketing,0.7692
