question,answer,A,B,C,D,Category,Human Accuracy
후버와 지아라타니(Hoover&Giar ratani)가 제시한 문제지역에 대한 설명으로 옳은 것은?,4,"침체 지역(developedregions inrecess ion)에서는 성장하는 산업이 늘어나 실업률이 낮으나, 인구의 역외이출이 심각하다.",과열성장 및 과잉 집중 지역(ex cessivegrowthandconcentration regions) 인지 아닌지를 결정하는 기준은 구체적인 수치로 제시되어 있다.,석탄이나 철 등 주요 자원을 기반으로 번성한 지역은 문제지역이 되지 않는다.,낙후지역(backw ardregions)은 자생적인 성장 과정으로 진입하지 못한 지역을 말한다.,Political Science and Sociology,0.0
도시 및 지역분석 방법에 대한 설명으로 옳지 않은 것은?,3,"입지계수법(locationquotientm ethod)은 지역경제를 구성하는 산업의 지역특화도를 측정하는 것으로, 특정 산업이 지역에서 차지하는 비율과 해당 산업이 전국에서 차지하는 비율을 비교함으로써 측정된다.",투입산출모형(input-outputmodel)은 산업간 연관관계의 흐름에 대한 정보를 기반으로 경제적 파급효과 분석 및 지역경제에 미치는 영향을 분석하는 데 주로 이용된다.,"경제기반 모형(economicbasemodel)에서 기반산업이란 지역 내에서 생산된 재화와 서비스가 지역 외부로 수출되지 않고, 지역 주민들에 의해 전적으로 소비되는 산업을 말한다.",변이할 당 분석(shift-sh areanalysis)은 지역경제 성장의 횡적인 차원과 종적인 차원을 동시에 관찰할 수 있는 간결하고 이해하기 쉬운 지역경제 분석 모형이다.,Political Science and Sociology,0.0
사회적 자본에 대한 설명으로 옳지 않은 것은?,2,사회적 자본은 금융자본이나 물적 자본과 함께 생산과정의 필수 요소로 인식되고 있다.,개인 간의 상호작용과 네트워크 및 결사체 속에 배태된 사회적 자본으로 인한 이익은 개인에게 귀속된다.,사회적 자본과 지역발전의 관계는 일방적인 관계가 아니라 상호 영향을 주고받는 쌍방향의 순환적 관계이다.,"사회의 능률성을 제고시킬 수 있는 신뢰, 규범 및 네트워크와 같은 사회조직의 특징을 사회적 자본이라 한다.",Political Science and Sociology,0.0
지속가능한 개발(sustainabledevelopm ent)에 대한 설명으로 옳지 않은 것은?,4,단순한 소득 증가뿐만이 아닌 삶의 질의 향상까지 포함하는 포괄적인 개념이다.,현 세대의 개발행위는 세대 간의 형평성을 고려해야 한다.,개발을 통한 자연자원의 소비비율은 환경이 감당할 수 있고 지탱할 수 있는 범위 내에서 이루어져야 한다.,사전 예방보다는 사후처리가 장기적인 차원에서는 훨씬 효과적 이다.,Political Science and Sociology,0.0
프리드만(Friedmann)이 지역정책을 국가의 경제발전 단계와 연계한 내용으로 옳지 않은 것은?,3,전 산업 단계(preindustrialstage)에서는 지역정책의 필요성이 크지 않다.,전이 단계(transitionalstage)에서는 지역정책의 중요성이 커진다.,산업단계(industrialstage)에서는 지역정책의 중요성이 배가된다.,후기 산업 단계(post-industrialstage)에서는 지역정책의 초점이 전환된다.,Political Science and Sociology,0.0
지역개발의 이념에 대한 설명으로 옳지 않은 것은?,1,"지역개발의 형평성은 수직적 형평성과 수평적 형평성으로 나뉘며, 수평적 형평성은 계층적 관계에서 차이를 고려한 형평성을 말한다.",지역 기반시설과 공공서비스의 공급 등 지역개발과제의 이행 과정에서 효율성이 매우 중요하다.,지역개발 전략 및 정책은 이해관계자들의 자발적 협력과 동참을 끌어낼 수 있도록 내용과 절차의 측면에서 민주적이어야 한다.,지역정책의 수요자인 지역주민의 관점에서 만족하느냐의 여부가 대응성의 개념이다.,Political Science and Sociology,0.0
국가균형발전특별법상 국가균형발전과 관련된 개념에 대한 설명으로 옳지 않은 것은?,4,국가균형발전이란 지역 간 발전의 기회균등을 촉진하고 지역의 자립적 발전역량을 증진함으로써 삶의 질을 향상하고 지속가능한 발전을 도모하여 전국이 개성 있게 골고루 잘사는 사회를 구현하는 것을 말한다.,"성장 촉진지역이란 생활환경이 열악하고 개발 수준이 현저하게 저조하여 해당 지역의 경제적 ․사회적 성장을 촉진하기 위하여 필요한 도로, 상수도 등의 지역사회 기반시설의 구축 등에 국가와 지방자치단체의 특별한 배려가 필요한 지역으로서 소득, 인구, 재정상태 등을 고려하여 대통령령으로 정하는 지역을 말한다.",광역협력권이란 지역의 경제발전과 성장잠재력 확충에 필요한 산업 및 교통 등의 협력사업 추진을 위하여 특별시․광역시 ․ 특별자치시 및 도․특별자치도가 상호 협의하여 설정한 권역을 말한다.,특수 상황 지역이란 지역 주민의 삶의 질 향상에 필요한 일자리 및 교육 ․문화․복지․ 주거․ 안전․환경 등의 생활기반을 확충하기 위하여 시․군 ․구가 인근 시․군 ․구와 협의하여 설정한 권역을 말한다.,Political Science and Sociology,0.0
도시재생 활성화 및 지원에 관한 특별법 시행령상 도시재생 활성화 지역 지정의 세부 기준이 아닌 것은?,2,최근 30년간 인구가 가장 많았던 시기와 비교하여 20퍼센트 이상 인구가 감소한 지역,생활사회간접자본의 수가 30퍼센트 이상 감소하여 삶의 질이 떨어지는 지역,최근 5년간 3년 이상 연속으로 총사 업체 수가 감소한 지역,전체 건축물 중 준공된 후 20년 이상 지난 건축물이 차지하는 비율이 50퍼센트 이상인 지역,Political Science and Sociology,0.0
지방자치법 상지방의회의 권한으로 옳지 않은 것은?,2,행정사무감사권,선결 처분권,특정 사안에 대한 조사권,외국 지방자치단체와의 교류협력에 관한 사항의 의결권,Political Science and Sociology,0.0
지방자치분권 및 지방행정체제 개편에 관한 특별법 에 규정된 사무배분 원칙으로 옳은 것은?,3,경합의 원칙,중복 배분의 원칙,종합성의 원칙,민간 참여 최소화의 원칙,Political Science and Sociology,0.0
라이트(Wright)의 정부 간 관계론에 대한 설명으로 옳지 않은 것은?,1,"내포권위 모형(Inclus iveA uth ority Model)에 의하면, 연방정부와 주정부 그리고 지방정부가 동시에 경쟁하거나 협력하는 관계를 맺으며, 그 과정에서 합의를 이루고 협력체계를 구축하기 위한 협상이 계속된다.","분리권위 모형(SeparatedA uth ority Model)에 의하면, 중앙정부와 주정부가 독자적인 사무영역과 처리 권능을 지니고 있으며, 상호 협력을 할 필요도, 상호의존을 할 이유도 없다.","중첩권위 모형(OverlappingA uth ority Model)에 의하면, 연방 정부와 주정부 그리고 지방정부가 모두 제한된 권한을 갖고 있으며, 한 정부가 배타적인 권한을 행사하는 영역은 상대적으로 많지 않다.","분리권위 모형(SeparatedA uth ority Model)에 의하면, 연방정부와 주정부는 대등한 관계를, 주정부와 지방정부는 포함 관계를 유지한다.",Political Science and Sociology,0.0
A광역지방자치단체의 의회는 환경부 소관의 폐기물관리정책과 관련하여 공익을 현저히 해치는 의결을 하였다.이에 대한 설명으로 옳지 않은 것은?,4,환경부 장관은 A광역지방자치단체의 장에게 재의를 요구하게 할 수 있다.,환경부 장관으로부터 재의 요구를 받은 A광역지방자치단체의 장은 지방의회에 이유를 붙여 재의를 요구하여야 한다.,A광역지방자치단체장의 재의 요구에 대하여 지방의회에서 재적의원 과반수의 출석과 출석 의원 3분의 2 이상의 찬성으로 전과 같은 의결을 하면 그의 결사항은 확정된다.,A광역지방자치단체의 장은 지방의회에서 재의결된 사항이 공익을 현저히 해친다고 판단되면 재의결된 날부터 20일 이내에 대법원에 소를 제기할 수 있다.,Political Science and Sociology,0.0
A지방자치단체는 공유수면 관리 및 매립에 관한 법률 에 따라 관내 해안지역의 해수면 매립을 완료하였다.이에 대한 설명으로 옳은 것은?,1,매립지가 속할 지방자치단체는 행정안전부 장관이 결정한다.,관내 해안지역을 매립한 것이므로 매립지는 당연히 A지방자치 단체에 속하게 되지만 몇 가지 행정적 절차를 거치게 된다.,A지방자치단체의 장은 지방자치단체 중앙분쟁조정위원회의 결정에 이의가 있으면 그 결과를 통보받은 날부터 30일 이내에 대법원에 소송을 제기할 수 있다.,"매립공사를 시작하기 이전에 행정안전부 장관에게 신고하였다면, 매립된 지역은 A지방자치단체에 속하게 된다.",Political Science and Sociology,0.0
지방자치단체의 계층에 대한 설명으로 옳지 않은 것은?,4,우리나라의 자치계층은 2계층제를 기조로 하지만 일부 지역에서는 단층제를 채택하고 있다.,우리나라에서 자치계층을 포함한 행정계층은 2～4개의 계층으로 이루어져 있다.,광역시의 경우는 ‘광역시 －자치구 ․군’의 자치2 계층제를 채택하고 있다.,1949년 지방자치법 제정 이후 제주특별자치도가 출범하기 전까지는 모든 시․도가 지속적으로 자치2 계층제를 유지하고 있었다.,Political Science and Sociology,0.0
지방의회 선거에 대한 설명으로 옳은 것은?,3,1991년 이후 전국 광역지방의회 의원정수의 총합은 지속적으로 증가하였다.,기초지방의회 의원 선거구의 획정은 행정구역이 아니라 인구 규모를 반영한다.,2006년 기초지방의회 선거 때부터 정당공천이 허용됨과 동시에 비례대표제와 중선거구제가 도입되었다.,기초지방의회의 지역구별 의원 정수는 총원 증가를 억제하기 위해 조례가 아닌 공직선거법 에서 규정한다.,Political Science and Sociology,0.0
지방자치법상 지방의회의 의결 정족수에 대한 설명으로 옳지 않은 것은?,4,지방자치단체 사무소의 소재지를 변경하기 위한 조례는 그 지방의회의 재적의원 과반수의 찬성을 받아야 한다.,지방의회 의원의 제명에는 재적의원 3분의 2 이상의 찬성이 있어야 한다.,지방의회 의원에 대한 자격상실의 결은 재적의원 3분의 2 이상의 찬성이 있어야 한다.,지방자치법 에 특별히 규정된 경우 외에는 재적의원 과반수의 찬성이 있어야 한다.,Political Science and Sociology,0.0
지방세기본법상 지방세의 부과에 대한 설명으로 옳은 것은?,3,경기도 안성시 주민인 최모씨가 오늘 아침에 구입한 담배에 부과 된 담배소비세는 경기도에 납부될 것이다.,사업자등록을 하고 승마투표권을 판매한 강원도 강릉시 주민 이모씨에게 부과된 레저세는 강릉시에 납부될 것이다.,충청남도 태안군 주민인 강모씨가 오늘 취득한 양식업권에 부과된 등록면허세는 충청남도에 납부될 것이다.,자동차를 소유하고 있는 충청북도 제천시 주민인 오모씨에게 부과된 자동차세는 충청북도에 납부될 것이다.,Political Science and Sociology,0.0
지방공무원제도의 운영에 대한 설명으로 옳지 않은 것은?,2,"임용권자는, 전직 시험에서 3회 이상 불합격한 사람으로서 직무 수행 능력이 부족하다고 인정될 때에는, 그 사람을 직권면직 할 수 있다.",지방자치단체는 해당 지방자치단체의 지방공무원직류를 신설할 수 없다.,"공무원의 징계, 그 밖에 그의사에 반하는 불리한 처분이나 부작위에 대한 소청을 심사․ 결정하기 위하여 시․도에 임용권자별로 지방 소청심사위원회 및 교육소청심사위원회를 둔다.","임용권자는 소속 공무원에 대한 능력개발 등을 위하여 해당 공무원의 상급 또는 상위 공무원, 동료, 하급 또는 하위 공무원 및 민원인 등에 의한다면 평가를 실시할 수 있다.",Political Science and Sociology,0.0
지방자치의 역사에 대한 설명으로 옳은 것은?,2,1949년 지방자치법 이제정되면서 시와 군자치제가 규정되었다.,지방자치단체의 장이 지방의회에 의해 불신임될 수 있는 규정이 존재하기도 하였다.,제2공화국은 의원내각 제 정부 형태였으므로 지방자치단체의 기관 구성 형태도 기관 통합형을 취하였다.,지방자치에 관한 임시조치법 이 시행되면서 지방의회는 구성되지 않았지만 주민직선의 단체장은 선출되었다.,Political Science and Sociology,0.0
중앙통제에 대한 설명으로 옳지 않은 것은?,1,지방자치단체의 장이외채를 발행하는 경우에는 지방채 발행 한도액 범위더라도 지방의회의 의결을 거쳐 행정안전부 장관의 승인을 받아야 한다.,"자치사무에 관한 시․도지사의 명령이나 처분이 법령에 위반 된다고 인정되면 주무부 장관이 기간을 정하여 서면으로 시정할 것을 명하고, 그 기간에 이행하지 아니하면 이를 취소하거나 정지할 수 있다.","지방자치단체의 장은 재정 책임성 강화를 위하여 재정위험 수준, 재정 상황 및 채무규모 등을 고려하여 대통령령으로 정하는 범위를 초과하는 지방채를 발행하는 경우에는 행정안전부 장관의 승인을 받은 후 지방의회의 의결을 받아야 한다.",행정안전부 장관 또는 긴급재정관리인은 긴급재정관리단체의 긴급재정관리계획의 이행 상황을 점검하거나 보고 또는 자료 제출을 요구할 수 있다.,Political Science and Sociology,0.0
공공외교법 에 대한 설명으로 옳지 않은 것은?,4,공공외교는 인류의 보편적 가치와 대한민국 고유의 특성을 조화롭게 반영하여 추진되어야 한다.,공공외교 정책은 국제사회와 의 지속가능한 우호협력 증진에 중점을 두어야 한다.,공공외교법 의 목적은 국제사회에서 대한민국의 국가 이미지 및 위상 제고에 이바지하는 것이다.,공공외교 활동은 국가이익에 부합하는 지역과 국가를 대상으로 한다.,Political Science and Sociology,0.0
현실주의 이론의 가정으로 옳지 않은 것은?,3,국가는 국제관계에 있어서 가장 중요한 행위자이다.,국가는 국제사회의 무정부 상태라는 특성으로 인해 권력과 안보를 추구하게 된다.,국가는 다양한 이해관계를 가진 조직과 개인 혹은 집단의 합이다.,국가는 냉철한 손익계산을 통해 이익의 극대화를 시도하는 행위자이다.,Political Science and Sociology,0.0
권력자원으로서의 국제문화에 대한 설명으로 옳지 않은 것은?,3,나이(Nye)는 소프트 파워를 군사적 강압이나 경제적 유인책을 사용하는 대신 다른 국가들이 자발적으로 자신의 의도와 의지를 따르도록 만드는 능력이라고 정의한다.,소프트파워 개념은 국제정치에서 한 행위자가 다른 행위자에게 문화적이고 규범적인 영향력을 행사함으로써 그들의 행위를 변화시킬 수 있다고 본다.,사이드(Said)는 오리엔탈리즘이 동양에 대한 서양의 편견과 선입견을 해소하는 역할을 한 것으로 평가하였다.,문화제국주의 이론은 권력자원으로서의 문화가 서구 사회의 비서구 사회에 대한 지배와 헤게모니의 도구로 활용될 수 있다고 비판한다.,Political Science and Sociology,0.0
동맹 이론 중 연루(entrapm ent)와 방기(abandonment)에 대한 설명으로 옳은 것은?,4,연루란 중립국이 중립을 유지하는 데 실패하고 전쟁에 휘말리는 상황을 의미한다.,연루의 위험과 방기의 위험은 비례하는 경향이 있다.,동맹의 중요성을 강하게 느끼지 않는 국가일수록 연루의 위험에 빠지기 쉽다.,동맹상대국에 대해 강한 지원의도를 가진 국가일수록 자국이 방기될 가능성을 줄일 수 있다.,Political Science and Sociology,0.0
국제정치 이론가 콕스(Cox)의 주장이 아닌 것은?,1,지식과 이론은 가치중립적이며 객관적이고 시간 초월적이다.,자본주의의 내재적 모순으로 인해 불가피하게 발생하는 경제 위기는 대항헤게모니(cou nter-hegem ony) 운동을 야기한다.,"패권국이 패권을 유지할 수 있는 것은 단순히 강제력의 결과가 아니라, 기존 질서에 의해 불이익을 받는 사람들에게서 그러한 질서에 대한 동의를 이끌어낼 수 있기 때문이다.",신현실 주의는 현존질서의 특징을 잘 반영하고 정당화하는 문제 해결 이론이다.,Political Science and Sociology,0.0
패권 안정론(hegem onicstabilitytheory)에 대한 설명으로 옳은 것은?,3,신자유주의와 구조주의 시각에서만 국제경제질서를 설명하는 이론이다.,두 국가가 팽팽한 세력 균형을 이룰 때 국제 경제질서 또한 안정성을 유지한다.,19세기 중반의 유럽 경제는 영국의 패권으로 인하여 안정을 유지하였다.,제2차 세계대전 후 패권의 부재는 20세기 중반 폐쇄적 경제 질서의 대두로 이어졌다.,Political Science and Sociology,0.0
1842년 난징 조약에 대한 설명으로 옳지 않은 것은?,3,청나라는 승전 국 영국에 홍콩을 영구할 양하였다.,"난징 조약 으로 청나라는 양쯔강이남의 다섯 항구인 상하이, 닝보, 푸저우, 샤먼, 광저우를 개항하였다.",영국 상인들은 난징 조약 에 명시된 개항장을 통해 면 산업의 생산과잉 문제를 해소하고 이익을 극대화할 수 있었다.,"난징 조약 이후 취약해진 청나라는 미국, 프랑스와도 각각 불평등 조약을 체결하였다.",Political Science and Sociology,0.0
중국의 대외정책에서 강조된 중요 원칙을 시기가 이른 것부터 바르게 나열한 것은?,4,(나)－(가)－(라)－(다),(나)－(다)－(라)－(가),(다)－(가)－(라)－(나),(다)－(라)－(나)－(가),Political Science and Sociology,0.0
일본의 외교안보 정책에 대한 설명으로 옳은 것은?,2,집단적 자위권은 다른 국가가 자국을 공격했을 때 이에 대해 독자적으로 반격할 수 있는 권리이다.,1946년 공포한 평화헌법 제9조는 일본의 군대 보유와 전쟁 개입을 금지하고 있다.,일본은 1970년대에 헌법 해석의 변경을 통하여 자국이 집단적 자위권을 행사할 수 있다는 공식 입장을 정했다.,오바마 대통령은 일본의 집단적 자위권 행사와 군사력 강화를 반대하였다.,Political Science and Sociology,0.0
미국의 외교정책에 대한 설명으로 옳지 않은 것은?,3,레이건 독트린은 군비 경쟁을 야기하여 소련 붕괴의 원인이 되었다.,닉슨 독트린은 아시아에서 핵에 의한 위협을 제외하면 아시아 제국 스스로 안보를 책임져야 한다는 내용을 담고 있다.,트럼프 행정부는 ‘아시아로의 회귀(PivottoAsia)’ 정책을 도입하여 중국 봉쇄정책을 추구하였다.,9.11 테러 발생 이후 부시 행정부의 아프가니스탄 개입은 탈레반 정권을 축출하는 결과를 가져왔다.,Political Science and Sociology,0.0
제1차 세계대전에 대한 설명으로 옳지 않은 것은?,4,19세기 후반 이래 유럽 동맹체제의 경직화가 주요한 개전 요인의 하나였다.,오스트리아 － 헝가리 제국의 민족문제가 주요한 개 전 요인의 하나였다.,제1차 세계대전 종전 후 윌슨의 이상주의에 의해 국제연맹이 수립되었다.,베르사유 조약에 의해서 오스만 제국이 해체되었다.,Political Science and Sociology,0.0
보호책임(Respons ibilitytoP rotect)에 대한 설명으로 옳지 않은 것은?,3,2001년 ‘개입과 국가주권에 관한 국제위원회’에 의해 마련된 보고서에 명시되었다.,자국민 보호의 일차적 책임은 그 해 당 국가에게 있다는 내용을 포함한다.,자연재해로 인한 인도적 위기에 적용한다.,"해당 국가가 자국민을 보호하지 못한 경우, 국제사회가 그 국민들을 보호할 책임이 있다는 내용을 담고 있다.",Political Science and Sociology,0.0
남북기본합의서에 명시된 내용으로 옳은 것은?,1,7․4 남북공동성명에서 천명한 조국통일 3대 원칙을 재확인한다.,합의서 발효 후 6개월 안에 판문점에 남북 연락사무소를 설치 ․ 운영한다.,남과 북은 의견 대립과 분쟁 문제를 유엔 헌장 에 따라 평화적으로 해결한다.,"남과 북은 국제무대에서 경제, 문화, 외교, 군사 등 여러 분야에서 서로 협력하고, 선의의 경쟁을 벌인다.",Political Science and Sociology,0.0
아시아 지역 영토분쟁에 대한 설명으로 옳지 않은 것은?,2,러시아 － 일본은 쿠릴열도/ 북방 4개 도서분쟁 해결의 실마리를 찾고자 다양한 접촉을 시도하였다.,남중국해 분쟁과 관련하여 UN안전보장이사회는 중국이 주권을 주장하는 경계선 인구단선에 국제법상의 근거가 없다고 발표했다.,일본은 센카쿠 열도/댜오위다오를 자국의 영토라고 주장하며 현재까지 실효적 지배를 하고 있다.,인도와 파키스탄은 카슈미르 지역을 둘러싸고 분쟁을 지속하고 있다.,Political Science and Sociology,0.0
토지시장에서 정부 개입 근거에 대한 설명으로 옳지 않은 것은?,1,토지개발에 따른 외부 효과가 존재하지 않기 때문에 토지이용의 시 장기제는 제대로 작동하지 않는다.,토지거래에 필요한 자료와 정보가 원하는 모든 사람에게 쉽게 전달되지 않기 때문에 토지시장에 대한 정보는 불완전하다.,토지개발에 따른 도로나 상하수도 등 공공설비의 설치는 규모의 경제를 수반하므로 토지이용에서 자원의 최적 배분이 시장기제에 의해 달성되기 어렵다.,"토지는 위치에 따라 다른 특성을 지닌 이질적 자원으로, 각 특성에 따라 이용 가능한 토지의 양이 한정되어 있다는 점에서 토지시장에서 토지 공급자가 독점적 영향력을 행사할 여지가 크다.",Political Science and Sociology,0.0
국토의 계획 및 이용에 관한 법률 상용 도구역에 해당하지 않는 것은?,3,시가 화 조정구역,개발제한구역,복합용도구역,입지규제 최소구역,Political Science and Sociology,0.0
수출 기반 이론에 대한 설명으로 옳지 않은 것은?,4,한 지역의 산업활동은 기반 부문과 비기반 부문으로 구성된다.,생산능력제약 및 다른 공급 측면의 특징을 고려하고 있지 않다는 문제점이 있다.,기반 부문을 파악하기 위해 입지상(LocationQuotient) 방법을 이용할 수 있다.,지역 간 생산요소의 이동을 성장 요인으로 파악한다.,Political Science and Sociology,0.0
지역 성장 이론 중 불균형 성장 이론이 아닌 것은?,3,극화발전이론,누적 성장 이론,자원 재배치 이론,중심 － 주변부 이론,Political Science and Sociology,0.0
지역 갈등에 대한 설명으로 옳지 않은 것은?,4,님비(NIMBY) 현상은 자기 지역에 불이익이 되는 조치나 정책 또는 시설이 입지하는 것을 회피하는 과정에서 발생하는 갈등이다.,"갈등관리 방안으로는 주민참여 확대, 공개행정, 정당한 보상의 제공, 협력체제 구축 등이 있다.",공공갈등은 공공기관이 법령을 제․개정하거나 각종 공공정책과 사업 계획을 수립하고 추진하는 과정에서 발생하는 갈등이다.,지역 갈등을 해소하기 위해 조정이나 중재와 같은 대체적 분쟁 해결 방식(AlternativeDisputeResolution)이 존재하지만 우리나라에는 제도화되어 있지 않다.,Political Science and Sociology,0.0
조직 목표의 기능에 대한 설명으로 옳지 않은 것은?,4,조직 구성원들이 목표로 인해 일체감을 느끼기 때문에 구성원들의 동기를 유발해준다.,조직의 구조와 과정을 설계하는 준거를 제공하고 성과를 평가하는 기준이 되기도 한다.,미래의 바람직한 상태를 밝혀 조직활동의 방향을 제시한다.,조직이 존재하는 정당성의 근거가 될 수는 없다.,Political Science and Sociology,0.0
결정과 기획 같은 핵심 기능만 수행하는 조직을 중심에 놓고 다수의 독립된 조직들을 협력관계로 묶어 일을 수행하는 조직 형태는?,3,태스크포스,프로젝트팀,네트워크 조직,매트릭스 조직,Political Science and Sociology,0.0
